"report.date","worksite","location","potential.exposure.dates","start","end","standard.report.date"
"12-01","Walker Hall","Davis campus","11/29/2021","2021-11-29","2021-11-29","2021-12-01"
"12-01","Hart Hall","Davis campus","11/29/2021","2021-11-29","2021-11-29","2021-12-01"
"12-01","Yosemite Hall","Davis campus","11/30/2021","2021-11-30","2021-11-30","2021-12-01"
"12-01","Olson Hall","Davis campus","11/30/2021","2021-11-30","2021-11-30","2021-12-01"
"12-01","Sciences Lab Building","Davis campus","11/30/2021","2021-11-30","2021-11-30","2021-12-01"
"12-01","Rock Hall","Davis campus","12/01/2021","2021-12-01","2021-12-01","2021-12-01"
"12-01","Wellman Hall","Davis campus","11/29/2021
 - 11/30/2021","2021-11-29","2021-11-30","2021-12-01"
"12-01","Cuarto Dining Commons","Davis campus","11/30/2021","2021-11-30","2021-11-30","2021-12-01"
"12-01","Vet Med Teaching Hospital","Davis campus","12/01/2021","2021-12-01","2021-12-01","2021-12-01"
"12-02","Mondavi Center","Davis campus","11/26/2021","2021-11-26","2021-11-26","2021-12-02"
"12-02","Shields Library","Davis campus","11/28/2021","2021-11-28","2021-11-28","2021-12-02"
"12-02","Young Hall","Davis campus","11/30/2021
 - 12/01/2021","2021-11-30","2021-12-01","2021-12-02"
"12-02","Mondavi Center","Davis campus","11/29/2021","2021-11-29","2021-11-29","2021-12-02"
"12-02","Segundo Dining Commons","Davis campus","11/30/2021","2021-11-30","2021-11-30","2021-12-02"
"12-02","Wellman Hall","Davis campus","11/30/2021","2021-11-30","2021-11-30","2021-12-02"
"12-02","Kleiber Hall","Davis campus","11/30/2021","2021-11-30","2021-11-30","2021-12-02"
"12-02","The Grove - Academic Surge 3","Davis campus","12/02/2021","2021-12-02","2021-12-02","2021-12-02"
"12-03","Mondavi Center","Davis campus","11/29/2021","2021-11-29","2021-11-29","2021-12-03"
"12-03","Hunt Hall","Davis campus","11/30/2021","2021-11-30","2021-11-30","2021-12-03"
"12-03","Vet Med 3A","Davis campus","11/30/2021","2021-11-30","2021-11-30","2021-12-03"
"12-03","Wellman Hall","Davis campus","11/30/2021","2021-11-30","2021-11-30","2021-12-03"
"12-03","Mondavi Center","Davis campus","11/24/2021","2021-11-24","2021-11-24","2021-12-03"
"12-03","Kleiber Hall","Davis campus","11/25/2021","2021-11-25","2021-11-25","2021-12-03"
"12-03","Hunt Hall","Davis campus","12/02/2021","2021-12-02","2021-12-02","2021-12-03"
"12-03","Academic Surge","Davis campus","11/30/2021","2021-11-30","2021-11-30","2021-12-03"
"12-03","Segundo Dining Commons","Davis campus","11/29/2021
 - 12/01/2021","2021-11-29","2021-12-01","2021-12-03"
"12-03","Mondavi Center","Davis campus","11/26/2021","2021-11-26","2021-11-26","2021-12-03"
"12-03","Kleiber Hall","Davis campus","11/30/2021","2021-11-30","2021-11-30","2021-12-03"
"12-03","Bainer Hall","Davis campus","11/30/2021","2021-11-30","2021-11-30","2021-12-03"
"12-03","Shields Library","Davis campus","11/28/2021
 - 11/29/2021","2021-11-28","2021-11-29","2021-12-03"
"12-03","Malcom Hall","Davis campus","11/30/2021","2021-11-30","2021-11-30","2021-12-03"
"12-06","Hunt Hall","Davis campus","12/03/2021","2021-12-03","2021-12-03","2021-12-06"
"12-06","Shields Library","Davis campus","11/30/2021","2021-11-30","2021-11-30","2021-12-06"
"12-06","Olson Hall","Davis campus","12/01/2021","2021-12-01","2021-12-01","2021-12-06"
"12-06","Young Hall","Davis campus","11/30/2021","2021-11-30","2021-11-30","2021-12-06"
"12-06","Social Sciences Lecture Hall","Davis campus","12/03/2021","2021-12-03","2021-12-03","2021-12-06"
"12-06","Rock Hall","Davis campus","11/29/2021","2021-11-29","2021-11-29","2021-12-06"
"12-06","International Center","Davis campus","12/02/2021","2021-12-02","2021-12-02","2021-12-06"
"12-06","Hunt Hall","Davis campus","11/29/2021","2021-11-29","2021-11-29","2021-12-06"
"12-06","The Grove - Academic Surge 3","Davis campus","11/30/2021","2021-11-30","2021-11-30","2021-12-06"
"12-06","Wellman Hall","Davis campus","11/30/2021","2021-11-30","2021-11-30","2021-12-06"
"12-06","Hutchison Hall","Davis campus","12/01/2021","2021-12-01","2021-12-01","2021-12-06"
"12-06","Social Sciences Lecture Hall","Davis campus","11/29/2021","2021-11-29","2021-11-29","2021-12-06"
"12-06","Rock Hall","Davis campus","12/01/2021","2021-12-01","2021-12-01","2021-12-06"
"12-06","Hunt Hall","Davis campus","12/01/2021","2021-12-01","2021-12-01","2021-12-06"
"12-06","Wellman Hall","Davis campus","11/29/2021
 - 12/03/2021","2021-11-29","2021-12-03","2021-12-06"
"12-06","Hutchison Hall","Davis campus","12/03/2021","2021-12-03","2021-12-03","2021-12-06"
"12-06","Social Sciences Lecture Hall","Davis campus","12/01/2021","2021-12-01","2021-12-01","2021-12-06"
"12-06","Hart Hall","Davis campus","11/29/2021","2021-11-29","2021-11-29","2021-12-06"
"12-06","Rock Hall","Davis campus","12/03/2021","2021-12-03","2021-12-03","2021-12-06"
"12-07","Olson Hall","Davis campus","12/02/2021
 - 12/03/2021","2021-12-02","2021-12-03","2021-12-07"
"12-08","UC Davis Health Stadium","Davis campus","12/07/2021","2021-12-07","2021-12-07","2021-12-08"
"12-09","Ghausi Hall","Davis campus","12/08/2021","2021-12-08","2021-12-08","2021-12-09"
"12-09","Veihmeyer Hall","Davis campus","12/08/2021","2021-12-08","2021-12-08","2021-12-09"
"12-09","Wellman Hall","Davis campus","12/08/2021","2021-12-08","2021-12-08","2021-12-09"
"12-09","Center for Companion Animal Health","Davis campus","12/09/2021","2021-12-09","2021-12-09","2021-12-09"
"12-09","Olson Hall","Davis campus","12/08/2021","2021-12-08","2021-12-08","2021-12-09"
"12-09","Student Community Center","Davis campus","12/08/2021","2021-12-08","2021-12-08","2021-12-09"
"12-09","Green Hall","Davis campus","11/29/2021
 - 11/30/2021","2021-11-29","2021-11-30","2021-12-09"
"12-09","Walker Hall","Davis campus","12/08/2021","2021-12-08","2021-12-08","2021-12-09"
"12-09","Shields Library","Davis campus","12/08/2021","2021-12-08","2021-12-08","2021-12-09"
"12-09","Wellman Hall","Davis campus","12/06/2021","2021-12-06","2021-12-06","2021-12-09"
"12-09","Center for Companion Animal Health","Davis campus","12/05/2021","2021-12-05","2021-12-05","2021-12-09"
"12-10","Voorhies Hall","Davis campus","12/09/2021","2021-12-09","2021-12-09","2021-12-10"
"01-04","The Green; 2231 Jade St.","Davis Campus","12-29
 - 12-31","2020-12-29","2020-12-31","2021-01-04"
"01-05","Alder Hall","Davis Campus","01-01
 - 01-04","2021-01-01","2021-01-04","2021-01-05"
"01-05","Coffee House","Davis Campus","01-01
 - 01-04","2021-01-01","2021-01-04","2021-01-05"
"01-05","Miller Hall","Davis Campus","01-01
 - 01-04","2021-01-01","2021-01-04","2021-01-05"
"01-05","Briggs Hall","Davis Campus","12-31
 - 01-04","2020-12-31","2021-01-04","2021-01-05"
"01-05","Comparative Pathology Lab","Davis Campus","12-25
 - 12-29","2020-12-25","2020-12-29","2021-01-05"
"01-05","Thompson Hall","Davis Campus","01-01
 - 01-04","2021-01-01","2021-01-04","2021-01-05"
"01-05","Tupper Hall","Davis Campus","12-29
 - 12-30","2020-12-29","2020-12-30","2021-01-05"
"01-05","Center for Equine Health","Davis Campus","12-26
 - 12-28","2020-12-26","2020-12-28","2021-01-05"
"01-05","Comparative Pathology Lab","Davis Campus","12-29
 - 01-02","2020-12-29","2021-01-02","2021-01-05"
"01-05","Thurman Lab","Davis Campus","12-26
 - 12-30","2020-12-26","2020-12-30","2021-01-05"
"01-05","Vet Med 3A","Davis Campus","12-25
 - 12-29","2020-12-25","2020-12-29","2021-01-05"
"01-05","Tupper Hall","Davis campus","01-01
 - 01-03","2021-01-01","2021-01-03","2021-01-05"
"01-05","Vet Med 3B","Davis campus","12-25
 - 12-29","2020-12-25","2020-12-29","2021-01-05"
"01-06","Mann Lab","Davis Campus","01-02
 - 01-04","2021-01-02","2021-01-04","2021-01-06"
"01-06","Memorial Union","Davis Campus","01-02
 - 01-04","2021-01-02","2021-01-04","2021-01-06"
"01-06","Laben Hall","Davis Campus","01-02
 - 01-05","2021-01-02","2021-01-05","2021-01-06"
"01-06","Building Maintenance Services","Davis Campus","12-29
 - 12-31","2020-12-29","2020-12-31","2021-01-06"
"01-06","Tupper Hall","Davis Campus","01-02
 - 01-04","2021-01-02","2021-01-04","2021-01-06"
"01-06","Potter Hall","Davis Campus","01-04
 - 01-06","2021-01-04","2021-01-06","2021-01-06"
"01-06","Vet Med Admin Center","Davis Campus","01-01
 - 01-05","2021-01-01","2021-01-05","2021-01-06"
"01-07","Shields Library","Davis Campus","01-02
 - 01-04","2021-01-02","2021-01-04","2021-01-07"
"01-07","Dutton Hall","Davis Campus","01-04
 - 01-06","2021-01-04","2021-01-06","2021-01-07"
"01-07","Police Building","Davis Campus","01-03
 - 01-05","2021-01-03","2021-01-05","2021-01-07"
"01-07","Laben Hall","Davis Campus","12-31
 - 01-02","2020-12-31","2021-01-02","2021-01-07"
"01-07","Segundo Market","Davis Campus","01-01
 - 01-05","2021-01-01","2021-01-05","2021-01-07"
"01-07","Center for Equine Health","Davis Campus","01-03
 - 01-05","2021-01-03","2021-01-05","2021-01-07"
"01-08","Segundo Market","Davis campus","01-04
 - 01-06","2021-01-04","2021-01-06","2021-01-08"
"01-08","Activities & Recreation Center","Davis campus","01-04
 - 01-06","2021-01-04","2021-01-06","2021-01-08"
"01-08","Genome & Biomedical Sciences Facility","Davis campus","01-04
 - 01-06","2021-01-04","2021-01-06","2021-01-08"
"01-08","Tercero Redwood","Davis campus","01-03
 - 01-05","2021-01-03","2021-01-05","2021-01-08"
"01-11","Currant Hall","Davis campus","01-03
 - 01-08","2021-01-03","2021-01-08","2021-01-11"
"01-11","Activities & Recreation Center","Davis campus","01-04
 - 01-06","2021-01-04","2021-01-06","2021-01-11"
"01-11","Campbell Hall","Davis campus","01-09
 - 01-11","2021-01-09","2021-01-11","2021-01-11"
"01-11","Genome & Biomedical Sciences Facility","Davis campus","01-03
 - 01-05","2021-01-03","2021-01-05","2021-01-11"
"01-11","Briggs Hall","Davis campus","01-04
 - 01-06","2021-01-04","2021-01-06","2021-01-11"
"01-11","Cole Facility","Davis campus","01-05
 - 01-07","2021-01-05","2021-01-07","2021-01-11"
"01-11","Segundo Dining Commons","Davis campus","01-05
 - 01-09","2021-01-05","2021-01-09","2021-01-11"
"01-11","Tercero Dining Commons","Davis campus","01-07
 - 01-11","2021-01-07","2021-01-11","2021-01-11"
"01-11","Segundo Dining Commons","Davis campus","01-07
 - 01-09","2021-01-07","2021-01-09","2021-01-11"
"01-11","Wall Hall","Davis campus","01-01
 - 01-06","2021-01-01","2021-01-06","2021-01-11"
"01-11","Gilmore Hall","Davis campus","01-07
 - 01-09","2021-01-07","2021-01-09","2021-01-11"
"01-11","Mondavi","Davis campus","01-06
 - 01-08","2021-01-06","2021-01-08","2021-01-11"
"01-11","Memorial Union","Davis campus","01-07
 - 01-09","2021-01-07","2021-01-09","2021-01-11"
"01-11","Segundo Services Center","Davis campus","01-07
 - 01-09","2021-01-07","2021-01-09","2021-01-11"
"01-11","Campbell Hall","Davis campus","01-02
 - 01-09","2021-01-02","2021-01-09","2021-01-11"
"01-11","Mahogany Hall","Davis campus","01-03
 - 01-08","2021-01-03","2021-01-08","2021-01-11"
"01-11","Animal Resource Service V","Davis campus","01-04
 - 01-08","2021-01-04","2021-01-08","2021-01-11"
"01-11","Malcolm Hall","Davis campus","01-05
 - 01-07","2021-01-05","2021-01-07","2021-01-11"
"01-11","Potter Hall","Davis campus","01-07
 - 01-11","2021-01-07","2021-01-11","2021-01-11"
"01-11","Meyer Hall","Davis campus","01-05
 - 01-07","2021-01-05","2021-01-07","2021-01-11"
"01-12","Malcolm Hall","Davis campus","01-07
 - 01-10","2021-01-07","2021-01-10","2021-01-12"
"01-12","Memorial Union","Davis campus","01-07
 - 01-09","2021-01-07","2021-01-09","2021-01-12"
"01-12","San Bernardino Lab","Off campus","01-05
 - 01-07","2021-01-05","2021-01-07","2021-01-12"
"01-12","Ryerson Hall","Davis campus","01-07
 - 01-10","2021-01-07","2021-01-10","2021-01-12"
"01-12","UC Davis Health Stadium","Davis campus","01-08
 - 01-10","2021-01-08","2021-01-10","2021-01-12"
"01-12","Tulare Lab","Off campus","01-03
 - 01-05","2021-01-03","2021-01-05","2021-01-12"
"01-12","Wall Hall","Davis campus","01-06
 - 01-09","2021-01-06","2021-01-09","2021-01-12"
"01-12","Gilmore Hall","Davis campus","01-07
 - 01-11","2021-01-07","2021-01-11","2021-01-12"
"01-12","Thompson Hall","Davis campus","01-04
 - 01-07","2021-01-04","2021-01-07","2021-01-12"
"01-13","Mondavi","Davis campus","01-07
 - 01-09","2021-01-07","2021-01-09","2021-01-13"
"01-13","Howard Field","Davis campus","01-09
 - 01-10","2021-01-09","2021-01-10","2021-01-13"
"01-13","Gilmore Hall","Davis campus","01-09
 - 01-12","2021-01-09","2021-01-12","2021-01-13"
"01-13","Equestrian Center","Davis campus","01-09
 - 01-12","2021-01-09","2021-01-12","2021-01-13"
"01-13","Segundo Market","Davis campus","01-09
 - 01-13","2021-01-09","2021-01-13","2021-01-13"
"01-13","Thurman Lab","Davis campus","01-08
 - 01-12","2021-01-08","2021-01-12","2021-01-13"
"01-13","Hickey Gym","Davis campus","01-09
 - 01-11","2021-01-09","2021-01-11","2021-01-13"
"01-13","Potter Hall","Davis campus","01-09
 - 01-12","2021-01-09","2021-01-12","2021-01-13"
"01-13","Gilmore Hall","Davis campus","01-09
 - 01-13","2021-01-09","2021-01-13","2021-01-13"
"01-13","Hickey Gym","Davis campus","01-09
 - 01-12","2021-01-09","2021-01-12","2021-01-13"
"01-13","Segundo Dining Commons","Davis campus","01-09
 - 01-13","2021-01-09","2021-01-13","2021-01-13"
"01-13","Toomey Field","Davis campus","01-10
 - 01-12","2021-01-10","2021-01-12","2021-01-13"
"01-13","Vet Med 3A","Davis campus","01-09
 - 01-10","2021-01-09","2021-01-10","2021-01-13"
"01-13","Toomey Field","Davis campus","01-09
 - 01-12","2021-01-09","2021-01-12","2021-01-13"
"01-14","Segundo Market","Davis campus","01-10
 - 01-12","2021-01-10","2021-01-12","2021-01-14"
"01-14","Gilmore Hall","Davis campus","01-07
 - 01-12","2021-01-07","2021-01-12","2021-01-14"
"01-14","Russell Ranch","Davis campus","01-09
 - 01-12","2021-01-09","2021-01-12","2021-01-14"
"01-14","Gilmore Hall","Davis campus","01-09
 - 01-13","2021-01-09","2021-01-13","2021-01-14"
"01-14","Segundo Market","Davis campus","01-09
 - 01-13","2021-01-09","2021-01-13","2021-01-14"
"01-14","Tercero Dining Commons","Davis campus","01-11
 - 01-12","2021-01-11","2021-01-12","2021-01-14"
"01-14","Segundo Dining Commons","Davis campus","01-07
 - 01-12","2021-01-07","2021-01-12","2021-01-14"
"01-14","Segundo Dining Commons","Davis campus","01-09
 - 01-12","2021-01-09","2021-01-12","2021-01-14"
"01-14","Miller Hall","Davis campus","01-09
 - 01-13","2021-01-09","2021-01-13","2021-01-14"
"01-14","Wall Hall","Davis campus","01-09
 - 01-13","2021-01-09","2021-01-13","2021-01-14"
"01-14","School of Education Building","Davis campus","01-02
 - 01-05","2021-01-02","2021-01-05","2021-01-14"
"01-14","Dobbins Baseball Complex","Davis campus","01-09
 - 01-11","2021-01-09","2021-01-11","2021-01-14"
"01-14","Wastewater Treatment Plant","Davis campus","01-09
 - 01-12","2021-01-09","2021-01-12","2021-01-14"
"01-14","Segundo Dining Commons","Davis campus","01-09
 - 01-13","2021-01-09","2021-01-13","2021-01-14"
"01-14","Marya Welch Tennis Center","Davis campus","01-10
 - 01-12","2021-01-10","2021-01-12","2021-01-14"
"01-15","Environmental Horticulture","Davis campus","01-11
 - 01-14","2021-01-11","2021-01-14","2021-01-15"
"01-15","Scrub Oak Hall","Davis campus","01-09
 - 01-13","2021-01-09","2021-01-13","2021-01-15"
"01-15","Redwood Hall","Davis campus","01-11
 - 01-14","2021-01-11","2021-01-14","2021-01-15"
"01-15","Building Maintenance Services","Davis campus","01-11
 - 01-14","2021-01-11","2021-01-14","2021-01-15"
"01-15","Segundo Dining Commons","Davis campus","01-09
 - 01-13","2021-01-09","2021-01-13","2021-01-15"
"01-15","University Extension Building","Davis campus","01-10
 - 01-12","2021-01-10","2021-01-12","2021-01-15"
"01-15","The Green (West Village)","Davis campus","01-11
 - 01-14","2021-01-11","2021-01-14","2021-01-15"
"01-15","The Green (West Village)","Davis campus","01-07
 - 01-14","2021-01-07","2021-01-14","2021-01-15"
"01-15","Mayra Welch Tennis Center","Davis campus","01-10
 - 01-14","2021-01-10","2021-01-14","2021-01-15"
"01-19","Vegetable Crops Headquarters","Davis campus","01-12
 - 01-14","2021-01-12","2021-01-14","2021-01-19"
"01-19","Genome & Biomedical Sciences Facility","Davis campus","01-14
 - 01-15","2021-01-14","2021-01-15","2021-01-19"
"01-19","Tercero Market","Davis campus","01-14
 - 01-18","2021-01-14","2021-01-18","2021-01-19"
"01-19","Segundo Services Center","Davis campus","01-15
 - 01-18","2021-01-15","2021-01-18","2021-01-19"
"01-19","The Green - 187 Mint St","Davis campus","01-18
 - 01-19","2021-01-18","2021-01-19","2021-01-19"
"01-19","Toomey Weight Room","Davis campus","01-11
 - 01-12","2021-01-11","2021-01-12","2021-01-19"
"01-19","Tercero Dining","Davis campus","01-11
 - 01-13","2021-01-11","2021-01-13","2021-01-19"
"01-19","Police","Davis campus","01-12
 - 01-14","2021-01-12","2021-01-14","2021-01-19"
"01-19","Rec Pool","Davis campus","01-10
 - 01-14","2021-01-10","2021-01-14","2021-01-19"
"01-19","UC Davis Health Stadium","Davis campus","01-11
 - 01-12","2021-01-11","2021-01-12","2021-01-19"
"01-19","Memorial Union","Davis campus","01-12
 - 01-14","2021-01-12","2021-01-14","2021-01-19"
"01-19","Memorial Union","Davis campus","01-12
 - 01-15","2021-01-12","2021-01-15","2021-01-19"
"01-19","Potter Hall","Davis campus","01-14
 - 01-18","2021-01-14","2021-01-18","2021-01-19"
"01-19","Gilmore Hall","Davis campus","01-15
 - 01-18","2021-01-15","2021-01-18","2021-01-19"
"01-19","The Green - 2231 Jade St","Davis campus","01-18
 - 01-19","2021-01-18","2021-01-19","2021-01-19"
"01-19","Toomey Weight Room","Davis campus","01-09
 - 01-12","2021-01-09","2021-01-12","2021-01-19"
"01-19","Memorial Union","Davis campus","01-10
 - 01-15","2021-01-10","2021-01-15","2021-01-19"
"01-19","Vet Med 3B","Davis campus","01-11
 - 01-13","2021-01-11","2021-01-13","2021-01-19"
"01-19","Hickey Gym","Davis campus","01-09
 - 01-12","2021-01-09","2021-01-12","2021-01-19"
"01-19","Segundo Dining Commons","Davis campus","01-15
 - 01-18","2021-01-15","2021-01-18","2021-01-19"
"01-20","Cowell Building","Davis campus","01-11
 - 01-13","2021-01-11","2021-01-13","2021-01-20"
"01-20","Tercero Market","Davis campus","01-16
 - 01-19","2021-01-16","2021-01-19","2021-01-20"
"01-20","Activities & Recreation Center","Davis campus","01-14
 - 01-18","2021-01-14","2021-01-18","2021-01-20"
"01-20","Segundo Dining Commons","Davis campus","01-14
 - 01-19","2021-01-14","2021-01-19","2021-01-20"
"01-20","Mahagony Hall","Davis campus","01-16
 - 01-19","2021-01-16","2021-01-19","2021-01-20"
"01-20","Gilmore Hall","Davis campus","01-17
 - 01-19","2021-01-17","2021-01-19","2021-01-20"
"01-20","Gilmore Hall","Davis campus","01-14
 - 01-19","2021-01-14","2021-01-19","2021-01-20"
"01-20","Segundo Market","Davis campus","01-14
 - 01-19","2021-01-14","2021-01-19","2021-01-20"
"01-20","Tercero Dining Commons","Davis campus","01-16
 - 01-19","2021-01-16","2021-01-19","2021-01-20"
"01-20","Walker Hall","Davis campus","01-17
 - 01-20","2021-01-17","2021-01-20","2021-01-20"
"01-20","Thurman Lab","Davis campus","01-12
 - 01-15","2021-01-12","2021-01-15","2021-01-20"
"01-20","Segundo Student Services","Davis campus","01-14
 - 01-19","2021-01-14","2021-01-19","2021-01-20"
"01-20","Rec Pool","Davis campus","01-16
 - 01-19","2021-01-16","2021-01-19","2021-01-20"
"01-21","Segundo Dining Commons","Davis campus","01-16
 - 01-19","2021-01-16","2021-01-19","2021-01-21"
"01-21","Currant Hall","Davis campus","01-17
 - 01-20","2021-01-17","2021-01-20","2021-01-21"
"01-21","The Green","Davis campus","01-09
 - 01-19","2021-01-09","2021-01-19","2021-01-21"
"01-21","Genome & Biomedical Sciences Facility","Davis campus","01-14
 - 01-15","2021-01-14","2021-01-15","2021-01-21"
"01-21","Segundo Market","Davis campus","01-16
 - 01-19","2021-01-16","2021-01-19","2021-01-21"
"01-21","Tercero Dining Commons","Davis campus","01-17
 - 01-20","2021-01-17","2021-01-20","2021-01-21"
"01-21","Gilmore Hall","Davis campus","01-16
 - 01-19","2021-01-16","2021-01-19","2021-01-21"
"01-21","Segundo Services Center","Davis campus","01-16
 - 01-19","2021-01-16","2021-01-19","2021-01-21"
"01-21","Tercero Market","Davis campus","01-17
 - 01-20","2021-01-17","2021-01-20","2021-01-21"
"01-22","Vet Med 3B","Davis campus","01-14
 - 01-21","2021-01-14","2021-01-21","2021-01-22"
"01-22","Animal Resources Service H-1","Davis campus","01-18
 - 01-21","2021-01-18","2021-01-21","2021-01-22"
"01-22","Gilmore Hall","Davis campus","01-17
 - 01-21","2021-01-17","2021-01-21","2021-01-22"
"01-22","Activities & Recreation Center","Davis campus","01-14
 - 01-15","2021-01-14","2021-01-15","2021-01-22"
"01-25","Cowell Building","Davis campus","01-20
 - 01-22","2021-01-20","2021-01-22","2021-01-25"
"01-25","Segundo Dining Commons","Davis campus","01-15
 - 01-16","2021-01-15","2021-01-16","2021-01-25"
"01-25","Ghausi Hall","Davis campus","01-19
 - 01-21","2021-01-19","2021-01-21","2021-01-25"
"01-25","Kemper Hall","Davis campus","01-19
 - 01-21","2021-01-19","2021-01-21","2021-01-25"
"01-25","Facilities Mechanical Operations","Davis campus","01-19
 - 01-21","2021-01-19","2021-01-21","2021-01-25"
"01-25","Activities & Recreation Center","Davis campus","01-19
 - 01-21","2021-01-19","2021-01-21","2021-01-25"
"01-25","Shields Library","Davis campus","01-20
 - 01-22","2021-01-20","2021-01-22","2021-01-25"
"01-25","Vet Med Admin Center","Davis campus","01-18
 - 01-20","2021-01-18","2021-01-20","2021-01-25"
"01-25","Environmental Services Facility Headquarters","Davis campus","01-19
 - 01-21","2021-01-19","2021-01-21","2021-01-25"
"01-25","San Bernardino Lab","Off campus","01-20
 - 01-21","2021-01-20","2021-01-21","2021-01-25"
"01-26","Outdoor Adventures","Davis campus","01-22
 - 01-25","2021-01-22","2021-01-25","2021-01-26"
"01-26","623 Putah Creek Lodge Drive","Davis campus","01-23
 - 01-25","2021-01-23","2021-01-25","2021-01-26"
"01-26","Animal Resources Service H-1","Davis campus","01-18
 - 01-21","2021-01-18","2021-01-21","2021-01-26"
"01-28","Unitrans Maintenance Facility","Davis campus","01-24
 - 01-26","2021-01-24","2021-01-26","2021-01-28"
"01-28","Ann E. Pitzer Center","Davis campus","01-24
 - 01-27","2021-01-24","2021-01-27","2021-01-28"
"01-28","Cottonwood Hall","Davis campus","01-24
 - 01-27","2021-01-24","2021-01-27","2021-01-28"
"01-28","Tercero Dining Commons","Davis campus","01-24
 - 01-27","2021-01-24","2021-01-27","2021-01-28"
"01-29","Downtown Store","Davis city","01-21
 - 01-25","2021-01-21","2021-01-25","2021-01-29"
"01-29","Aggie Surplus & Custodial Storage Facility","Davis campus","01-25
 - 01-28","2021-01-25","2021-01-28","2021-01-29"
"01-29","Memorial Union Unitrans Terminal","Davis campus","01-21
 - 01-25","2021-01-21","2021-01-25","2021-01-29"
"01-29","Chemistry","Davis campus","01-25
 - 01-27","2021-01-25","2021-01-27","2021-01-29"
"02-01","Primate Colony","Davis campus","01-26
 - 01-29","2021-01-26","2021-01-29","2021-02-01"
"02-01","187 Mint, The Green","Davis campus","01-26
 - 01-27","2021-01-26","2021-01-27","2021-02-01"
"02-01","Vet Med Teaching Hospital Small Animal Clinic","Davis campus","01-25
 - 01-29","2021-01-25","2021-01-29","2021-02-01"
"02-01","Meyer Hall","Davis campus","01-28
 - 01-30","2021-01-28","2021-01-30","2021-02-01"
"02-01","Student Health & Wellness Center","Davis campus","01-26
 - 01-28","2021-01-26","2021-01-28","2021-02-01"
"02-01","298 Horizon St., The Green","Davis campus","01-26
 - 01-27","2021-01-26","2021-01-27","2021-02-01"
"02-02","Emerson Hall","Davis campus","01-23
 - 01-25","2021-01-23","2021-01-25","2021-02-02"
"02-03","Toomey Field","Davis campus","01-28
 - 01-29","2021-01-28","2021-01-29","2021-02-03"
"02-03","Chemistry","Davis campus","02-01
 - 02-02","2021-02-01","2021-02-02","2021-02-03"
"02-03","Greenhouse #083","Davis campus","02-01
 - 02-02","2021-02-01","2021-02-02","2021-02-03"
"02-03","UC Davis Health Stadium","Davis campus","01-28
 - 01-29","2021-01-28","2021-01-29","2021-02-03"
"02-03","UC Davis Health Stadium","Davis campus","02-01
 - 02-02","2021-02-01","2021-02-02","2021-02-03"
"02-03","Segundo Dining Commons","Davis campus","01-28
 - 01-29","2021-01-28","2021-01-29","2021-02-03"
"02-03","623 Putah Creek Lodge Drive","Davis campus","02-01
 - 02-02","2021-02-01","2021-02-02","2021-02-03"
"02-03","Young Hall","Davis campus","02-01
 - 02-02","2021-02-01","2021-02-02","2021-02-03"
"02-04","Tercero Dining Commons","Davis campus","01-26
 - 01-28","2021-01-26","2021-01-28","2021-02-04"
"02-04","Shields Library","Davis campus","01-31
 - 02-02","2021-01-31","2021-02-02","2021-02-04"
"02-04","Swine Teaching and Research Facility","Davis campus","01-29
 - 01-30","2021-01-29","2021-01-30","2021-02-04"
"02-04","Madrone Hall","Davis campus","01-30
 - 02-02","2021-01-30","2021-02-02","2021-02-04"
"02-04","Segundo Dining Commons","Davis campus","01-31
 - 02-02","2021-01-31","2021-02-02","2021-02-04"
"02-04","Activities & Recreation Center","Davis campus","01-27
 - 02-02","2021-01-27","2021-02-02","2021-02-04"
"02-04","Tercero Dining Commons","Davis campus","01-30
 - 02-02","2021-01-30","2021-02-02","2021-02-04"
"02-08","359 North Sage St.,The Green","Davis campus","02-02
 - 02-04","2021-02-02","2021-02-04","2021-02-08"
"02-09","Activities & Recreation Center","Davis campus","02-06
 - 02-08","2021-02-06","2021-02-08","2021-02-09"
"02-09","Tupper Hall","Davis campus","01-28
 - 02-05","2021-01-28","2021-02-05","2021-02-09"
"02-09","1850 Research Park Dr","Davis city","02-06
 - 02-08","2021-02-06","2021-02-08","2021-02-09"
"02-09","Aggie Soccer Field","Davis campus","02-06
 - 02-08","2021-02-06","2021-02-08","2021-02-09"
"02-09","Toomey Weight Room Field","Davis campus","02-06
 - 02-08","2021-02-06","2021-02-08","2021-02-09"
"02-10","Dairy Barn","Davis campus","02-04
 - 02-06","2021-02-04","2021-02-06","2021-02-10"
"02-10","Aggie Surplus & Custodial","Davis campus","02-06
 - 02-09","2021-02-06","2021-02-09","2021-02-10"
"02-10","Central Cage Wash","Davis campus","02-06
 - 02-09","2021-02-06","2021-02-09","2021-02-10"
"02-10","Valley Hall","Davis campus","02-06
 - 02-09","2021-02-06","2021-02-09","2021-02-10"
"02-10","Center for Companion Animal Health","Davis campus","02-06
 - 02-09","2021-02-06","2021-02-09","2021-02-10"
"02-10","Wastewater Treatment Plant Administration Building","Davis campus","02-06
 - 02-08","2021-02-06","2021-02-08","2021-02-10"
"02-10","Gourley","Davis campus","02-06
 - 02-09","2021-02-06","2021-02-09","2021-02-10"
"02-10","Genome & Biomedical Sciences Facility","Davis campus","02-06
 - 02-09","2021-02-06","2021-02-09","2021-02-10"
"02-11","Shields Library","Davis campus","02-06
 - 02-08","2021-02-06","2021-02-08","2021-02-11"
"02-12","Life Sciences/Green Hall","Davis campus","02-08
 - 02-10","2021-02-08","2021-02-10","2021-02-12"
"02-16","The Green","Davis campus","02-12
 - 02-15","2021-02-12","2021-02-15","2021-02-16"
"02-16","Art Annex","Davis campus","02-10
 - 02-13","2021-02-10","2021-02-13","2021-02-16"
"02-16","Facilities Services","Davis campus","02-10
 - 02-13","2021-02-10","2021-02-13","2021-02-16"
"02-17","Jungerman Hall","Davis campus","02-08
 - 02-09","2021-02-08","2021-02-09","2021-02-17"
"02-17","Transportation and Parking Services","Davis campus","02-11
 - 02-12","2021-02-11","2021-02-12","2021-02-17"
"02-18","Sequoia Hall","Davis campus","02-14
 - 02-17","2021-02-14","2021-02-17","2021-02-18"
"02-18","Hawthorn Hall","Davis campus","02-08
 - 02-10","2021-02-08","2021-02-10","2021-02-18"
"02-18","Tercero Dining Commons","Davis campus","02-14
 - 02-17","2021-02-14","2021-02-17","2021-02-18"
"02-18","Mahogany Hall","Davis campus","02-08
 - 02-10","2021-02-08","2021-02-10","2021-02-18"
"02-18","Yosemite Hall","Davis campus","02-08
 - 02-10","2021-02-08","2021-02-10","2021-02-18"
"02-19","Pritchard VMTH","Davis campus","02-15
 - 02-18","2021-02-15","2021-02-18","2021-02-19"
"02-19","Center for Companion Animal Health","Davis campus","02-15
 - 02-18","2021-02-15","2021-02-18","2021-02-19"
"02-19","Vet Med 2","Davis campus","02-15
 - 02-18","2021-02-15","2021-02-18","2021-02-19"
"02-22","Advanced Transportation Infrastructure Research Ce","Davis campus","02-15
 - 02-18","2021-02-15","2021-02-18","2021-02-22"
"02-22","Life Sciences/Green Hall","Davis campus","02-16
 - 02-19","2021-02-16","2021-02-19","2021-02-22"
"02-22","Hutchison Hall","Davis campus","02-16
 - 02-19","2021-02-16","2021-02-19","2021-02-22"
"02-22","Storer Hall","Davis campus","02-16
 - 02-19","2021-02-16","2021-02-19","2021-02-22"
"02-23","Plant & Environmental Sciences","Davis campus","02-16
 - 02-18","2021-02-16","2021-02-18","2021-02-23"
"02-24","Tercero Dining Commons","Davis campus","02-08
 - 02-10","2021-02-08","2021-02-10","2021-02-24"
"02-25","UC Davis California National Primate Research Cen","Davis campus","02-20
 - 02-24","2021-02-20","2021-02-24","2021-02-25"
"02-25","Peter J. Shields Library","Davis campus","02-21
 - 02-22","2021-02-21","2021-02-22","2021-02-25"
"02-25","Tercero Madrone","Davis campus","02-21
 - 02-23","2021-02-21","2021-02-23","2021-02-25"
"02-26","Hickey Gym","Davis campus","02-23
 - 02-25","2021-02-23","2021-02-25","2021-02-26"
"03-01","UC Davis Health Stadium","Davis campus","02-26
 - 02-28","2021-02-26","2021-02-28","2021-03-01"
"03-01","Schaal Aquatic Center","Davis campus","02-26","2021-02-26","2021-02-26","2021-03-01"
"03-01","Segundo Gilmore","Davis campus","02-26
 - 02-28","2021-02-26","2021-02-28","2021-03-01"
"03-02","260 Cousteau Place","Davis city","02-19","2021-02-19","2021-02-19","2021-03-02"
"03-03","Segundo Gilmore","Davis campus","02-25
 - 03-01","2021-02-25","2021-03-01","2021-03-03"
"03-05","3213 Apiary drive","Davis campus","02-25
 - 02-26","2021-02-25","2021-02-26","2021-03-05"
"03-05","Surge II","Davis campus","02-25
 - 02-26","2021-02-25","2021-02-26","2021-03-05"
"03-08","Peter J. Shields Library","Davis campus","03-04
 - 03-06","2021-03-04","2021-03-06","2021-03-08"
"03-10","Wastewater Treatment Plant","Davis campus","03-04
 - 03-05","2021-03-04","2021-03-05","2021-03-10"
"03-11","Sciences Lecture Hall","Davis campus","03-08
 - 03-11","2021-03-08","2021-03-11","2021-03-11"
"03-12","Peter J. Shields Library","Davis campus","03-09
 - 03-12","2021-03-09","2021-03-12","2021-03-12"
"03-12","Memorial Union Bookstore","Davis campus","03-09
 - 03-12","2021-03-09","2021-03-12","2021-03-12"
"03-12","Tercero Dining Commons","Davis campus","03-09
 - 03-12","2021-03-09","2021-03-12","2021-03-12"
"03-12","Wall Hall","Davis campus","03-09
 - 03-12","2021-03-09","2021-03-12","2021-03-12"
"03-15","Latitude Dining Commons","Davis campus","03-11
 - 03-15","2021-03-11","2021-03-15","2021-03-15"
"03-15","Aggie Surplus & Custodial","Davis campus","03-11
 - 03-15","2021-03-11","2021-03-15","2021-03-15"
"03-15","Tercero Services Center","Davis campus","03-11
 - 03-15","2021-03-11","2021-03-15","2021-03-15"
"03-15","Tercero Dining Commons","Davis campus","03-11
 - 03-15","2021-03-11","2021-03-15","2021-03-15"
"03-15","Scrub Oak Hall","Davis campus","03-12
 - 03-15","2021-03-12","2021-03-15","2021-03-15"
"03-16","Tercero Dining Commons","Davis campus","03-13
 - 03-16","2021-03-13","2021-03-16","2021-03-16"
"03-16","Tercero Dining Commons","Davis campus","03-13
 - 03-15","2021-03-13","2021-03-15","2021-03-16"
"03-16","Tercero Services Center","Davis campus","03-13
 - 03-16","2021-03-13","2021-03-16","2021-03-16"
"03-16","Peter J. Shields Library","Davis campus","03-13
 - 03-15","2021-03-13","2021-03-15","2021-03-16"
"03-17","Currant Hall","Davis campus","03-15
 - 03-16","2021-03-15","2021-03-16","2021-03-17"
"03-17","Tercero Dining Commons","Davis campus","03-15
 - 03-16","2021-03-15","2021-03-16","2021-03-17"
"03-18","Potter Hall","Davis campus","03-15
 - 03-18","2021-03-15","2021-03-18","2021-03-18"
"03-18","Tercero Dining Commons","Davis campus","03-15
 - 03-18","2021-03-15","2021-03-18","2021-03-18"
"03-19","Peter J.Shields Library","Davis campus","03-10
 - 03-16","2021-03-10","2021-03-16","2021-03-19"
"03-19","Tercero Dining Commons","Davis campus","03-10
 - 03-16","2021-03-10","2021-03-16","2021-03-19"
"03-22","Segundo Dining commons","Davis campus","03-16
 - 03-18","2021-03-16","2021-03-18","2021-03-22"
"03-22","The Green","Davis campus","03-16
 - 03-19","2021-03-16","2021-03-19","2021-03-22"
"03-23","Hyatt Place","Davis campus","03-15","2021-03-15","2021-03-15","2021-03-23"
"03-24","Vet Med 3B","Davis campus","03-21
 - 03-23","2021-03-21","2021-03-23","2021-03-24"
"03-29","Bainer Hall","Davis campus","03-19","2021-03-19","2021-03-19","2021-03-29"
"03-29","Social Sciences and Humanities","Davis campus","03-25
 - 03-27","2021-03-25","2021-03-27","2021-03-29"
"03-29","Solano Park","Davis campus","03-19","2021-03-19","2021-03-19","2021-03-29"
"03-29","The Green","Davis campus","03-26
 - 03-29","2021-03-26","2021-03-29","2021-03-29"
"03-29","Atriums at La Rue Park","Davis campus","03-19","2021-03-19","2021-03-19","2021-03-29"
"03-30","Tercero Dining Commons","Davis campus","03-27
 - 03-30","2021-03-27","2021-03-30","2021-03-30"
"03-30","Campbell Hall","Davis campus","03-27
 - 03-30","2021-03-27","2021-03-30","2021-03-30"
"03-30","Tercero Services Center","Davis campus","03-27
 - 03-30","2021-03-27","2021-03-30","2021-03-30"
"03-31","Mondavi Center for the Performing Arts","Davis campus","03-27
 - 03-28","2021-03-27","2021-03-28","2021-03-31"
"04-01","Wickson Hall","Davis campus","03-29
 - 03-31","2021-03-29","2021-03-31","2021-04-01"
"04-01","UC Davis California National Primate Research","Davis campus","03-29
 - 03-31","2021-03-29","2021-03-31","2021-04-01"
"04-01","Sequoia Hall","Davis campus","03-27
 - 03-31","2021-03-27","2021-03-31","2021-04-01"
"04-01","Robbins Hall Annex","Davis campus","03-29
 - 03-31","2021-03-29","2021-03-31","2021-04-01"
"04-01","Tercero Dining Commons","Davis campus","03-27
 - 03-31","2021-03-27","2021-03-31","2021-04-01"
"04-01","Voorhies Hal","Davis campus","03-29
 - 03-31","2021-03-29","2021-03-31","2021-04-01"
"04-05","Aquatic Biology & Environmental Science building","Davis campus","03-31
 - 04-02","2021-03-31","2021-04-02","2021-04-05"
"04-06","Fire & Police Building","Davis campus","04-05","2021-04-05","2021-04-05","2021-04-06"
"04-07","Sproul Hall","Davis campus","04-03
 - 04-05","2021-04-03","2021-04-05","2021-04-07"
"04-08","Segundo Bixby","Davis campus","04-03
 - 04-07","2021-04-03","2021-04-07","2021-04-08"
"04-08","Scrub Oak Hall","Davis campus","04-04
 - 04-07","2021-04-04","2021-04-07","2021-04-08"
"04-08","Scrub Oak Hall","Davis campus","04-05
 - 04-07","2021-04-05","2021-04-07","2021-04-08"
"04-12","Pritchard VMTH","Davis campus","04-06
 - 04-07","2021-04-06","2021-04-07","2021-04-12"
"04-12","Segundo Dining Commons","Davis campus","04-08
 - 04-10","2021-04-08","2021-04-10","2021-04-12"
"04-12","Tercero Dining Commons","Davis campus","04-06
 - 04-07","2021-04-06","2021-04-07","2021-04-12"
"04-12","Police Building","Davis campus","04-07
 - 04-08","2021-04-07","2021-04-08","2021-04-12"
"04-12","Peter J. Shields Library","Davis campus","04-06","2021-04-06","2021-04-06","2021-04-12"
"04-12","Tercero Dining Commons","Davis campus","04-08
 - 04-10","2021-04-08","2021-04-10","2021-04-12"
"04-14","Briggs Hall","Davis campus","04-09","2021-04-09","2021-04-09","2021-04-14"
"04-14","Hutchinson Child Development Center","Davis campus","04-07
 - 04-14","2021-04-07","2021-04-14","2021-04-14"
"04-16","California National Primate Research Center","Davis campus","04-10","2021-04-10","2021-04-10","2021-04-16"
"04-19","Aggie Surplus & Custodial Building","Davis campus","04-14
 - 04-19","2021-04-14","2021-04-19","2021-04-19"
"04-19","Social Sciences and Humanities","Davis campus","04-14
 - 04-16","2021-04-14","2021-04-16","2021-04-19"
"04-20","Pritchard VMTH","Davis campus","04-15
 - 04-16","2021-04-15","2021-04-16","2021-04-20"
"05-28","Campbell Hall","Davis campus","05-21","2021-05-21","2021-05-21","2021-05-28"
"06-07","Vet Med 3A","Davis campus","06-07
 - 06-09","2021-06-07","2021-06-09","2021-06-07"
"07-06","Activities & Recreation Center","Davis campus","06-30
 - 07-01","2021-06-30","2021-07-01","2021-07-06"
"07-06","Toomey Weight Room","Davis campus","06-30
 - 07-02","2021-06-30","2021-07-02","2021-07-06"
"07-06","Asmundson Hall","Davis campus","06-30
 - 07-01","2021-06-30","2021-07-01","2021-07-06"
"07-09","King Hall","Davis campus","07-07","2021-07-07","2021-07-07","2021-07-09"
"07-13","VMTH B Barn","Davis campus","07-05
 - 07-06","2021-07-05","2021-07-06","2021-07-13"
"07-13","Vet Med 2","Davis campus","07-05
 - 07-06","2021-07-05","2021-07-06","2021-07-13"
"07-13","VMTH","Davis campus","07-03
 - 07-05","2021-07-03","2021-07-05","2021-07-13"
"07-13","VMTH","Davis campus","07-05
 - 07-06","2021-07-05","2021-07-06","2021-07-13"
"07-14","TANA arts facility, 1224 Lemen Av, Woodland","Off campus","07-11
 - 07-12","2021-07-11","2021-07-12","2021-07-14"
"07-19","The Grove (Surge III)","Davis campus","07-11
 - 07-13","2021-07-11","2021-07-13","2021-07-19"
"07-19","Hyatt Place","Davis campus","07-14
 - 07-16","2021-07-14","2021-07-16","2021-07-19"
"07-19","Segundo Dining Commons","Davis campus","07-14","2021-07-14","2021-07-14","2021-07-19"
"07-19","Memorial Union","Davis campus","07-15","2021-07-15","2021-07-15","2021-07-19"
"07-20","Student Affairs Annex","Davis campus","07-13
 - 07-15","2021-07-13","2021-07-15","2021-07-20"
"07-23","Advanced Transportation Infrastructure Rsch Ctr","Davis campus","07-19
 - 07-22","2021-07-19","2021-07-22","2021-07-23"
"07-23","Hutchison Hall","Davis campus","07-22","2021-07-22","2021-07-22","2021-07-23"
"07-23","Aggie Surplus and Custodial","Davis campus","07-19
 - 07-23","2021-07-19","2021-07-23","2021-07-23"
"07-23","Bainer Hall","Davis campus","07-17
 - 07-21","2021-07-17","2021-07-21","2021-07-23"
"07-23","Olson Hall","Davis campus","07-19
 - 07-23","2021-07-19","2021-07-23","2021-07-23"
"07-26","Briggs Hall","Davis campus","07-19
 - 07-23","2021-07-19","2021-07-23","2021-07-26"
"07-28","Teaching & Learning Complex","Davis campus","07-27","2021-07-27","2021-07-27","2021-07-28"
"07-28","Hutchison Hall","Davis campus","07-24
 - 07-26","2021-07-24","2021-07-26","2021-07-28"
"07-28","Fleet Services Central Garage","Davis campus","07-23
 - 07-26","2021-07-23","2021-07-26","2021-07-28"
"07-30","Chemistry Annex","Davis campus","07-26
 - 07-27","2021-07-26","2021-07-27","2021-07-30"
"07-30","Fire and Police Building","Davis campus","07-28
 - 07-30","2021-07-28","2021-07-30","2021-07-30"
"07-30","Meyer Hall","Davis campus","07-27
 - 07-28","2021-07-27","2021-07-28","2021-07-30"
"07-30","Vet Med 3A","Davis campus","07-26
 - 07-27","2021-07-26","2021-07-27","2021-07-30"
"07-30","Wastewater Treatment Plant Admin Bldg 2","Davis campus","07-27
 - 07-30","2021-07-27","2021-07-30","2021-07-30"
"07-30","Briggs Hall","Davis campus","07-25
 - 07-29","2021-07-25","2021-07-29","2021-07-30"
"08-03","Emerson Hall","Davis campus","07-29","2021-07-29","2021-07-29","2021-08-03"
"08-03","Orchard Park Greenhouse Complex","Davis campus","07-25
 - 07-30","2021-07-25","2021-07-30","2021-08-03"
"08-03","Teaching & Learning Complex","Davis campus","07-26","2021-07-26","2021-07-26","2021-08-03"
"08-03","Cowell Building","Davis campus","07-28
 - 07-29","2021-07-28","2021-07-29","2021-08-03"
"08-03","Teaching & Learning Complex","Davis campus","07-30","2021-07-30","2021-07-30","2021-08-03"
"08-04","CAHFS San Bernardino Lab","Off campus","07-27
 - 07-29","2021-07-27","2021-07-29","2021-08-04"
"08-04","8-4","Davis campus","07-28","2021-07-28","2021-07-28","2021-08-04"
"08-05","Granite Canyon Laboratory, Monterey, CA","Off campus","07-25
 - 08-04","2021-07-25","2021-08-04","2021-08-05"
"08-05","Nelson Hall","Davis campus","08-01
 - 08-04","2021-08-01","2021-08-04","2021-08-05"
"08-05","Primate Center","Davis campus","07-31
 - 08-05","2021-07-31","2021-08-05","2021-08-05"
"08-06","Plant & Environmental Sciences","Davis campus","08-03
 - 08-05","2021-08-03","2021-08-05","2021-08-06"
"08-06","Briggs Hall","Davis campus","08-02
 - 08-03","2021-08-02","2021-08-03","2021-08-06"
"08-06","Primate Center","Davis campus","08-02
 - 08-03","2021-08-02","2021-08-03","2021-08-06"
"08-09","Gourley Clinical Teaching Center","Davis campus","08-03
 - 08-05","2021-08-03","2021-08-05","2021-08-09"
"08-11","UC Davis Bookstore","Davis campus","08-07
 - 08-09","2021-08-07","2021-08-09","2021-08-11"
"08-11","Waste Water Treatment Plant","Davis campus","08-08
 - 08-10","2021-08-08","2021-08-10","2021-08-11"
"08-11","Plant and Enviro Sciences","Davis campus","08-06
 - 08-08","2021-08-06","2021-08-08","2021-08-11"
"08-11","Emerson Hall","Davis campus","08-04","2021-08-04","2021-08-04","2021-08-11"
"08-11","D Barn / Facilities Shop","Davis campus","08-07
 - 08-09","2021-08-07","2021-08-09","2021-08-11"
"08-11","Watershed Sciences Building","Davis campus","08-08
 - 08-10","2021-08-08","2021-08-10","2021-08-11"
"25-Aug","Activities and Recreation Center (ARC)","Davis campus","08-21
 - 08-23","2021-08-21","2021-08-23","2021-08-25"
"27-Aug","Physical Plant","Davis campus","08-24
 - 08-26","2021-08-24","2021-08-26","2021-08-27"
"27-Aug","ARC","Davis campus","08-23
 - 08-25","2021-08-23","2021-08-25","2021-08-27"
"1-Sep","Center for Neuroscience - CNS","Davis city","08-29
 - 08-31","2021-08-29","2021-08-31","2021-09-01"
"2-Sep","Segundo Services Center","Davis campus","08-30
 - 09-01","2021-08-30","2021-09-01","2021-09-02"
"3-Sep","Valley Hall","Davis campus","31-Aug","2021-08-31","2021-08-31","2021-09-03"
"3-Sep","UC Davis Teaching & Learning Complex","Davis campus","30-Aug","2021-08-30","2021-08-30","2021-09-03"
"3-Sep","The Green","Davis campus","08-31
 - 09-02","2021-08-31","2021-09-02","2021-09-03"
"3-Sep","Vet Med 3A (MPT)","Davis campus","31-Aug","2021-08-31","2021-08-31","2021-09-03"
"7-Sep","VM Mulit-Purpose Teaching Facility","Davis campus","3-Sep","2021-09-03","2021-09-03","2021-09-07"
"7-Sep","Tupper Hall","Davis campus","3-Sep","2021-09-03","2021-09-03","2021-09-07"
"8-Sep","Unitrans Maintenance Shop","Davis campus","09-05
 - 09-07","2021-09-05","2021-09-07","2021-09-08"
"9-Sep","Robbins Hall","Davis campus","09-07
 - 09-08","2021-09-07","2021-09-08","2021-09-09"
"9-Sep","Walter A Beuhler Alumni Center","Davis campus","09-07
 - 09-08","2021-09-07","2021-09-08","2021-09-09"
"9-Sep","Vet Med Admin Building","Davis campus","8-Sep","2021-09-08","2021-09-08","2021-09-09"
"9-Sep","King Hall","Davis campus","7-Sep","2021-09-07","2021-09-07","2021-09-09"
"9-Sep","Valley Hall","Davis campus","7-Sep","2021-09-07","2021-09-07","2021-09-09"
"9-Sep","UC Davis Health Stadium","Davis campus","7-Sep","2021-09-07","2021-09-07","2021-09-09"
"9-Sep","Gourley Clinical Teaching Center","Davis campus","8-Sep","2021-09-08","2021-09-08","2021-09-09"
"10-Sep","Fire & Police Building","Davis campus","09-07
 - 09-09","2021-09-07","2021-09-09","2021-09-10"
"13-Sep","Center for Companion Animal Health","Davis campus","09-08
 - 09-10","2021-09-08","2021-09-10","2021-09-13"
"13-Sep","Campbell Hall","Davis campus","12-Sep","2021-09-12","2021-09-12","2021-09-13"
"13-Sep","King Hall","Davis campus","09-06
 - 09-08","2021-09-06","2021-09-08","2021-09-13"
"13-Sep","Veterinary Medicine 3A","Davis campus","09-08
 - 09-10","2021-09-08","2021-09-10","2021-09-13"
"13-Sep","Gladys Hall","Davis campus","09-08
 - 09-10","2021-09-08","2021-09-10","2021-09-13"
"13-Sep","Student Housing Building","Davis campus","09-08
 - 09-10","2021-09-08","2021-09-10","2021-09-13"
"15-Sep","Sequoia Hall","Davis campus","14-Sep","2021-09-14","2021-09-14","2021-09-15"
"15-Sep","Teaching & Learning Complex","Davis campus","10-Sep","2021-09-10","2021-09-10","2021-09-15"
"15-Sep","Memorial Union","Davis campus","14-Sep","2021-09-14","2021-09-14","2021-09-15"
"15-Sep","Tercero Dining Commons","Davis campus","13-Sep","2021-09-13","2021-09-13","2021-09-15"
"15-Sep","Shasta Hall","Davis campus","09-13
 - 09-14","2021-09-13","2021-09-14","2021-09-15"
"16-Sep","Hutchison Hall","Davis campus","8-Sep","2021-09-08","2021-09-08","2021-09-16"
"16-Sep","Hickey Gym","Davis campus","14-Sep","2021-09-14","2021-09-14","2021-09-16"
"17-Sep","The Greens","Davis campus","09-08
 - 09-10","2021-09-08","2021-09-10","2021-09-17"
"17-Sep","The Greens","Davis campus","09-13
 - 09-15","2021-09-13","2021-09-15","2021-09-17"
"17-Sep","1550 Cannery Avenue","Davis city","09-14
 - 09-16","2021-09-14","2021-09-16","2021-09-17"
"17-Sep","Latitude Dining Hall","Davis campus","16-Sep","2021-09-16","2021-09-16","2021-09-17"
"17-Sep","Thompson Hall","Davis campus","09-15
 - 09-17","2021-09-15","2021-09-17","2021-09-17"
"17-Sep","Latitude Dining Commons","Davis campus","16-Sep","2021-09-16","2021-09-16","2021-09-17"
"17-Sep","The Green at West Village","Davis campus","09-08
 - 09-10","2021-09-08","2021-09-10","2021-09-17"
"20-Sep","UC Davis Bookstore","Davis campus","18-Sep","2021-09-18","2021-09-18","2021-09-20"
"20-Sep","ARC","Davis campus","09-15
 - 09-17","2021-09-15","2021-09-17","2021-09-20"
"20-Sep","Latitude Dining Commons","Davis campus","19-Sep","2021-09-19","2021-09-19","2021-09-20"
"20-Sep","Orchard Park","Davis campus","09-15
 - 09-17","2021-09-15","2021-09-17","2021-09-20"
"20-Sep","Memorial Union","Davis campus","18-Sep","2021-09-18","2021-09-18","2021-09-20"
"20-Sep","The Green","Davis campus","09-13
 - 09-15","2021-09-13","2021-09-15","2021-09-20"
"20-Sep","The Green at West Village","Davis campus","09-13
 - 09-15","2021-09-13","2021-09-15","2021-09-20"
"21-Sep","Student Community Center","Davis campus","20-Sep","2021-09-20","2021-09-20","2021-09-21"
"21-Sep","Primate Center","Davis campus","09-17
 - 09-19","2021-09-17","2021-09-19","2021-09-21"
"09-21","Primate Research Center","Davis campus","09/17/2021
 - 09/19/2021","2021-09-17","2021-09-19","2021-09-21"
"22-Sep","Mary Welch Tennis Center","Davis campus","21-Sep","2021-09-21","2021-09-21","2021-09-22"
"22-Sep","The Green at West Village","Davis campus","09-18
 - 09-19","2021-09-18","2021-09-19","2021-09-22"
"22-Sep","CA Animal Health and Food Safety Lab, Turlock","Off campus","09-13
 - 09-15","2021-09-13","2021-09-15","2021-09-22"
"22-Sep","Storer Hall","Davis campus","22-Sep","2021-09-22","2021-09-22","2021-09-22"
"23-Sep","Rock Hall","Davis campus","22-Sep","2021-09-22","2021-09-22","2021-09-23"
"23-Sep","Kerr Hall","Davis campus","22-Sep","2021-09-22","2021-09-22","2021-09-23"
"23-Sep","Science Lecture Building","Davis campus","22-Sep","2021-09-22","2021-09-22","2021-09-23"
"23-Sep","Young Hall","Davis campus","22-Sep","2021-09-22","2021-09-22","2021-09-23"
"09-23","Sciences Lecture Hall","Davis campus","09/22/2021","2021-09-22","2021-09-22","2021-09-23"
"24-Sep","Young Hall","Davis campus","09-21
 - 09-22","2021-09-21","2021-09-22","2021-09-24"
"27-Sep","Activities & Recreational Center","Davis campus","23-Sep","2021-09-23","2021-09-23","2021-09-27"
"27-Sep","UC Davis Bookstore","Davis campus","09-22
 - 09-24","2021-09-22","2021-09-24","2021-09-27"
"27-Sep","Life Sciences","Davis campus","22-Sep","2021-09-22","2021-09-22","2021-09-27"
"27-Sep","Young Hall","Davis campus","24-Sep","2021-09-24","2021-09-24","2021-09-27"
"27-Sep","Kleiber Hall","Davis campus","09-22
 - 09-24","2021-09-22","2021-09-24","2021-09-27"
"27-Sep","Wellman Hall","Davis campus","22-Sep","2021-09-22","2021-09-22","2021-09-27"
"27-Sep","Harding Hall","Davis campus","09-21
 - 09-23","2021-09-21","2021-09-23","2021-09-27"
"27-Sep","Hunt Hall","Davis campus","24-Sep","2021-09-24","2021-09-24","2021-09-27"
"27-Sep","Giedt Hall","Davis campus","22-Sep","2021-09-22","2021-09-22","2021-09-27"
"27-Sep","Memorial Union","Davis campus","09-22
 - 09-24","2021-09-22","2021-09-24","2021-09-27"
"27-Sep","Social Sciences Lecture Hall","Davis campus","22-Sep","2021-09-22","2021-09-22","2021-09-27"
"27-Sep","Social Sciences Lecture Hall","Davis campus","24-Sep","2021-09-24","2021-09-24","2021-09-27"
"27-Sep","Shields Library","Davis campus","24-Sep","2021-09-24","2021-09-24","2021-09-27"
"27-Sep","California Hall","Davis campus","09-24
 - 09-25","2021-09-24","2021-09-25","2021-09-27"
"28-Sep","Primate Research Center","Davis campus","09-19
 - 09-21","2021-09-19","2021-09-21","2021-09-28"
"28-Sep","Veihmeyer Hall","Davis campus","09-22
 - 09-24","2021-09-22","2021-09-24","2021-09-28"
"28-Sep","Olson Hall","Davis campus","09-22
 - 09-24","2021-09-22","2021-09-24","2021-09-28"
"29-Sep","Wellman Hall","Davis campus","27-Sep","2021-09-27","2021-09-27","2021-09-29"
"29-Sep","Social Science & Humanities","Davis campus","27-Sep","2021-09-27","2021-09-27","2021-09-29"
"29-Sep","Mondavi Center","Davis campus","27-Sep","2021-09-27","2021-09-27","2021-09-29"
"29-Sep","Everson Hall","Davis campus","27-Sep","2021-09-27","2021-09-27","2021-09-29"
"29-Sep","Hickey Gym","Davis campus","27-Sep","2021-09-27","2021-09-27","2021-09-29"
"29-Sep","Segundo Dining Commons","Davis campus","27-Sep","2021-09-27","2021-09-27","2021-09-29"
"29-Sep","Vet Med-Tulare","Off campus","09-24
 - 09-26","2021-09-24","2021-09-26","2021-09-29"
"29-Sep","Hart Hall","Davis campus","27-Sep","2021-09-27","2021-09-27","2021-09-29"
"29-Sep","California Hall","Davis campus","27-Sep","2021-09-27","2021-09-27","2021-09-29"
"29-Sep","Teaching & Learning Complex","Davis campus","27-Sep","2021-09-27","2021-09-27","2021-09-29"
"09-29","Social Sciences & Humanities","Davis campus","09/27/2021","2021-09-27","2021-09-27","2021-09-29"
"30-Sep","Giedt Hall","Davis campus","09-24
 - 09-26","2021-09-24","2021-09-26","2021-09-30"
"30-Sep","Trecero Dining Commons","Davis campus","09-24
 - 09-26","2021-09-24","2021-09-26","2021-09-30"
"30-Sep","Olson Hall","Davis campus","27-Sep","2021-09-27","2021-09-27","2021-09-30"
"30-Sep","Geidt Hall","Davis campus","27-Sep","2021-09-27","2021-09-27","2021-09-30"
"30-Sep","Art Building","Davis campus","09-24
 - 09-26","2021-09-24","2021-09-26","2021-09-30"
"30-Sep","Cruess Hall","Davis campus","27-Sep","2021-09-27","2021-09-27","2021-09-30"
"30-Sep","Plant & Environmental Sciences","Davis campus","24-Sep","2021-09-24","2021-09-24","2021-09-30"
"30-Sep","Young Hall","Davis campus","29-Sep","2021-09-29","2021-09-29","2021-09-30"
"30-Sep","Wellman Hall","Davis campus","09-24
 - 09-26","2021-09-24","2021-09-26","2021-09-30"
"30-Sep","Segundo Dining Commons","Davis campus","09-24
 - 09-26","2021-09-24","2021-09-26","2021-09-30"
"30-Sep","Wellman Hall","Davis campus","27-Sep","2021-09-27","2021-09-27","2021-09-30"
"30-Sep","260 Cousteau","Davis campus","29-Sep","2021-09-29","2021-09-29","2021-09-30"
"30-Sep","Rock Hall","Davis campus","29-Sep","2021-09-29","2021-09-29","2021-09-30"
"30-Sep","Hunt Hall","Davis campus","29-Sep","2021-09-29","2021-09-29","2021-09-30"
"09-30","Giedt Hall","Davis campus","09/27/2021","2021-09-27","2021-09-27","2021-09-30"
"10-01","Bainer Hall","Davis campus","09/27/2021","2021-09-27","2021-09-27","2021-10-01"
"10-01","VMTH","Davis campus","09/26/2021
 - 09/28/2021","2021-09-26","2021-09-28","2021-10-01"
"10-01","Olson Hall","Davis campus","09/27/2021","2021-09-27","2021-09-27","2021-10-01"
"10-04","Hart Hall","Davis campus","09/27/2021
 - 09/29/2021","2021-09-27","2021-09-29","2021-10-04"
"10-04","Academic Surge","Davis campus","09/30/2021","2021-09-30","2021-09-30","2021-10-04"
"10-04","The Grove","Davis campus","09/30/2021","2021-09-30","2021-09-30","2021-10-04"
"10-04","Hickey Gym","Davis campus","09/28/2021","2021-09-28","2021-09-28","2021-10-04"
"10-04","Olson Hall","Davis campus","09/30/2021","2021-09-30","2021-09-30","2021-10-04"
"10-04","Roessler hall","Davis campus","09/30/2021","2021-09-30","2021-09-30","2021-10-04"
"10-04","Modavi Center","Davis campus","09/27/2021
 - 09/29/2021","2021-09-27","2021-09-29","2021-10-04"
"10-04","Everson Hall","Davis campus","09/28/2021","2021-09-28","2021-09-28","2021-10-04"
"10-04","Bainer Hall","Davis campus","10/01/2021","2021-10-01","2021-10-01","2021-10-04"
"10-04","Hoagland Hall","Davis campus","10/04/2021","2021-10-04","2021-10-04","2021-10-04"
"10-04","The Grove (Surge III)","Davis campus","09/30/2021","2021-09-30","2021-09-30","2021-10-04"
"10-04","Storer Hall","Davis campus","10/04/2021","2021-10-04","2021-10-04","2021-10-04"
"10-04","Olson Hall","Davis campus","10/04/2021","2021-10-04","2021-10-04","2021-10-04"
"10-04","Chemistry Annex","Davis campus","10/04/2021","2021-10-04","2021-10-04","2021-10-04"
"10-04","Sciences Lecture Hall","Davis campus","10/04/2021","2021-10-04","2021-10-04","2021-10-04"
"10-04","Mondavi Center","Davis campus","09/27/2021
 - 09/29/2021","2021-09-27","2021-09-29","2021-10-04"
"10-04","The Grove (Surge III)","Davis campus","10/04/2021","2021-10-04","2021-10-04","2021-10-04"
"10-05","VMTH","Davis campus","10/03/2021
 - 10/04/2021","2021-10-03","2021-10-04","2021-10-05"
"10-06","Center for Companion Animal Health","Davis campus","10/01/2021","2021-10-01","2021-10-01","2021-10-06"
"10-06","Hart Hall","Davis campus","10/05/2021","2021-10-05","2021-10-05","2021-10-06"
"10-06","Sciences Lecture Hall","Davis campus","10/01/2021","2021-10-01","2021-10-01","2021-10-06"
"10-07","Roessler Hall","Davis campus","10/04/2021","2021-10-04","2021-10-04","2021-10-07"
"10-07","Wellman Hall","Davis campus","10/04/2021","2021-10-04","2021-10-04","2021-10-07"
"10-07","Rock Hall","Davis campus","10/05/2021","2021-10-05","2021-10-05","2021-10-07"
"10-07","Meyer Hall","Davis campus","10/04/2021","2021-10-04","2021-10-04","2021-10-07"
"10-07","Earth and Physical Sciences","Davis campus","10/05/2021","2021-10-05","2021-10-05","2021-10-07"
"10-08","Bainer Hall","Davis campus","10/07/2021","2021-10-07","2021-10-07","2021-10-08"
"10-08","Haring Hall","Davis campus","10/07/2021","2021-10-07","2021-10-07","2021-10-08"
"10-08","Genome & Biomedical Sciences Facility","Davis campus","10/07/2021","2021-10-07","2021-10-07","2021-10-08"
"10-08","Kemper Hall","Davis campus","10/07/2021","2021-10-07","2021-10-07","2021-10-08"
"10-08","Watershed Science Facility","Davis campus","10/04/2021","2021-10-04","2021-10-04","2021-10-08"
"10-11","Social Sciences & Humanities","Davis campus","10/06/2021
 - 10/08/2021","2021-10-06","2021-10-08","2021-10-11"
"10-11","Latitude Dining Commons","Davis campus","10/06/2021","2021-10-06","2021-10-06","2021-10-11"
"10-11","Olson Hall","Davis campus","10/07/2021","2021-10-07","2021-10-07","2021-10-11"
"10-11","California Hall","Davis campus","10/08/2021","2021-10-08","2021-10-08","2021-10-11"
"10-11","Bowley Plant Science Teaching Facility","Davis campus","10/06/2021","2021-10-06","2021-10-06","2021-10-11"
"10-11","Walker Hall","Davis campus","10/05/2021
 - 10/07/2021","2021-10-05","2021-10-07","2021-10-11"
"10-11","Veihmeyer Hall","Davis campus","10/06/2021
 - 10/08/2021","2021-10-06","2021-10-08","2021-10-11"
"10-11","Everson Hall","Davis campus","10/08/2021","2021-10-08","2021-10-08","2021-10-11"
"10-11","Haring Hall","Davis campus","10/08/2021","2021-10-08","2021-10-08","2021-10-11"
"10-11","Rock Hall","Davis campus","10/08/2021","2021-10-08","2021-10-08","2021-10-11"
"10-11","Environmental Horticulture","Davis campus","10/06/2021","2021-10-06","2021-10-06","2021-10-11"
"10-11","Wellman Hall","Davis campus","10/07/2021","2021-10-07","2021-10-07","2021-10-11"
"10-11","Vet Med 3A","Davis campus","10/08/2021","2021-10-08","2021-10-08","2021-10-11"
"10-11","The Grove (Surge III)","Davis campus","10/07/2021","2021-10-07","2021-10-07","2021-10-11"
"10-11","Hart Hall","Davis campus","10/08/2021","2021-10-08","2021-10-08","2021-10-11"
"10-11","Giedt Hall","Davis campus","10/06/2021
 - 10/08/2021","2021-10-06","2021-10-08","2021-10-11"
"10-11","Plant & Environmental Sciences","Davis campus","10/07/2021","2021-10-07","2021-10-07","2021-10-11"
"10-11","Roessler Hall","Davis campus","10/11/2021","2021-10-11","2021-10-11","2021-10-11"
"10-11","Memorial Union Moss Room","Davis campus","10/11/2021","2021-10-11","2021-10-11","2021-10-11"
"10-12","Scrub Oak Hall","Davis campus","10/04/2021
 - 10/06/2021","2021-10-04","2021-10-06","2021-10-12"
"10-12","Earth and Physical Sciences","Davis campus","10/04/2021
 - 10/06/2021","2021-10-04","2021-10-06","2021-10-12"
"10-12","1560 Drew Avenue","Davis city","10/11/2021","2021-10-11","2021-10-11","2021-10-12"
"10-12","Medical Sciences","Davis campus","10/04/2021
 - 10/06/2021","2021-10-04","2021-10-06","2021-10-12"
"10-13","Ctr for Chicanx & Latinx Academic Student Success","Davis campus","10/11/2021","2021-10-11","2021-10-11","2021-10-13"
"10-13","Haring Hall","Davis campus","10/09/2021","2021-10-09","2021-10-09","2021-10-13"
"10-13","Coffee House","Davis campus","10/12/2021","2021-10-12","2021-10-12","2021-10-13"
"10-13","Olson Hall","Davis campus","10/11/2021","2021-10-11","2021-10-11","2021-10-13"
"10-13","Olson Hall","Davis campus","10/07/2021
 - 10/09/2021","2021-10-07","2021-10-09","2021-10-13"
"10-13","AB540 and Undocumented Student Center","Davis campus","10/12/2021","2021-10-12","2021-10-12","2021-10-13"
"10-13","Gallagher Hall","Davis campus","10/11/2021","2021-10-11","2021-10-11","2021-10-13"
"10-13","Vet Med 3A","Davis campus","10/13/2021","2021-10-13","2021-10-13","2021-10-13"
"10-14","Segundo Hall","Davis campus","10/11/2021","2021-10-11","2021-10-11","2021-10-14"
"10-14","Hunt Hall","Davis campus","10/11/2021","2021-10-11","2021-10-11","2021-10-14"
"10-14","Wickson Hall","Davis campus","10/13/2021","2021-10-13","2021-10-13","2021-10-14"
"10-14","Facilities Services","Davis campus","10/13/2021","2021-10-13","2021-10-13","2021-10-14"
"10-14","Chemistry","Davis campus","10/12/2021","2021-10-12","2021-10-12","2021-10-14"
"10-14","Wellman Hall","Davis campus","10/12/2021","2021-10-12","2021-10-12","2021-10-14"
"10-14","Pine Hall","Davis campus","10/12/2021","2021-10-12","2021-10-12","2021-10-14"
"10-14","Bainer Hall","Davis campus","10/11/2021","2021-10-11","2021-10-11","2021-10-14"
"10-14","Cruess hall","Davis campus","10/11/2021
 - 10/12/2021","2021-10-11","2021-10-12","2021-10-14"
"10-14","Olson Hall","Davis campus","10/11/2021","2021-10-11","2021-10-11","2021-10-14"
"10-14","Latitude Dining Commons","Davis campus","10/14/2021","2021-10-14","2021-10-14","2021-10-14"
"10-14","Haring Hall","Davis campus","10/12/2021","2021-10-12","2021-10-12","2021-10-14"
"10-14","Shields Library","Davis campus","10/12/2021","2021-10-12","2021-10-12","2021-10-14"
"10-15","Olson Hall","Davis campus","10/11/2021","2021-10-11","2021-10-11","2021-10-15"
"10-15","Wellman Hall","Davis campus","10/14/2021","2021-10-14","2021-10-14","2021-10-15"
"10-15","Segundo Dining Commons","Davis campus","10/12/2021","2021-10-12","2021-10-12","2021-10-15"
"10-15","Mondavi Center","Davis campus","10/11/2021","2021-10-11","2021-10-11","2021-10-15"
"10-18","Valley Hall","Davis campus","10/11/2021
 - 10/14/2021","2021-10-11","2021-10-14","2021-10-18"
"10-18","King Hall","Davis campus","10/15/2021","2021-10-15","2021-10-15","2021-10-18"
"10-18","Wellman Hall","Davis campus","10/14/2021","2021-10-14","2021-10-14","2021-10-18"
"10-18","Vet Med 3A","Davis campus","10/11/2021","2021-10-11","2021-10-11","2021-10-18"
"10-18","School of Education","Davis campus","10/18/2021","2021-10-18","2021-10-18","2021-10-18"
"10-18","Scrubs Cafe","Davis campus","10/13/2021","2021-10-13","2021-10-13","2021-10-18"
"10-20","Unitrans Maintenance Facility","Davis campus","10/15/2021","2021-10-15","2021-10-15","2021-10-20"
"10-20","Activities & Recreation Center (ARC)","Davis campus","10/15/2021","2021-10-15","2021-10-15","2021-10-20"
"10-21","Wellman Hall","Davis campus","10/18/2021
 - 10/20/2021","2021-10-18","2021-10-20","2021-10-21"
"10-21","Sheep Barn Lab","Davis campus","10/19/2021","2021-10-19","2021-10-19","2021-10-21"
"10-21","North Hall","Davis campus","10/20/2021
 - 10/21/2021","2021-10-20","2021-10-21","2021-10-21"
"10-21","Meyer Hall","Davis campus","10/18/2021","2021-10-18","2021-10-18","2021-10-21"
"10-21","Olson Hall","Davis campus","10/18/2021
 - 10/20/2021","2021-10-18","2021-10-20","2021-10-21"
"10-21","Earth and Physical Sciences","Davis campus","10/18/2021","2021-10-18","2021-10-18","2021-10-21"
"10-21","Olson Hall","Davis campus","10/21/2021","2021-10-21","2021-10-21","2021-10-21"
"10-22","Social Sciences & Humanities","Davis campus","10/21/2021","2021-10-21","2021-10-21","2021-10-22"
"10-22","Segundo Dining Commons","Davis campus","10/21/2021","2021-10-21","2021-10-21","2021-10-22"
"10-25","Olson Hall","Davis campus","10/22/2021","2021-10-22","2021-10-22","2021-10-25"
"10-25","Olson Hall","Davis campus","10/18/2021","2021-10-18","2021-10-18","2021-10-25"
"10-25","Social Sciences & Humanities","Davis campus","10/20/2021","2021-10-20","2021-10-20","2021-10-25"
"10-25","Bainer Hall","Davis campus","10/23/2021","2021-10-23","2021-10-23","2021-10-25"
"10-25","Wellman Hall","Davis campus","10/22/2021","2021-10-22","2021-10-22","2021-10-25"
"10-25","Olson Hall","Davis campus","10/20/2021","2021-10-20","2021-10-20","2021-10-25"
"10-25","Giedt Hall","Davis campus","10/19/2021","2021-10-19","2021-10-19","2021-10-25"
"10-25","The Grove (Surge III) Lecture Hall","Davis campus","10/22/2021","2021-10-22","2021-10-22","2021-10-25"
"10-25","Hart Hall","Davis campus","10/18/2021
 - 10/20/2021","2021-10-18","2021-10-20","2021-10-25"
"10-25","Social Sciences & Humanities","Davis campus","10/18/2021","2021-10-18","2021-10-18","2021-10-25"
"10-26","255 Cousteau Place","Davis campus","10/21/2021","2021-10-21","2021-10-21","2021-10-26"
"10-26","Coffee House","Davis campus","10/20/2021","2021-10-20","2021-10-20","2021-10-26"
"10-26","Sciences Lecture Hall","Davis campus","10/22/2021","2021-10-22","2021-10-22","2021-10-26"
"10-26","Cruess Hall","Davis campus","10/21/2021","2021-10-21","2021-10-21","2021-10-26"
"10-26","Wellman Hall","Davis campus","10/21/2021","2021-10-21","2021-10-21","2021-10-26"
"10-26","The Grove (Surge III)","Davis campus","10/20/2021","2021-10-20","2021-10-20","2021-10-26"
"10-26","Walker Hall","Davis campus","10/21/2021","2021-10-21","2021-10-21","2021-10-26"
"10-26","Social Sciences & Humanities Lecture Hall","Davis campus","10/20/2021","2021-10-20","2021-10-20","2021-10-26"
"10-26","Sciences Lab Building","Davis campus","10/21/2021","2021-10-21","2021-10-21","2021-10-26"
"10-26","Academic Surge Building","Davis campus","10/20/2021","2021-10-20","2021-10-20","2021-10-26"
"10-26","Sciences Lecture Hall","Davis campus","10/20/2021","2021-10-20","2021-10-20","2021-10-26"
"10-26","Social Sciences & Humanities Lecture Hall","Davis campus","10/22/2021","2021-10-22","2021-10-22","2021-10-26"
"10-26","Robbins Hall","Davis campus","10/21/2021","2021-10-21","2021-10-21","2021-10-26"
"10-27","Vet Med Teaching Hospital","Davis campus","10/22/2021","2021-10-22","2021-10-22","2021-10-27"
"10-27","Young Hall","Davis campus","10/26/2021","2021-10-26","2021-10-26","2021-10-27"
"10-27","Sciences Lecture Hall","Davis campus","10/26/2021","2021-10-26","2021-10-26","2021-10-27"
"10-27","California Hall","Davis campus","10/26/2021","2021-10-26","2021-10-26","2021-10-27"
"10-28","Tupper Hall","Davis campus","10/22/2021","2021-10-22","2021-10-22","2021-10-28"
"10-28","Women's Resources and Research Center","Davis campus","10/27/2021
 - 10/28/2021","2021-10-27","2021-10-28","2021-10-28"
"10-28","Wellman Hall","Davis campus","10/27/2021
 - 10/28/2021","2021-10-27","2021-10-28","2021-10-28"
"10-28","Tercero Dining Commons","Davis campus","10/26/2021","2021-10-26","2021-10-26","2021-10-28"
"10-28","Hart Hall","Davis campus","10/27/2021","2021-10-27","2021-10-27","2021-10-28"
"10-29","Wellman Hall","Davis campus","10/22/2021","2021-10-22","2021-10-22","2021-10-29"
"10-29","Shields Library","Davis campus","10/25/2021","2021-10-25","2021-10-25","2021-10-29"
"10-29","Art Building","Davis campus","10/26/2021","2021-10-26","2021-10-26","2021-10-29"
"10-29","Hunt Hall","Davis campus","10/26/2021","2021-10-26","2021-10-26","2021-10-29"
"10-29","Mondavi Center - Jackson Hall","Davis campus","10/27/2021","2021-10-27","2021-10-27","2021-10-29"
"10-29","Hunt Hall","Davis campus","10/27/2021","2021-10-27","2021-10-27","2021-10-29"
"10-29","Memorial Union","Davis campus","10/27/2021","2021-10-27","2021-10-27","2021-10-29"
"10-29","Academic Assistance and Tutoring Center","Davis campus","10/28/2021","2021-10-28","2021-10-28","2021-10-29"
"10-29","Wellman Hall","Davis campus","10/28/2021","2021-10-28","2021-10-28","2021-10-29"
"10-29","Shields Library","Davis campus","10/27/2021","2021-10-27","2021-10-27","2021-10-29"
"10-29","Art Building","Davis campus","10/28/2021","2021-10-28","2021-10-28","2021-10-29"
"10-29","Conference Center","Davis campus","10/27/2021","2021-10-27","2021-10-27","2021-10-29"
"10-29","Mondavi Center - Jackson Hall","Davis campus","10/29/2021","2021-10-29","2021-10-29","2021-10-29"
"10-29","Olson Hall","Davis campus","10/26/2021
 - 10/29/2021","2021-10-26","2021-10-29","2021-10-29"
"10-29","202 Cousteau Place","Davis campus","10/28/2021","2021-10-28","2021-10-28","2021-10-29"
"10-29","Hickey Gym","Davis campus","10/28/2021","2021-10-28","2021-10-28","2021-10-29"
"10-29","Shields Library","Davis campus","10/22/2021","2021-10-22","2021-10-22","2021-10-29"
"10-29","Olson Hall","Davis campus","10/25/2021","2021-10-25","2021-10-25","2021-10-29"
"10-29","Wellman Hall","Davis campus","10/25/2021
 - 10/26/2021","2021-10-25","2021-10-26","2021-10-29"
"10-29","Mondavi Center - Jackson Hall","Davis campus","10/25/2021","2021-10-25","2021-10-25","2021-10-29"
"10-29","Hunt Hall","Davis campus","10/25/2021","2021-10-25","2021-10-25","2021-10-29"
"10-29","Meyer Hall","Davis campus","10/28/2021","2021-10-28","2021-10-28","2021-10-29"
"11-01","Wellman Hall","Davis campus","10/25/2021","2021-10-25","2021-10-25","2021-11-01"
"11-01","Memorial Union Games Area","Davis campus","10/27/2021","2021-10-27","2021-10-27","2021-11-01"
"11-01","Student Farm - Greenhouse","Davis campus","11/01/2021","2021-11-01","2021-11-01","2021-11-01"
"11-01","Hart Hall","Davis campus","10/27/2021","2021-10-27","2021-10-27","2021-11-01"
"11-01","Academic Surge Building","Davis campus","10/25/2021","2021-10-25","2021-10-25","2021-11-01"
"11-01","Social Sciences & Humanities","Davis campus","10/26/2021","2021-10-26","2021-10-26","2021-11-01"
"11-01","Mondavi Center - Jackson Hall","Davis campus","10/25/2021","2021-10-25","2021-10-25","2021-11-01"
"11-01","Hunt Hall","Davis campus","10/25/2021","2021-10-25","2021-10-25","2021-11-01"
"11-01","Olson Hall","Davis campus","10/28/2021","2021-10-28","2021-10-28","2021-11-01"
"11-01","Wellman Hall","Davis campus","10/27/2021","2021-10-27","2021-10-27","2021-11-01"
"11-01","Social Sciences & Humanities","Davis campus","10/29/2021","2021-10-29","2021-10-29","2021-11-01"
"11-01","Green Hall","Davis campus","10/29/2021","2021-10-29","2021-10-29","2021-11-01"
"11-01","Roessler Hall","Davis campus","10/25/2021
 - 10/26/2021","2021-10-25","2021-10-26","2021-11-01"
"11-01","Mondavi Center","Davis campus","10/26/2021","2021-10-26","2021-10-26","2021-11-01"
"11-01","Social Sciences & Humanities","Davis campus","10/28/2021","2021-10-28","2021-10-28","2021-11-01"
"11-01","Mondavi Center - Jackson Hall","Davis campus","10/27/2021","2021-10-27","2021-10-27","2021-11-01"
"11-01","Hunt Hall","Davis campus","10/27/2021","2021-10-27","2021-10-27","2021-11-01"
"11-01","Meyer Hall","Davis campus","10/28/2021","2021-10-28","2021-10-28","2021-11-01"
"11-01","Wellman Hall","Davis campus","10/29/2021","2021-10-29","2021-10-29","2021-11-01"
"11-01","Bainer Hall","Davis campus","10/25/2021","2021-10-25","2021-10-25","2021-11-01"
"11-01","Hart Hall","Davis campus","10/25/2021","2021-10-25","2021-10-25","2021-11-01"
"11-01","Roessler Hall","Davis campus","10/28/2021","2021-10-28","2021-10-28","2021-11-01"
"11-01","Mondavi Center","Davis campus","10/28/2021","2021-10-28","2021-10-28","2021-11-01"
"11-01","Physics Building","Davis campus","10/27/2021","2021-10-27","2021-10-27","2021-11-01"
"11-01","Mondavi Center - Jackson Hall","Davis campus","10/29/2021","2021-10-29","2021-10-29","2021-11-01"
"11-01","Olson Hall","Davis campus","10/26/2021","2021-10-26","2021-10-26","2021-11-01"
"11-01","Earth and Physical Sciences","Davis campus","11/01/2021","2021-11-01","2021-11-01","2021-11-01"
"11-02","Activities & Recreation Center (ARC)","Davis campus","10/31/2021","2021-10-31","2021-10-31","2021-11-02"
"11-02","Robbins Hall","Davis campus","10/28/2021","2021-10-28","2021-10-28","2021-11-02"
"11-02","Center for Health & Environment","Davis campus","11/01/2021","2021-11-01","2021-11-01","2021-11-02"
"11-02","Bainer Hall","Davis campus","10/29/2021","2021-10-29","2021-10-29","2021-11-02"
"11-02","Young Hall","Davis campus","10/28/2021","2021-10-28","2021-10-28","2021-11-02"
"11-02","Kleiber Hall","Davis campus","11/02/2021","2021-11-02","2021-11-02","2021-11-02"
"11-03","California Hall","Davis campus","11/02/2021","2021-11-02","2021-11-02","2021-11-03"
"11-03","Hutchison Hall","Davis campus","10/29/2021","2021-10-29","2021-10-29","2021-11-03"
"11-03","Giedt Hall","Davis campus","10/29/2021","2021-10-29","2021-10-29","2021-11-03"
"11-03","South Hall","Davis campus","11/02/2021","2021-11-02","2021-11-02","2021-11-03"
"11-03","Medical Sciences 1C","Davis campus","11/03/2021","2021-11-03","2021-11-03","2021-11-03"
"11-03","Olson Hall","Davis campus","10/29/2021","2021-10-29","2021-10-29","2021-11-03"
"11-04","King Hall","Davis campus","11/02/2021","2021-11-02","2021-11-02","2021-11-04"
"11-04","Walker Hall","Davis campus","11/02/2021","2021-11-02","2021-11-02","2021-11-04"
"11-05","Academic Surge Building","Davis campus","11/04/2021","2021-11-04","2021-11-04","2021-11-05"
"11-05","Young Hall","Davis campus","11/02/2021","2021-11-02","2021-11-02","2021-11-05"
"11-05","Bainer Hall","Davis campus","11/03/2021","2021-11-03","2021-11-03","2021-11-05"
"11-08","Mondavi Center","Davis campus","11/02/2021","2021-11-02","2021-11-02","2021-11-08"
"11-08","Walker Hall","Davis campus","11/01/2021","2021-11-01","2021-11-01","2021-11-08"
"11-08","Activities and Recreation Center","Davis campus","10/28/2021","2021-10-28","2021-10-28","2021-11-08"
"11-08","Wellman Hall","Davis campus","11/02/2021
 - 11/04/2021","2021-11-02","2021-11-04","2021-11-08"
"11-08","Mondavi Center","Davis campus","11/04/2021","2021-11-04","2021-11-04","2021-11-08"
"11-08","Walker Hall","Davis campus","11/04/2021","2021-11-04","2021-11-04","2021-11-08"
"11-08","Plant & Environmental Sciences","Davis campus","11/04/2021
 - 11/05/2021","2021-11-04","2021-11-05","2021-11-08"
"11-08","Olson Hall","Davis campus","11/04/2021","2021-11-04","2021-11-04","2021-11-08"
"11-08","Vet Med Teaching Hospital Small Animal Clinic","Davis campus","11/07/2021","2021-11-07","2021-11-07","2021-11-08"
"11-09","Young Hall","Davis campus","11/08/2021","2021-11-08","2021-11-08","2021-11-09"
"11-09","Hickey Gym","Davis campus","11/08/2021","2021-11-08","2021-11-08","2021-11-09"
"11-10","Geotechnical Centrifuge","Davis campus","11/08/2021
 - 11/10/2021","2021-11-08","2021-11-10","2021-11-10"
"11-10","Antenna Farm","Davis campus","11/08/2021
 - 11/10/2021","2021-11-08","2021-11-10","2021-11-10"
"11-12","Telecom Building","Davis campus","11/08/2021
 - 11/10/2021","2021-11-08","2021-11-10","2021-11-12"
"11-15","Tercero Dining Hall","Davis campus","11/08/2021
 - 11/13/2021","2021-11-08","2021-11-13","2021-11-15"
"11-15","Cuarto Dining Commons","Davis campus","11/14/2021","2021-11-14","2021-11-14","2021-11-15"
"11-15","Sciences Lab Building","Davis campus","11/10/2021","2021-11-10","2021-11-10","2021-11-15"
"11-15","Olson Hall","Davis campus","11/10/2021","2021-11-10","2021-11-10","2021-11-15"
"11-15","Cruess Hall","Davis campus","11/10/2021","2021-11-10","2021-11-10","2021-11-15"
"11-15","Bainer Hall","Davis campus","11/10/2021","2021-11-10","2021-11-10","2021-11-15"
"11-15","Roessler Hall","Davis campus","11/09/2021","2021-11-09","2021-11-09","2021-11-15"
"11-15","Mathematical Sciences Building","Davis campus","11/08/2021","2021-11-08","2021-11-08","2021-11-15"
"11-15","Sciences Lab Building","Davis campus","11/12/2021","2021-11-12","2021-11-12","2021-11-15"
"11-15","Art Building","Davis campus","11/09/2021","2021-11-09","2021-11-09","2021-11-15"
"11-15","Wellman Hall","Davis campus","11/11/2021","2021-11-11","2021-11-11","2021-11-15"
"11-15","Olson Hall","Davis campus","11/12/2021","2021-11-12","2021-11-12","2021-11-15"
"11-15","Cruess Hall","Davis campus","11/12/2021","2021-11-12","2021-11-12","2021-11-15"
"11-15","Bainer Hall","Davis campus","11/12/2021","2021-11-12","2021-11-12","2021-11-15"
"11-15","Roessler Hall","Davis campus","11/11/2021","2021-11-11","2021-11-11","2021-11-15"
"11-15","Manetti Shrem Museum","Davis campus","11/13/2021","2021-11-13","2021-11-13","2021-11-15"
"11-15","Harding Hall","Davis campus","11/09/2021","2021-11-09","2021-11-09","2021-11-15"
"11-15","Olson Hall","Davis campus","11/08/2021","2021-11-08","2021-11-08","2021-11-15"
"11-15","Cruess Hall","Davis campus","11/08/2021","2021-11-08","2021-11-08","2021-11-15"
"11-15","Bainer Hall","Davis campus","11/08/2021","2021-11-08","2021-11-08","2021-11-15"
"11-15","Chancellor's Residence","Davis campus","11/14/2021","2021-11-14","2021-11-14","2021-11-15"
"11-16","South Hall","Davis campus","11/15/2021","2021-11-15","2021-11-15","2021-11-16"
"11-16","Social Sciences & Humanities Building","Davis campus","11/16/2021","2021-11-16","2021-11-16","2021-11-16"
"11-16","Coffee Center","Davis campus","11/15/2021","2021-11-15","2021-11-15","2021-11-16"
"11-16","Social Sciences & Humanities","Davis campus","11/16/2021","2021-11-16","2021-11-16","2021-11-16"
"11-17","Unitrans Maintenance Facility","Davis campus","11/16/2021","2021-11-16","2021-11-16","2021-11-17"
"11-17","Haring Hall","Davis campus","11/15/2021","2021-11-15","2021-11-15","2021-11-17"
"11-17","Shields Library","Davis campus","11/15/2021","2021-11-15","2021-11-15","2021-11-17"
"11-17","Vet Med 3A","Davis campus","11/16/2021","2021-11-16","2021-11-16","2021-11-17"
"11-17","Sciences Lecture Hall","Davis campus","11/16/2021","2021-11-16","2021-11-16","2021-11-17"
"11-17","Wellman Hall","Davis campus","11/15/2021","2021-11-15","2021-11-15","2021-11-17"
"11-17","The Grove (Surge III)","Davis campus","11/10/2021","2021-11-10","2021-11-10","2021-11-17"
"11-17","Sciences Lab Building","Davis campus","11/16/2021","2021-11-16","2021-11-16","2021-11-17"
"11-18","Memorial Union","Davis campus","11/12/2021","2021-11-12","2021-11-12","2021-11-18"
"11-18","Olson Hall","Davis campus","11/17/2021","2021-11-17","2021-11-17","2021-11-18"
"11-18","Wellman Hall","Davis campus","11/16/2021","2021-11-16","2021-11-16","2021-11-18"
"11-18","Social Sciences & Humanities","Davis campus","11/15/2021","2021-11-15","2021-11-15","2021-11-18"
"11-18","Student Heath & Counseling Services","Davis campus","11/17/2021","2021-11-17","2021-11-17","2021-11-18"
"11-18","Equestrian Center","Davis campus","11/16/2021","2021-11-16","2021-11-16","2021-11-18"
"11-18","Wellman Hall","Davis campus","11/15/2021","2021-11-15","2021-11-15","2021-11-18"
"11-19","Meyer Hall","Davis campus","11/17/2021","2021-11-17","2021-11-17","2021-11-19"
"11-19","Social Sciences & Humanities","Davis campus","11/17/2021","2021-11-17","2021-11-17","2021-11-19"
"11-19","Sciences Lab Building","Davis campus","11/16/2021","2021-11-16","2021-11-16","2021-11-19"
"11-19","Shields Library","Davis campus","11/17/2021","2021-11-17","2021-11-17","2021-11-19"
"11-19","Sciences Lab Building","Davis campus","11/18/2021","2021-11-18","2021-11-18","2021-11-19"
"11-22","Earth and Physical Sciences","Davis campus","11/18/2021","2021-11-18","2021-11-18","2021-11-22"
"11-22","Wellman Hall","Davis campus","11/19/2021","2021-11-19","2021-11-19","2021-11-22"
"11-22","California Hall","Davis campus","11/17/2021
 - 11/19/2021","2021-11-17","2021-11-19","2021-11-22"
"11-22","Young Hall","Davis campus","11/19/2021","2021-11-19","2021-11-19","2021-11-22"
"11-22","Kerr Hall","Davis campus","11/17/2021","2021-11-17","2021-11-17","2021-11-22"
"11-22","Mathematical Sciences Building","Davis campus","11/18/2021","2021-11-18","2021-11-18","2021-11-22"
"11-22","Sciences Lecture Hall","Davis campus","11/19/2021","2021-11-19","2021-11-19","2021-11-22"
"11-22","Bainer Hall","Davis campus","11/19/2021","2021-11-19","2021-11-19","2021-11-22"
"11-22","Young Hall","Davis campus","11/15/2021","2021-11-15","2021-11-15","2021-11-22"
"11-22","Sciences Lab Building","Davis campus","11/17/2021","2021-11-17","2021-11-17","2021-11-22"
"11-22","Kerr Hall","Davis campus","11/19/2021","2021-11-19","2021-11-19","2021-11-22"
"11-22","Art Annex","Davis campus","11/18/2021","2021-11-18","2021-11-18","2021-11-22"
"11-22","Chemistry Annex","Davis campus","11/18/2021","2021-11-18","2021-11-18","2021-11-22"
"11-22","Olson Hall","Davis campus","11/18/2021","2021-11-18","2021-11-18","2021-11-22"
"11-22","California Hall","Davis campus","11/15/2021","2021-11-15","2021-11-15","2021-11-22"
"11-22","Young Hall","Davis campus","11/17/2021","2021-11-17","2021-11-17","2021-11-22"
"11-22","Kerr Hall","Davis campus","11/15/2021","2021-11-15","2021-11-15","2021-11-22"
"11-22","Bainer Hall","Davis campus","11/15/2021","2021-11-15","2021-11-15","2021-11-22"
"11-22","Cruess Hall","Davis campus","11/19/2021","2021-11-19","2021-11-19","2021-11-22"
"11-23","California National Primate Research Center","Davis campus","11/18/2021","2021-11-18","2021-11-18","2021-11-23"
"11-23","California Hall","Davis campus","11/19/2021","2021-11-19","2021-11-19","2021-11-23"
"11-23","Latitude Dining Commons","Davis campus","11/22/2021","2021-11-22","2021-11-22","2021-11-23"
"11-23","Kemper Hall","Davis campus","11/19/2021","2021-11-19","2021-11-19","2021-11-23"
"11-23","Storer Hall","Davis campus","11/18/2021","2021-11-18","2021-11-18","2021-11-23"
"11-23","Olson Hall","Davis campus","11/19/2021","2021-11-19","2021-11-19","2021-11-23"
"11-23","Cuarto Dining Commons","Davis campus","11/21/2021","2021-11-21","2021-11-21","2021-11-23"
"11-23","Segundo Dining Commons","Davis campus","11/17/2021
 - 11/22/2021","2021-11-17","2021-11-22","2021-11-23"
"11-23","Kemper Hall","Davis campus","11/18/2021","2021-11-18","2021-11-18","2021-11-23"
"11-23","Temporary Building 9","Davis campus","11/22/2021","2021-11-22","2021-11-22","2021-11-23"
"11-23","Geidt Hall","Davis campus","11/17/2021
 - 11/18/2021","2021-11-17","2021-11-18","2021-11-23"
"11-24","Sciences Lecture Hall","Davis campus","11/19/2021","2021-11-19","2021-11-19","2021-11-24"
"11-24","Young Hall","Davis campus","11/22/2021","2021-11-22","2021-11-22","2021-11-24"
"11-24","Sciences Lecture Hall","Davis campus","11/22/2021","2021-11-22","2021-11-22","2021-11-24"
"11-24","Kleiber Hall","Davis campus","11/22/2021","2021-11-22","2021-11-22","2021-11-24"
"11-24","California National Primate Research Center","Davis campus","11/19/2021","2021-11-19","2021-11-19","2021-11-24"
"11-24","Haring Hall","Davis campus","11/19/2021","2021-11-19","2021-11-19","2021-11-24"
"11-24","Tercero Dining Commons","Davis campus","11/22/2021","2021-11-22","2021-11-22","2021-11-24"
"11-29","Shields Library","Davis campus","11/28/2021","2021-11-28","2021-11-28","2021-11-29"
"11-29","Green Hall (Life Sciences)","Davis campus","11/24/2021","2021-11-24","2021-11-24","2021-11-29"
"11-30","California National Primate Research Center","Davis campus","11/23/2021","2021-11-23","2021-11-23","2021-11-30"
"11-30","Storer Hall Research Lab","Davis campus","11/23/2021","2021-11-23","2021-11-23","2021-11-30"
"11-30","Center for Immunology & Infectious Diseases (CIID)","Davis campus","11/29/2021","2021-11-29","2021-11-29","2021-11-30"
"11-30","Hunt Hall","Davis campus","11/29/2021","2021-11-29","2021-11-29","2021-11-30"
"11-30","California Hall","Davis campus","11/23/2021","2021-11-23","2021-11-23","2021-11-30"
"11-30","Meyer Hall","Davis campus","11/29/2021","2021-11-29","2021-11-29","2021-11-30"
"11-30","Olson Hall","Davis campus","11/23/2021","2021-11-23","2021-11-23","2021-11-30"
"11-30","Giedt Hall","Davis campus","11/29/2021","2021-11-29","2021-11-29","2021-11-30"
"12-13","Unitrans Maintenance Facility","Davis campus","12/07/2021","2021-12-07","2021-12-07","2021-12-13"
"12-14","Kleiber Hall","Davis campus","12/14/2021","2021-12-14","2021-12-14","2021-12-14"
"12-15","Human Resources Administration Building","Davis campus","12/14/2021","2021-12-14","2021-12-14","2021-12-15"
"12-15","Medical Sciences 1B","Davis campus","12/14/2021","2021-12-14","2021-12-14","2021-12-15"
"12-15","Pritchard VMTH","Davis campus","12/14/2021","2021-12-14","2021-12-14","2021-12-15"
"12-16","Kearney Hall","Davis campus","12/11/2021","2021-12-11","2021-12-11","2021-12-16"
"12-17","Manetti Shrem Museum","Davis campus","12/17/2021","2021-12-17","2021-12-17","2021-12-17"
"12-21","UC Pavement Research Center","Davis campus","12/16/2021
 - 12/17/2021","2021-12-16","2021-12-17","2021-12-21"
"12-21","Academic Surge HRVIP Lab","Davis campus","12/17/2021","2021-12-17","2021-12-17","2021-12-21"
"12-21","Activities and Recreation Center","Davis campus","12/16/2021","2021-12-16","2021-12-16","2021-12-21"
"12-21","Bainer Hall","Davis campus","12/16/2021","2021-12-16","2021-12-16","2021-12-21"
"12-21","Vet Med Teaching Hospital","Davis campus","12/20/2021","2021-12-20","2021-12-20","2021-12-21"
"12-21","King Hall","Davis campus","12/20/2021","2021-12-20","2021-12-20","2021-12-21"
"12-27","Vet Med Teaching Hospital","Davis campus","12/24/2021","2021-12-24","2021-12-24","2021-12-27"
"12-27","Veihmeyer Hall","Davis campus","12/20/2021","2021-12-20","2021-12-20","2021-12-27"
"12-27","Activities and Recreation Center","Davis campus","12/16/2021","2021-12-16","2021-12-16","2021-12-27"
"12-27","Activities and Recreation Center","Davis campus","12/21/2021","2021-12-21","2021-12-21","2021-12-27"
"12-27","Chemistry Annex","Davis campus","12/20/2021","2021-12-20","2021-12-20","2021-12-27"
"12-27","Meyer Hall","Davis campus","12/22/2021","2021-12-22","2021-12-22","2021-12-27"
"12-27","Chemistry Building","Davis campus","12/20/2021","2021-12-20","2021-12-20","2021-12-27"
"12-22","Activities and Recreation Center","Davis campus","12/16/2021","2021-12-16","2021-12-16","2021-12-22"
"12-28","Tercero Admin Building","Davis campus","12/27/2021","2021-12-27","2021-12-27","2021-12-28"
"12-29","Tupper Hall","Davis campus","12/28/2021","2021-12-28","2021-12-28","2021-12-29"
"01-04","Live Oak Hall","Davis campus","01/02/2022","2022-01-02","2022-01-02","2022-01-04"
"01-04","VMTH Clinical Labs","Davis campus","12/29/2021","2021-12-29","2021-12-29","2022-01-04"
"01-03","Veterinary Medical Teaching Hospital","Davis campus","12/30/2021","2021-12-30","2021-12-30","2022-01-03"
"01-03","Hoagland Hall","Davis campus","12/28/2021","2021-12-28","2021-12-28","2022-01-03"
"12-30","Activities and Recreation Center","Davis campus","12/28/2021","2021-12-28","2021-12-28","2021-12-30"
"12-30","University Credit Union Center","Davis campus","12/27/2021","2021-12-27","2021-12-27","2021-12-30"
"01-06","Fire Department","Davis campus","01/02/2022","2022-01-02","2022-01-02","2022-01-06"
"01-06","Carlson Health Sciences Library","Davis campus","01/04/2022","2022-01-04","2022-01-04","2022-01-06"
"01-06","Latitude Dining Commons","Davis campus","01/03/2022","2022-01-03","2022-01-03","2022-01-06"
"01-06","Tercero Dining Commons","Davis campus","01/03/2022
 - 01/04/2022","2022-01-03","2022-01-04","2022-01-06"
"01-06","Teaching & Learning Complex","Davis campus","01/03/2022","2022-01-03","2022-01-03","2022-01-06"
"01-06","Campus Bookstore","Davis campus","01/03/2022
 - 01/04/2022","2022-01-03","2022-01-04","2022-01-06"
"01-06","Hickey Gym","Davis campus","01/01/2022","2022-01-01","2022-01-01","2022-01-06"
"01-06","Student Health & Wellness Center","Davis campus","01/04/2022","2022-01-04","2022-01-04","2022-01-06"
"01-06","CAHFS-Turlock Laboratory","Off campus","01/03/2022","2022-01-03","2022-01-03","2022-01-06"
"01-06","Segundo Dining Commons","Davis campus","01/02/2022
 - 01/05/2022","2022-01-02","2022-01-05","2022-01-06"
"01-06","Activities and Recreation Center","Davis campus","01/02/2022
 - 01/04/2022","2022-01-02","2022-01-04","2022-01-06"
"01-06","Human Resources Administration Building","Davis campus","01/03/2022","2022-01-03","2022-01-03","2022-01-06"
"01-06","Shields Library","Davis campus","01/03/2022","2022-01-03","2022-01-03","2022-01-06"
"01-06","Teaching & Learning Complex","Davis campus","12/29/2021","2021-12-29","2021-12-29","2022-01-06"
"01-07","H-Building Vet Lab","Davis campus","01/05/2022","2022-01-05","2022-01-05","2022-01-07"
"01-07","Vet Med 3A","Davis campus","01/05/2022","2022-01-05","2022-01-05","2022-01-07"
"01-07","VMTH Large Animal Clinic","Davis campus","01/04/2022","2022-01-04","2022-01-04","2022-01-07"
"01-10","Cuarto Dining Commons","Davis campus","01/06/2022","2022-01-06","2022-01-06","2022-01-10"
"01-10","Student Health & Wellness Center","Davis campus","01/07/2022","2022-01-07","2022-01-07","2022-01-10"
"01-10","Latitude Dining Commons","Davis campus","01/07/2022","2022-01-07","2022-01-07","2022-01-10"
"01-10","California National Primate Research Center","Davis campus","01/07/2022","2022-01-07","2022-01-07","2022-01-10"
"01-10","Segundo Dining Commons","Davis campus","01/07/2022","2022-01-07","2022-01-07","2022-01-10"
"01-10","Meyer Hall","Davis campus","01/03/2022
 - 01/04/2022","2022-01-03","2022-01-04","2022-01-10"
"01-10","Tercero Market","Davis campus","01/07/2022","2022-01-07","2022-01-07","2022-01-10"
"01-10","Equestrian Center","Davis campus","01/08/2022","2022-01-08","2022-01-08","2022-01-10"
"01-10","Vet Med Teaching Hospital","Davis campus","01/08/2022","2022-01-08","2022-01-08","2022-01-10"
"01-10","Teaching & Learning Complex","Davis campus","01/05/2022","2022-01-05","2022-01-05","2022-01-10"
"01-10","Tercero Dining Commons","Davis campus","01/05/2022
 - 01/07/2022","2022-01-05","2022-01-07","2022-01-10"
"01-10","Hunt Hall","Davis campus","01/07/2022","2022-01-07","2022-01-07","2022-01-10"
"01-10","Center for Equine Health","Davis campus","01/06/2022","2022-01-06","2022-01-06","2022-01-10"
"01-11","Shields Library","Davis campus","01/07/2022","2022-01-07","2022-01-07","2022-01-11"
"01-11","Tercero Dining Commons","Davis campus","01/10/2022","2022-01-10","2022-01-10","2022-01-11"
"01-11","Shields Library","Davis campus","01/10/2022","2022-01-10","2022-01-10","2022-01-11"
"01-11","RMI Brewery, Winery, and Food Pilot Facility","Davis campus","01/10/2022","2022-01-10","2022-01-10","2022-01-11"
"01-11","Student Housing & Dining Services","Davis campus","01/09/2022","2022-01-09","2022-01-09","2022-01-11"
"01-12","Live Oak Hall","Davis campus","01/11/2022","2022-01-11","2022-01-11","2022-01-12"
"01-12","Cottonwood Hall","Davis campus","01/04/2022","2022-01-04","2022-01-04","2022-01-12"
"01-12","Currant Hall","Davis campus","01/07/2022","2022-01-07","2022-01-07","2022-01-12"
"01-12","Laben Hall","Davis campus","01/04/2022","2022-01-04","2022-01-04","2022-01-12"
"01-12","Paloma Hall","Davis campus","01/03/2022","2022-01-03","2022-01-03","2022-01-12"
"01-12","Potter Hall","Davis campus","01/04/2022","2022-01-04","2022-01-04","2022-01-12"
"01-12","Ryerson Hall","Davis campus","01/04/2022","2022-01-04","2022-01-04","2022-01-12"
"01-12","Sequoia Hall","Davis campus","01/07/2022","2022-01-07","2022-01-07","2022-01-12"
"01-12","International Center","Davis campus","01/10/2022","2022-01-10","2022-01-10","2022-01-12"
"01-12","Talara Hall","Davis campus","01/05/2022","2022-01-05","2022-01-05","2022-01-12"
"01-12","Tupper Hall","Davis campus","01/10/2022","2022-01-10","2022-01-10","2022-01-12"
"01-12","Tercero Dining Commons","Davis campus","01/10/2022
 - 01/11/2022","2022-01-10","2022-01-11","2022-01-12"
"01-12","Teaching and Learning Complex","Davis campus","01/05/2022","2022-01-05","2022-01-05","2022-01-12"
"01-12","Cuarto Hall","Davis campus","01/04/2022","2022-01-04","2022-01-04","2022-01-12"
"01-12","Gilmore Hall","Davis campus","01/04/2022","2022-01-04","2022-01-04","2022-01-12"
"01-12","Laben Hall","Davis campus","01/07/2022","2022-01-07","2022-01-07","2022-01-12"
"01-12","Pine Hall","Davis campus","01/04/2022","2022-01-04","2022-01-04","2022-01-12"
"01-12","Redwood Hall","Davis campus","01/04/2022","2022-01-04","2022-01-04","2022-01-12"
"01-12","Ryerson Hall","Davis campus","01/08/2022","2022-01-08","2022-01-08","2022-01-12"
"01-12","Shasta Hall","Davis campus","01/03/2022","2022-01-03","2022-01-03","2022-01-12"
"01-12","Hoagland Hall","Davis campus","01/11/2022","2022-01-11","2022-01-11","2022-01-12"
"01-12","TB 13","Davis campus","01/06/2022","2022-01-06","2022-01-06","2022-01-12"
"01-12","UC Davis Bookstore","Davis campus","01/10/2022","2022-01-10","2022-01-10","2022-01-12"
"01-12","Latitude Dining Commons","Davis campus","01/11/2022","2022-01-11","2022-01-11","2022-01-12"
"01-12","Bixby Hall","Davis campus","01/06/2022","2022-01-06","2022-01-06","2022-01-12"
"01-03","Tahoe Hall","Davis campus","01/03/2022","2022-01-03","2022-01-03","2022-01-03"
"01-12","Segundo Dining Commons","Davis campus","01/10/2022","2022-01-10","2022-01-10","2022-01-12"
"01-12","Tercero Hall","Davis campus","01/04/2022","2022-01-04","2022-01-04","2022-01-12"
"01-12","Everson Hall","Davis campus","01/10/2022","2022-01-10","2022-01-10","2022-01-12"
"01-12","Valley Hall","Davis campus","01/07/2022","2022-01-07","2022-01-07","2022-01-12"
"01-12","The Green at West Village","Davis campus","01/05/2022","2022-01-05","2022-01-05","2022-01-12"
"01-12","Wall Hall","Davis campus","01/04/2022","2022-01-04","2022-01-04","2022-01-12"
"01-12","Ticon II","Off campus","01/04/2022","2022-01-04","2022-01-04","2022-01-12"
"01-12","Yosemite Hall","Davis campus","01/02/2022","2022-01-02","2022-01-02","2022-01-12"
"01-12","Currant Hall","Davis campus","01/04/2022","2022-01-04","2022-01-04","2022-01-12"
"01-12","Kearney Hall","Davis campus","01/05/2022
 - 01/07/2022","2022-01-05","2022-01-07","2022-01-12"
"01-12","Malcolm Hall","Davis campus","01/03/2022","2022-01-03","2022-01-03","2022-01-12"
"01-12","Pine Hall","Davis campus","01/07/2022","2022-01-07","2022-01-07","2022-01-12"
"01-12","Rienda Hall","Davis campus","01/03/2022
 - 01/04/2022","2022-01-03","2022-01-04","2022-01-12"
"01-12","Sequoia Hall","Davis campus","01/05/2022","2022-01-05","2022-01-05","2022-01-12"
"01-13","Segundo Dining Commons","Davis campus","01/11/2022
 - 01/13/2022","2022-01-11","2022-01-13","2022-01-13"
"01-13","Kemper Hall","Davis campus","01/13/2022","2022-01-13","2022-01-13","2022-01-13"
"01-13","Thompson Hall","Davis campus","01/13/2022","2022-01-13","2022-01-13","2022-01-13"
"01-13","Yosemite Hall","Davis campus","01/12/2022","2022-01-12","2022-01-12","2022-01-13"
"01-13","Young Hall","Davis campus","01/12/2022","2022-01-12","2022-01-12","2022-01-13"
"01-13","The Green at West Village - 301 Celadon St.","Davis campus","01/12/2022","2022-01-12","2022-01-12","2022-01-13"
"01-13","Vet Med Teaching Hospital","Davis campus","01/10/2022","2022-01-10","2022-01-10","2022-01-13"
"01-13","Human Resources Administration Building","Davis campus","01/12/2022","2022-01-12","2022-01-12","2022-01-13"
"01-13","UC Davis Student Farm","Davis campus","01/12/2022","2022-01-12","2022-01-12","2022-01-13"
"01-13","UC Davis Silo","Davis campus","01/10/2022","2022-01-10","2022-01-10","2022-01-13"
"01-14","Cuarto Dining Commons","Davis campus","01/11/2022","2022-01-11","2022-01-11","2022-01-14"
"01-14","UC Davis Bookstore","Davis campus","01/14/2022","2022-01-14","2022-01-14","2022-01-14"
"01-14","Genome and Biomedical Sciences Facility","Davis campus","01/14/2022","2022-01-14","2022-01-14","2022-01-14"
"01-14","Shasta Hall","Davis campus","01/13/2022","2022-01-13","2022-01-13","2022-01-14"
"01-14","Controlled Environment Facility-A","Davis campus","01/12/2022","2022-01-12","2022-01-12","2022-01-14"
"01-18","Madrone Hall","Davis campus","01/13/2022","2022-01-13","2022-01-13","2022-01-18"
"01-18","Segundo Dining Commons","Davis campus","01/12/2022","2022-01-12","2022-01-12","2022-01-18"
"01-18","Chemistry","Davis campus","01/14/2022","2022-01-14","2022-01-14","2022-01-18"
"01-18","Police Department","Davis campus","01/14/2022","2022-01-14","2022-01-14","2022-01-18"
"01-18","Tercero Dining Commons","Davis campus","01/13/2022","2022-01-13","2022-01-13","2022-01-18"
"01-18","Sereno Hall","Davis campus","01/13/2022","2022-01-13","2022-01-13","2022-01-18"
"01-18","Haring Hall","Davis campus","01/12/2022","2022-01-12","2022-01-12","2022-01-18"
"01-18","Medical Sciences D","Davis campus","01/14/2022","2022-01-14","2022-01-14","2022-01-18"
"01-18","Tupper Hall","Davis campus","01/14/2022","2022-01-14","2022-01-14","2022-01-18"
"01-18","Campus Store / Memorial Union","Davis campus","01/13/2022","2022-01-13","2022-01-13","2022-01-18"
"01-18","Latitude Dining Commons","Davis campus","01/13/2022","2022-01-13","2022-01-13","2022-01-18"
"01-18","UC Davis Bookstore","Davis campus","01/14/2022","2022-01-14","2022-01-14","2022-01-18"
"01-18","Design & Construction Management","Davis campus","01/18/2022","2022-01-18","2022-01-18","2022-01-18"
"01-18","Segundo Dining Commons","Davis campus","01/18/2022","2022-01-18","2022-01-18","2022-01-18"
"01-19","Segundo Dining Commons","Davis campus","01/17/2022
 - 01/18/2022","2022-01-17","2022-01-18","2022-01-19"
"01-19","Veterinary Teaching Hospital","Davis campus","01/16/2022","2022-01-16","2022-01-16","2022-01-19"
"01-19","Hawthorn Hall","Davis campus","01/18/2022","2022-01-18","2022-01-18","2022-01-19"
"01-19","Miller Hall","Davis campus","01/18/2022","2022-01-18","2022-01-18","2022-01-19"
"01-19","Plant and Environmental Sciences","Davis campus","01/18/2022","2022-01-18","2022-01-18","2022-01-19"
"01-19","Tercero Dining Commons","Davis campus","01/17/2022","2022-01-17","2022-01-17","2022-01-19"
"01-19","Activities and Recreation Center","Davis campus","01/16/2022","2022-01-16","2022-01-16","2022-01-19"
"01-19","Memorial Union","Davis campus","01/18/2022","2022-01-18","2022-01-18","2022-01-19"
"01-20","UC Pavement Research Center","Davis campus","01/18/2022","2022-01-18","2022-01-18","2022-01-20"
"01-20","Tercero Dining Commons","Davis campus","01/18/2022
 - 01/19/2022","2022-01-18","2022-01-19","2022-01-20"
"01-20","Cuarto Dining Commons","Davis campus","01/19/2022","2022-01-19","2022-01-19","2022-01-20"
"01-20","Latitude Dining Commons","Davis campus","01/19/2022","2022-01-19","2022-01-19","2022-01-20"
"01-20","Shields Library","Davis campus","01/19/2022","2022-01-19","2022-01-19","2022-01-20"
"01-20","Vet Med Teaching Hospital","Davis campus","01/19/2022","2022-01-19","2022-01-19","2022-01-20"
"01-20","Activities and Recreation Center","Davis campus","01/18/2022","2022-01-18","2022-01-18","2022-01-20"
"01-20","Scrubs Caf","Davis campus","01/18/2022","2022-01-18","2022-01-18","2022-01-20"
"01-20","Sage Street Market","Davis campus","01/19/2022","2022-01-19","2022-01-19","2022-01-20"
"01-20","Scrub Oak Hall","Davis campus","01/19/2022","2022-01-19","2022-01-19","2022-01-20"
"01-20","The Green at West Village","Davis campus","01/18/2022","2022-01-18","2022-01-18","2022-01-20"
"01-20","Memorial Union","Davis campus","01/18/2022","2022-01-18","2022-01-18","2022-01-20"
"01-20","Silo","Davis campus","01/19/2022","2022-01-19","2022-01-19","2022-01-20"
"01-12","Tahoe Hall","Davis campus","01/03/2022","2022-01-03","2022-01-03","2022-01-12"
"01-21","Thompson Hall","Davis campus","01/20/2022","2022-01-20","2022-01-20","2022-01-21"
"01-21","Communications Resources Trailer","Davis campus","01/19/2022","2022-01-19","2022-01-19","2022-01-21"
"01-21","Cuarto Dining Commons","Davis campus","01/20/2022","2022-01-20","2022-01-20","2022-01-21"
"01-21","Center for Mind and Brain","Davis campus","01/20/2022","2022-01-20","2022-01-20","2022-01-21"
"01-21","Genome and Biomedical Sciences","Davis campus","01/19/2022","2022-01-19","2022-01-19","2022-01-21"
"01-21","Segundo Dining Commons","Davis campus","01/19/2022","2022-01-19","2022-01-19","2022-01-21"
"01-21","Center for Companion Animal Health","Davis campus","01/18/2022","2022-01-18","2022-01-18","2022-01-21"
"01-20","Tercero Dinning Commons","Davis campus","01/20/2022","2022-01-20","2022-01-20","2022-01-20"
"01-24","Schaal Aquatic Center","Davis campus","01/23/2022","2022-01-23","2022-01-23","2022-01-24"
"01-24","Meyer Hall","Davis campus","01/20/2022","2022-01-20","2022-01-20","2022-01-24"
"01-24","Malcolm Hall","Davis campus","01/24/2022","2022-01-24","2022-01-24","2022-01-24"
"01-24","Chemistry Annex","Davis campus","01/21/2022","2022-01-21","2022-01-21","2022-01-24"
"01-24","Latitude Dining Commons","Davis campus","01/22/2022","2022-01-22","2022-01-22","2022-01-24"
"01-24","Davis Shields Library","Davis campus","01/21/2022
 - 01/23/2022","2022-01-21","2022-01-23","2022-01-24"
"01-24","Cottonwood Hall","Davis campus","01/23/2022","2022-01-23","2022-01-23","2022-01-24"
"01-24","Cuarto Dining Commons","Davis campus","01/20/2022","2022-01-20","2022-01-20","2022-01-24"
"01-24","Tercero Market","Davis campus","01/21/2022","2022-01-21","2022-01-21","2022-01-24"
"01-24","Memorial Union","Davis campus","01/19/2022","2022-01-19","2022-01-19","2022-01-24"
"01-24","Gilmore Hall","Davis campus","01/23/2022","2022-01-23","2022-01-23","2022-01-24"
"01-24","Tercero Dining Commons","Davis campus","01/22/2022","2022-01-22","2022-01-22","2022-01-24"
"01-25","Redwood Hall","Davis campus","01/24/2022","2022-01-24","2022-01-24","2022-01-25"
"01-25","Ryerson Hall","Davis campus","01/25/2022","2022-01-25","2022-01-25","2022-01-25"
"01-25","Henry Alder Hall","Davis campus","01/23/2022","2022-01-23","2022-01-23","2022-01-25"
"01-25","Segundo Dining Commons","Davis campus","01/23/2022
 - 01/24/2022","2022-01-23","2022-01-24","2022-01-25"
"01-25","Tercero Dining Commons","Davis campus","01/23/2022
 - 01/24/2022","2022-01-23","2022-01-24","2022-01-25"
"01-25","Teaching and Learning Complex","Davis campus","01/18/2022","2022-01-18","2022-01-18","2022-01-25"
"01-25","Latitude Dining Commons","Davis campus","01/23/2022","2022-01-23","2022-01-23","2022-01-25"
"01-25","Segundo Market","Davis campus","01/24/2022","2022-01-24","2022-01-24","2022-01-25"
"01-25","Memorial Union","Davis campus","01/24/2022","2022-01-24","2022-01-24","2022-01-25"
"01-26","Student Health & Wellness Center","Davis campus","01/24/2022","2022-01-24","2022-01-24","2022-01-26"
"01-26","Art Building","Davis campus","01/24/2022","2022-01-24","2022-01-24","2022-01-26"
"01-26","Peter J. Shields Library","Davis campus","01/23/2022","2022-01-23","2022-01-23","2022-01-26"
"01-26","Cuarto Dining Commons","Davis campus","01/24/2022","2022-01-24","2022-01-24","2022-01-26"
"01-26","Latitude Dining Commons","Davis campus","01/24/2022","2022-01-24","2022-01-24","2022-01-26"
"01-26","Meyer Hall","Davis campus","01/24/2022","2022-01-24","2022-01-24","2022-01-26"
"01-26","Fire & Police Building","Davis campus","01/23/2022","2022-01-23","2022-01-23","2022-01-26"
"01-26","Malcolm Hall","Davis campus","01/25/2022
 - 01/26/2022","2022-01-25","2022-01-26","2022-01-26"
"01-26","Peter J. Shields Library","Davis campus","01/25/2022","2022-01-25","2022-01-25","2022-01-26"
"01-26","Asmundson Hall","Davis campus","01/24/2022","2022-01-24","2022-01-24","2022-01-26"
"01-26","Redwood Hall","Davis campus","01/25/2022","2022-01-25","2022-01-25","2022-01-26"
"01-26","Activities & Recreation Center","Davis campus","01/24/2022","2022-01-24","2022-01-24","2022-01-26"
"01-26","Tercero Dinning Commons","Davis campus","01/25/2022","2022-01-25","2022-01-25","2022-01-26"
"01-26","Waste Water Treatment Plant","Davis campus","01/25/2022","2022-01-25","2022-01-25","2022-01-26"
"01-26","Tercero Dining Commons","Davis campus","01/23/2022","2022-01-23","2022-01-23","2022-01-26"
"01-26","Craft Center","Davis campus","01/23/2022
 - 01/24/2022","2022-01-23","2022-01-24","2022-01-26"
"01-26","Shasta Hall","Davis campus","01/25/2022","2022-01-25","2022-01-25","2022-01-26"
"01-26","Cottonwood Hall","Davis campus","01/25/2022","2022-01-25","2022-01-25","2022-01-26"
"01-26","King Hall","Davis campus","01/24/2022","2022-01-24","2022-01-24","2022-01-26"
"01-24","Peter J. Shields Library","Davis campus","01/21/2022
 - 01/23/2022","2022-01-21","2022-01-23","2022-01-24"
"01-20","Peter J. Shields Library","Davis campus","01/19/2022","2022-01-19","2022-01-19","2022-01-20"
"01-27","Vet Med Teaching Hospital","Davis campus","01/25/2022","2022-01-25","2022-01-25","2022-01-27"
"01-27","Laben Hall","Davis campus","01/26/2022","2022-01-26","2022-01-26","2022-01-27"
"01-27","Peter J. Shields Library","Davis campus","01/25/2022","2022-01-25","2022-01-25","2022-01-27"
