"","campus_building","worksite","report_date","location","potential_exposure_dates","start","end","standardized_exposure_dates","geometry"
"2","112 A Street","112 A Street","07-15","Davis city","07/11/2022","2022-07-11","2022-07-11","2022-07-15",list()
"3","1333 Research Park Drive","1333 Research Park Drive","11-01","Davis city","10/31/2022","2022-10-31","2022-10-31","2022-11-01",list()
"4","1441 Research Park Drive","1441 Research Park Drive","07-12","Davis city","07/10/2022","2022-07-10","2022-07-10","2022-07-12",list()
"5","1450 Drew Avenue","1450 Drew Avenue","09-08","Davis city","09/06/2022","2022-09-06","2022-09-06","2022-09-08",list()
"6","1515 Newton Court","1515 Newton Court","04-25","Davis city","04/22/2022","2022-04-22","2022-04-22","2022-04-25",list()
"7","1515 Newton Court","1515 Newton Court","04-25","Davis city","04/22/2022","2022-04-22","2022-04-22","2022-04-25",list()
"8","1515 Newton Court","1515 Newton Court","07-29","Davis campus","07/28/2022","2022-07-28","2022-07-28","2022-07-29",list()
"9","1515 Newton Court","1515 Newton Court","07-29","Davis campus","07/28/2022","2022-07-28","2022-07-28","2022-07-29",list()
"10","1544 Newton Court","1544 Newton Court","08-05","Davis city","08/03/2022","2022-08-03","2022-08-03","2022-08-05",list()
"11","1544 Newton Court","1544 Newton Court","08-05","Davis city","08/03/2022","2022-08-03","2022-08-03","2022-08-05",list()
"12","1544 Newton Court","1544 Newton Court","07-13","Davis city","07/12/2022","2022-07-12","2022-07-12","2022-07-13",list()
"13","1544 Newton Court","1544 Newton Court","07-13","Davis city","07/12/2022","2022-07-12","2022-07-12","2022-07-13",list()
"18","1632 Da Vinci Court","1632 Da Vinci Court","07-06","Davis city","07/02/2022","2022-07-02","2022-07-02","2022-07-06",list()
"19","1850 Research Park Drive","1850 Research Park Drive","09-02","Davis city","09/01/2022","2022-09-01","2022-09-01","2022-09-02",list()
"20","1850 Research Park Drive","1850 Research Park Drive","09-02","Davis city","09/01/2022","2022-09-01","2022-09-01","2022-09-02",list()
"21","1850 Research Park Drive","1850 Research Park Drive","05-18","Davis city","05/16/2022","2022-05-16","2022-05-16","2022-05-18",list()
"22","1850 Research Park Drive","1850 Research Park Drive","05-18","Davis city","05/16/2022","2022-05-16","2022-05-16","2022-05-18",list()
"23","202 Cousteau Place","202 Cousteau Place","08-01","Davis campus","07/28/2022","2022-07-28","2022-07-28","2022-08-01",list()
"24","202 Cousteau Place","202 Cousteau Place","08-01","Davis campus","07/28/2022","2022-07-28","2022-07-28","2022-08-01",list()
"25","202 Cousteau Place","202 Cousteau Place","08-01","Davis campus","07/28/2022","2022-07-28","2022-07-28","2022-08-01",list()
"26","202 Cousteau Place","202 Cousteau Place","08-01","Davis campus","07/28/2022","2022-07-28","2022-07-28","2022-08-01",list()
"27","202 Cousteau Place","202 Cousteau Place","08-01","Davis campus","07/28/2022","2022-07-28","2022-07-28","2022-08-01",list()
"28","202 Cousteau Place","202 Cousteau Place","08-01","Davis campus","07/28/2022","2022-07-28","2022-07-28","2022-08-01",list()
"29","202 Cousteau Place","202 Cousteau Place","08-01","Davis campus","07/28/2022","2022-07-28","2022-07-28","2022-08-01",list()
"30","202 Cousteau Place","202 Cousteau Place","08-01","Davis campus","07/28/2022","2022-07-28","2022-07-28","2022-08-01",list()
"31","202 Cousteau Place","202 Cousteau Place","08-01","Davis campus","07/28/2022","2022-07-28","2022-07-28","2022-08-01",list()
"32","202 Cousteau Place","202 Cousteau Place","08-01","Davis campus","07/28/2022","2022-07-28","2022-07-28","2022-08-01",list()
"33","202 Cousteau Place","202 Cousteau Place","05-16","Davis city","05/10/2022
 - 05/11/2022","2022-05-10","2022-05-11","2022-05-16",list()
"34","202 Cousteau Place","202 Cousteau Place","05-16","Davis city","05/10/2022
 - 05/11/2022","2022-05-10","2022-05-11","2022-05-16",list()
"35","202 Cousteau Place","202 Cousteau Place","05-16","Davis city","05/10/2022
 - 05/11/2022","2022-05-10","2022-05-11","2022-05-16",list()
"36","202 Cousteau Place","202 Cousteau Place","05-16","Davis city","05/10/2022
 - 05/11/2022","2022-05-10","2022-05-11","2022-05-16",list()
"37","202 Cousteau Place","202 Cousteau Place","05-16","Davis city","05/10/2022
 - 05/11/2022","2022-05-10","2022-05-11","2022-05-16",list()
"38","202 Cousteau Place","202 Cousteau Place","05-16","Davis city","05/10/2022
 - 05/11/2022","2022-05-10","2022-05-11","2022-05-16",list()
"39","202 Cousteau Place","202 Cousteau Place","05-16","Davis city","05/10/2022
 - 05/11/2022","2022-05-10","2022-05-11","2022-05-16",list()
"40","202 Cousteau Place","202 Cousteau Place","05-16","Davis city","05/10/2022
 - 05/11/2022","2022-05-10","2022-05-11","2022-05-16",list()
"41","202 Cousteau Place","202 Cousteau Place","05-16","Davis city","05/10/2022
 - 05/11/2022","2022-05-10","2022-05-11","2022-05-16",list()
"42","202 Cousteau Place","202 Cousteau Place","05-16","Davis city","05/10/2022
 - 05/11/2022","2022-05-10","2022-05-11","2022-05-16",list()
"43","202 Cousteau Place","202 Cousteau Place","09-19","Davis city","09/15/2022","2022-09-15","2022-09-15","2022-09-19",list()
"44","202 Cousteau Place","202 Cousteau Place","09-19","Davis city","09/15/2022","2022-09-15","2022-09-15","2022-09-19",list()
"45","202 Cousteau Place","202 Cousteau Place","09-19","Davis city","09/15/2022","2022-09-15","2022-09-15","2022-09-19",list()
"46","202 Cousteau Place","202 Cousteau Place","09-19","Davis city","09/15/2022","2022-09-15","2022-09-15","2022-09-19",list()
"47","202 Cousteau Place","202 Cousteau Place","09-19","Davis city","09/15/2022","2022-09-15","2022-09-15","2022-09-19",list()
"48","202 Cousteau Place","202 Cousteau Place","09-19","Davis city","09/15/2022","2022-09-15","2022-09-15","2022-09-19",list()
"49","202 Cousteau Place","202 Cousteau Place","09-19","Davis city","09/15/2022","2022-09-15","2022-09-15","2022-09-19",list()
"50","202 Cousteau Place","202 Cousteau Place","09-19","Davis city","09/15/2022","2022-09-15","2022-09-15","2022-09-19",list()
"51","202 Cousteau Place","202 Cousteau Place","09-19","Davis city","09/15/2022","2022-09-15","2022-09-15","2022-09-19",list()
"52","202 Cousteau Place","202 Cousteau Place","09-19","Davis city","09/15/2022","2022-09-15","2022-09-15","2022-09-19",list()
"53","202 Cousteau Place","202 Cousteau Place","06-08","Davis city","06/08/2022","2022-06-08","2022-06-08","2022-06-08",list()
"54","202 Cousteau Place","202 Cousteau Place","06-08","Davis city","06/08/2022","2022-06-08","2022-06-08","2022-06-08",list()
"55","202 Cousteau Place","202 Cousteau Place","06-08","Davis city","06/08/2022","2022-06-08","2022-06-08","2022-06-08",list()
"56","202 Cousteau Place","202 Cousteau Place","06-08","Davis city","06/08/2022","2022-06-08","2022-06-08","2022-06-08",list()
"57","202 Cousteau Place","202 Cousteau Place","06-08","Davis city","06/08/2022","2022-06-08","2022-06-08","2022-06-08",list()
"58","202 Cousteau Place","202 Cousteau Place","06-08","Davis city","06/08/2022","2022-06-08","2022-06-08","2022-06-08",list()
"59","202 Cousteau Place","202 Cousteau Place","06-08","Davis city","06/08/2022","2022-06-08","2022-06-08","2022-06-08",list()
"60","202 Cousteau Place","202 Cousteau Place","06-08","Davis city","06/08/2022","2022-06-08","2022-06-08","2022-06-08",list()
"61","202 Cousteau Place","202 Cousteau Place","06-08","Davis city","06/08/2022","2022-06-08","2022-06-08","2022-06-08",list()
"62","202 Cousteau Place","202 Cousteau Place","06-08","Davis city","06/08/2022","2022-06-08","2022-06-08","2022-06-08",list()
"63","202 Cousteau Place","202 Cousteau Place","03-09","Davis city","03/04/2022","2022-03-04","2022-03-04","2022-03-09",list()
"64","202 Cousteau Place","202 Cousteau Place","03-09","Davis city","03/04/2022","2022-03-04","2022-03-04","2022-03-09",list()
"65","202 Cousteau Place","202 Cousteau Place","03-09","Davis city","03/04/2022","2022-03-04","2022-03-04","2022-03-09",list()
"66","202 Cousteau Place","202 Cousteau Place","03-09","Davis city","03/04/2022","2022-03-04","2022-03-04","2022-03-09",list()
"67","202 Cousteau Place","202 Cousteau Place","03-09","Davis city","03/04/2022","2022-03-04","2022-03-04","2022-03-09",list()
"68","202 Cousteau Place","202 Cousteau Place","03-09","Davis city","03/04/2022","2022-03-04","2022-03-04","2022-03-09",list()
"69","202 Cousteau Place","202 Cousteau Place","03-09","Davis city","03/04/2022","2022-03-04","2022-03-04","2022-03-09",list()
"70","202 Cousteau Place","202 Cousteau Place","03-09","Davis city","03/04/2022","2022-03-04","2022-03-04","2022-03-09",list()
"71","202 Cousteau Place","202 Cousteau Place","03-09","Davis city","03/04/2022","2022-03-04","2022-03-04","2022-03-09",list()
"72","202 Cousteau Place","202 Cousteau Place","03-09","Davis city","03/04/2022","2022-03-04","2022-03-04","2022-03-09",list()
"73","202 Cousteau Place","202 Cousteau Place","07-12","Davis city","07/05/2022","2022-07-05","2022-07-05","2022-07-12",list()
"74","202 Cousteau Place","202 Cousteau Place","07-12","Davis city","07/05/2022","2022-07-05","2022-07-05","2022-07-12",list()
"75","202 Cousteau Place","202 Cousteau Place","07-12","Davis city","07/05/2022","2022-07-05","2022-07-05","2022-07-12",list()
"76","202 Cousteau Place","202 Cousteau Place","07-12","Davis city","07/05/2022","2022-07-05","2022-07-05","2022-07-12",list()
"77","202 Cousteau Place","202 Cousteau Place","07-12","Davis city","07/05/2022","2022-07-05","2022-07-05","2022-07-12",list()
"78","202 Cousteau Place","202 Cousteau Place","07-12","Davis city","07/05/2022","2022-07-05","2022-07-05","2022-07-12",list()
"79","202 Cousteau Place","202 Cousteau Place","07-12","Davis city","07/05/2022","2022-07-05","2022-07-05","2022-07-12",list()
"80","202 Cousteau Place","202 Cousteau Place","07-12","Davis city","07/05/2022","2022-07-05","2022-07-05","2022-07-12",list()
"81","202 Cousteau Place","202 Cousteau Place","07-12","Davis city","07/05/2022","2022-07-05","2022-07-05","2022-07-12",list()
"82","202 Cousteau Place","202 Cousteau Place","07-12","Davis city","07/05/2022","2022-07-05","2022-07-05","2022-07-12",list()
"83","202 Cousteau Place","202 Cousteau Place","10-29","Davis campus","10/28/2021","2021-10-28","2021-10-28","2021-10-29",list()
"84","202 Cousteau Place","202 Cousteau Place","10-29","Davis campus","10/28/2021","2021-10-28","2021-10-28","2021-10-29",list()
"85","202 Cousteau Place","202 Cousteau Place","10-29","Davis campus","10/28/2021","2021-10-28","2021-10-28","2021-10-29",list()
"86","202 Cousteau Place","202 Cousteau Place","10-29","Davis campus","10/28/2021","2021-10-28","2021-10-28","2021-10-29",list()
"87","202 Cousteau Place","202 Cousteau Place","10-29","Davis campus","10/28/2021","2021-10-28","2021-10-28","2021-10-29",list()
"88","202 Cousteau Place","202 Cousteau Place","10-29","Davis campus","10/28/2021","2021-10-28","2021-10-28","2021-10-29",list()
"89","202 Cousteau Place","202 Cousteau Place","10-29","Davis campus","10/28/2021","2021-10-28","2021-10-28","2021-10-29",list()
"90","202 Cousteau Place","202 Cousteau Place","10-29","Davis campus","10/28/2021","2021-10-28","2021-10-28","2021-10-29",list()
"91","202 Cousteau Place","202 Cousteau Place","10-29","Davis campus","10/28/2021","2021-10-28","2021-10-28","2021-10-29",list()
"92","202 Cousteau Place","202 Cousteau Place","10-29","Davis campus","10/28/2021","2021-10-28","2021-10-28","2021-10-29",list()
"93","202 Cousteau Place","202 Cousteau Place","07-12","Davis city","07/07/2022","2022-07-07","2022-07-07","2022-07-12",list()
"94","202 Cousteau Place","202 Cousteau Place","07-12","Davis city","07/07/2022","2022-07-07","2022-07-07","2022-07-12",list()
"95","202 Cousteau Place","202 Cousteau Place","07-12","Davis city","07/07/2022","2022-07-07","2022-07-07","2022-07-12",list()
"96","202 Cousteau Place","202 Cousteau Place","07-12","Davis city","07/07/2022","2022-07-07","2022-07-07","2022-07-12",list()
"97","202 Cousteau Place","202 Cousteau Place","07-12","Davis city","07/07/2022","2022-07-07","2022-07-07","2022-07-12",list()
"98","202 Cousteau Place","202 Cousteau Place","07-12","Davis city","07/07/2022","2022-07-07","2022-07-07","2022-07-12",list()
"99","202 Cousteau Place","202 Cousteau Place","07-12","Davis city","07/07/2022","2022-07-07","2022-07-07","2022-07-12",list()
"100","202 Cousteau Place","202 Cousteau Place","07-12","Davis city","07/07/2022","2022-07-07","2022-07-07","2022-07-12",list()
"101","202 Cousteau Place","202 Cousteau Place","07-12","Davis city","07/07/2022","2022-07-07","2022-07-07","2022-07-12",list()
"102","202 Cousteau Place","202 Cousteau Place","07-12","Davis city","07/07/2022","2022-07-07","2022-07-07","2022-07-12",list()
"103","202 Cousteau Place","202 Cousteau Place","08-12","Davis city","08/09/2022","2022-08-09","2022-08-09","2022-08-12",list()
"104","202 Cousteau Place","202 Cousteau Place","08-12","Davis city","08/09/2022","2022-08-09","2022-08-09","2022-08-12",list()
"105","202 Cousteau Place","202 Cousteau Place","08-12","Davis city","08/09/2022","2022-08-09","2022-08-09","2022-08-12",list()
"106","202 Cousteau Place","202 Cousteau Place","08-12","Davis city","08/09/2022","2022-08-09","2022-08-09","2022-08-12",list()
"107","202 Cousteau Place","202 Cousteau Place","08-12","Davis city","08/09/2022","2022-08-09","2022-08-09","2022-08-12",list()
"108","202 Cousteau Place","202 Cousteau Place","08-12","Davis city","08/09/2022","2022-08-09","2022-08-09","2022-08-12",list()
"109","202 Cousteau Place","202 Cousteau Place","08-12","Davis city","08/09/2022","2022-08-09","2022-08-09","2022-08-12",list()
"110","202 Cousteau Place","202 Cousteau Place","08-12","Davis city","08/09/2022","2022-08-09","2022-08-09","2022-08-12",list()
"111","202 Cousteau Place","202 Cousteau Place","08-12","Davis city","08/09/2022","2022-08-09","2022-08-09","2022-08-12",list()
"112","202 Cousteau Place","202 Cousteau Place","08-12","Davis city","08/09/2022","2022-08-09","2022-08-09","2022-08-12",list()
"113","202 Cousteau Place","202 Cousteau Place","08-09","Davis city","08/03/2022","2022-08-03","2022-08-03","2022-08-09",list()
"114","202 Cousteau Place","202 Cousteau Place","08-09","Davis city","08/03/2022","2022-08-03","2022-08-03","2022-08-09",list()
"115","202 Cousteau Place","202 Cousteau Place","08-09","Davis city","08/03/2022","2022-08-03","2022-08-03","2022-08-09",list()
"116","202 Cousteau Place","202 Cousteau Place","08-09","Davis city","08/03/2022","2022-08-03","2022-08-03","2022-08-09",list()
"117","202 Cousteau Place","202 Cousteau Place","08-09","Davis city","08/03/2022","2022-08-03","2022-08-03","2022-08-09",list()
"118","202 Cousteau Place","202 Cousteau Place","08-09","Davis city","08/03/2022","2022-08-03","2022-08-03","2022-08-09",list()
"119","202 Cousteau Place","202 Cousteau Place","08-09","Davis city","08/03/2022","2022-08-03","2022-08-03","2022-08-09",list()
"120","202 Cousteau Place","202 Cousteau Place","08-09","Davis city","08/03/2022","2022-08-03","2022-08-03","2022-08-09",list()
"121","202 Cousteau Place","202 Cousteau Place","08-09","Davis city","08/03/2022","2022-08-03","2022-08-03","2022-08-09",list()
"122","202 Cousteau Place","202 Cousteau Place","08-09","Davis city","08/03/2022","2022-08-03","2022-08-03","2022-08-09",list()
"123","205 Cousteau Place","205 Cousteau Place","09-26","Davis campus","09/20/2022","2022-09-20","2022-09-20","2022-09-26",list()
"150","267 Cousteau Place","267 Cousteau Place","07-12","Davis city","07/06/2022
 - 07/08/2022","2022-07-06","2022-07-08","2022-07-12",list()
"151","267 Cousteau Place","267 Cousteau Place","07-12","Davis city","07/06/2022
 - 07/08/2022","2022-07-06","2022-07-08","2022-07-12",list()
"152","267 Cousteau Place","267 Cousteau Place","09-26","Davis city","09/20/2022","2022-09-20","2022-09-20","2022-09-26",list()
"153","267 Cousteau Place","267 Cousteau Place","09-26","Davis city","09/20/2022","2022-09-20","2022-09-20","2022-09-26",list()
"154","2795 2nd Street","2795 2nd Street","07-20","Davis city","07/19/2022","2022-07-19","2022-07-19","2022-07-20",list()
"155","2795 2nd Street","2795 2nd Street","07-20","Davis city","07/19/2022","2022-07-19","2022-07-19","2022-07-20",list()
"156","2795 2nd Street","2795 2nd Street","07-20","Davis city","07/19/2022","2022-07-19","2022-07-19","2022-07-20",list()
"157","2795 2nd Street","2795 2nd Street","05-26","Davis city","05/26/2022","2022-05-26","2022-05-26","2022-05-26",list()
"158","2795 2nd Street","2795 2nd Street","05-26","Davis city","05/26/2022","2022-05-26","2022-05-26","2022-05-26",list()
"159","2795 2nd Street","2795 2nd Street","05-26","Davis city","05/26/2022","2022-05-26","2022-05-26","2022-05-26",list()
"160","2795 2nd Street","2795 2nd Street","07-15","Davis city","07/11/2022","2022-07-11","2022-07-11","2022-07-15",list()
"161","2795 2nd Street","2795 2nd Street","07-15","Davis city","07/11/2022","2022-07-11","2022-07-11","2022-07-15",list()
"162","2795 2nd Street","2795 2nd Street","07-15","Davis city","07/11/2022","2022-07-11","2022-07-11","2022-07-15",list()
"163","2828 Cowell Blvd","2828 Cowell Blvd","08-03","Davis city","08/01/2022","2022-08-01","2022-08-01","2022-08-03",list()
"164","298 Horizon Street","298 Horizon Street","09-08","Davis campus","09/06/2022","2022-09-06","2022-09-06","2022-09-08",list()
"165","301 Orchard Park Drive","301 Orchard Park Drive","07-20","Davis campus","07/20/2022","2022-07-20","2022-07-20","2022-07-20",list()
"166","359 North Sage St.,The Green","359 North Sage St.,The Green","02-08","Davis campus","02-02
 - 02-04","2021-02-02","2021-02-04","2021-02-08",list()
"167","400 Hopkins Road","400 Hopkins Road","07-18","Davis campus","07/12/2022
 - 07/14/2022","2022-07-12","2022-07-14","2022-07-18",list()
"168","740 La Rue Road","740 La Rue Road","05-18","Davis campus","05/18/2022","2022-05-18","2022-05-18","2022-05-18",list()
"169","8-4","8-4","08-04","Davis campus","07-28","2021-07-28","2021-07-28","2021-08-04",list()
"1996","Activities Recreation & Center","Activities Recreation & Center","08-11","Davis campus","08/11/2022","2022-08-11","2022-08-11","2022-08-11",list()
"2023","Agricultural Field Station","Agricultural Field Station","10-31","Davis campus","10/28/2022","2022-10-28","2022-10-28","2022-10-31",list()
"2024","Agronomy Field Headquarters","Agronomy Field Headquarters","04-18","Davis campus","04/14/2022","2022-04-14","2022-04-14","2022-04-18",list()
"2025","AHMCT Research Center","AHMCT Research Center","05-20","Davis campus","05/16/2022","2022-05-16","2022-05-16","2022-05-20",list()
"2026","Air Quality Research Center","Air Quality Research Center","04-28","Davis campus","04/25/2022","2022-04-25","2022-04-25","2022-04-28",list()
"2027","Air Quality Research Center (Drew Ave)","Air Quality Research Center (Drew Ave)","04-08","Davis city","04/06/2022","2022-04-06","2022-04-06","2022-04-08",list()
"2028","Alhambra Cannery","Alhambra Cannery","01-31","Off campus","01/28/2022","2022-01-28","2022-01-28","2022-01-31",list()
"2029","Alumni Center","Alumni Center","05-25","Davis campus","05/24/2022","2022-05-24","2022-05-24","2022-05-25",list()
"2030","Alumni Center","Alumni Center","06-03","Davis campus","06/02/2022","2022-06-02","2022-06-02","2022-06-03",list()
"2031","Alumni Center","Alumni Center","05-25","Davis campus","05/24/2022","2022-05-24","2022-05-24","2022-05-25",list()
"2032","Alumni Center","Alumni Center","05-25","Davis campus","05/24/2022","2022-05-24","2022-05-24","2022-05-25",list()
"2033","Alumni Center","Alumni Center","05-31","Davis campus","05/27/2022","2022-05-27","2022-05-27","2022-05-31",list()
"2034","Alumni Center","Alumni Center","06-03","Davis campus","06/02/2022","2022-06-02","2022-06-02","2022-06-03",list()
"2035","Alumni Center","Alumni Center","06-06","Davis campus","06/02/2022","2022-06-02","2022-06-02","2022-06-06",list()
"2036","Alumni Center","Alumni Center","06-06","Davis campus","06/02/2022","2022-06-02","2022-06-02","2022-06-06",list()
"2037","Alumni Center","Alumni Center","06-03","Davis campus","06/02/2022","2022-06-02","2022-06-02","2022-06-03",list()
"2038","Alumni Center","Alumni Center","06-03","Davis campus","06/02/2022","2022-06-02","2022-06-02","2022-06-03",list()
"2039","Alumni Center","Alumni Center","06-06","Davis campus","06/02/2022","2022-06-02","2022-06-02","2022-06-06",list()
"2040","Alumni Center","Alumni Center","05-31","Davis campus","05/27/2022","2022-05-27","2022-05-27","2022-05-31",list()
"2041","Alumni Center","Alumni Center","05-31","Davis campus","05/27/2022","2022-05-27","2022-05-27","2022-05-31",list()
"2042","Alumni Center","Alumni Center","05-25","Davis campus","05/24/2022","2022-05-24","2022-05-24","2022-05-25",list()
"2043","Alumni Center","Alumni Center","06-06","Davis campus","06/02/2022","2022-06-02","2022-06-02","2022-06-06",list()
"2044","Alumni Center","Alumni Center","05-31","Davis campus","05/27/2022","2022-05-27","2022-05-27","2022-05-31",list()
"2045","Alumni Center, Walter A. Buehler","Alumni Center, Walter A. Buehler","09-19","Davis campus","09/15/2022","2022-09-15","2022-09-15","2022-09-19",list()
"2053","Animal Resources Service","Animal Resources Service","06-20","Davis campus","06/13/2022","2022-06-13","2022-06-13","2022-06-20",list()
"2063","Animal Resources Service H-3 Trailer","Animal Resources Service H-3 Trailer","05-23","Davis campus","05/20/2022","2022-05-20","2022-05-20","2022-05-23",list()
"2064","Animal Sciences","Animal Sciences","06-30","Davis campus","06/28/2022","2022-06-28","2022-06-28","2022-06-30",list()
"2173","Antenna Farm","Antenna Farm","11-10","Davis campus","11/08/2021
 - 11/10/2021","2021-11-08","2021-11-10","2021-11-10",list()
"7588","Bodega Marine Laboratory","Bodega Marine Laboratory","10-03","Off campus","09/27/2022
 - 09/28/2022","2022-09-27","2022-09-28","2022-10-03",list()
"7589","Bodega Marine Laboratory","Bodega Marine Laboratory","07-25","Off campus","07/18/2022
 - 07/21/2022","2022-07-18","2022-07-21","2022-07-25",list()
"7590","Bodega Marine Laboratory","Bodega Marine Laboratory","07-26","Off campus","07/22/2022","2022-07-22","2022-07-22","2022-07-26",list()
"7591","Bodega Marine Laboratory","Bodega Marine Laboratory","07-25","Off campus","07/18/2022
 - 07/21/2022","2022-07-18","2022-07-21","2022-07-25",list()
"7592","Bodega Marine Laboratory","Bodega Marine Laboratory","10-03","Off campus","10/27/2022
 - 10/28/2022","2022-10-27","2022-10-28","2022-10-03",list()
"7593","Bodega Marine Laboratory","Bodega Marine Laboratory","07-26","Off campus","07/22/2022","2022-07-22","2022-07-22","2022-07-26",list()
"7594","Bodega Marine Laboratory","Bodega Marine Laboratory","07-26","Off campus","07/22/2022","2022-07-22","2022-07-22","2022-07-26",list()
"7595","Bodega Marine Laboratory","Bodega Marine Laboratory","10-03","Off campus","09/27/2022
 - 09/28/2022","2022-09-27","2022-09-28","2022-10-03",list()
"7596","Bodega Marine Laboratory","Bodega Marine Laboratory","10-03","Off campus","09/27/2022
 - 09/28/2022","2022-09-27","2022-09-28","2022-10-03",list()
"7597","Bodega Marine Laboratory","Bodega Marine Laboratory","07-26","Off campus","07/22/2022","2022-07-22","2022-07-22","2022-07-26",list()
"7598","Bodega Marine Laboratory","Bodega Marine Laboratory","10-03","Off campus","10/27/2022
 - 10/28/2022","2022-10-27","2022-10-28","2022-10-03",list()
"7599","Bodega Marine Laboratory","Bodega Marine Laboratory","10-03","Off campus","10/27/2022
 - 10/28/2022","2022-10-27","2022-10-28","2022-10-03",list()
"7600","Bodega Marine Laboratory","Bodega Marine Laboratory","10-03","Off campus","09/27/2022
 - 09/28/2022","2022-09-27","2022-09-28","2022-10-03",list()
"7601","Bodega Marine Laboratory","Bodega Marine Laboratory","07-25","Off campus","07/18/2022
 - 07/21/2022","2022-07-18","2022-07-21","2022-07-25",list()
"7602","Bodega Marine Laboratory","Bodega Marine Laboratory","10-03","Off campus","10/27/2022
 - 10/28/2022","2022-10-27","2022-10-28","2022-10-03",list()
"7603","Bodega Marine Laboratory","Bodega Marine Laboratory","07-25","Off campus","07/18/2022
 - 07/21/2022","2022-07-18","2022-07-21","2022-07-25",list()
"7604","Bookstore","Bookstore","06-13","Davis campus","06/08/2022","2022-06-08","2022-06-08","2022-06-13",list()
"7605","Bookstore","Bookstore","06-06","Davis campus","06/03/2022","2022-06-03","2022-06-03","2022-06-06",list()
"7606","Bookstore","Bookstore","05-25","Davis campus","05/24/2022","2022-05-24","2022-05-24","2022-05-25",list()
"7607","Bookstore","Bookstore","05-25","Davis campus","05/24/2022","2022-05-24","2022-05-24","2022-05-25",list()
"7608","Bookstore","Bookstore","05-25","Davis campus","05/24/2022","2022-05-24","2022-05-24","2022-05-25",list()
"7609","Bookstore","Bookstore","05-25","Davis campus","05/24/2022","2022-05-24","2022-05-24","2022-05-25",list()
"7610","Bookstore","Bookstore","06-13","Davis campus","06/08/2022","2022-06-08","2022-06-08","2022-06-13",list()
"7611","Bookstore","Bookstore","06-13","Davis campus","06/08/2022","2022-06-08","2022-06-08","2022-06-13",list()
"7612","Bookstore","Bookstore","06-13","Davis campus","06/08/2022","2022-06-08","2022-06-08","2022-06-13",list()
"7613","Bookstore","Bookstore","06-06","Davis campus","06/03/2022","2022-06-03","2022-06-03","2022-06-06",list()
"7614","Bookstore","Bookstore","08-09","Davis campus","08/08/2022","2022-08-08","2022-08-08","2022-08-09",list()
"7615","Bookstore","Bookstore","06-06","Davis campus","06/03/2022","2022-06-03","2022-06-03","2022-06-06",list()
"7616","Bookstore","Bookstore","08-09","Davis campus","08/08/2022","2022-08-08","2022-08-08","2022-08-09",list()
"7617","Bookstore","Bookstore","08-09","Davis campus","08/08/2022","2022-08-08","2022-08-08","2022-08-09",list()
"7618","Bookstore","Bookstore","08-09","Davis campus","08/08/2022","2022-08-08","2022-08-08","2022-08-09",list()
"7619","Bookstore","Bookstore","06-06","Davis campus","06/03/2022","2022-06-03","2022-06-03","2022-06-06",list()
"7620","Botanical Conservatory","Botanical Conservatory","09-23","Davis campus","09/20/2022","2022-09-20","2022-09-20","2022-09-23",list()
"7621","Bowley Hall","Bowley Hall","06-01","Davis campus","05/31/2022","2022-05-31","2022-05-31","2022-06-01",list()
"7631","Brewery, Winery, and Food Pilot Facility","Brewery, Winery, and Food Pilot Facility","08-30","Davis campus","08/26/2022","2022-08-26","2022-08-26","2022-08-30",list()
"8161","Bruce Edwards Club Room","Bruce Edwards Club Room","06-14","Davis campus","06/11/2022
 - 06/12/2022","2022-06-11","2022-06-12","2022-06-14",list()
"8162","Bruce Edwards Club Room / Stadium","Bruce Edwards Club Room / Stadium","06-15","Davis campus","06/11/2022
 - 06/12/2022","2022-06-11","2022-06-12","2022-06-15",list()
"8163","Bruce Edwards Club Room / Stadium","Bruce Edwards Club Room / Stadium","06-15","Davis campus","06/11/2022
 - 06/12/2022","2022-06-11","2022-06-12","2022-06-15",list()
"8164","Bruce Edwards Club Room / Stadium","Bruce Edwards Club Room / Stadium","06-13","Davis campus","06/10/2022
 - 06/12/2022","2022-06-10","2022-06-12","2022-06-13",list()
"8165","Bruce Edwards Club Room / Stadium","Bruce Edwards Club Room / Stadium","06-13","Davis campus","06/10/2022
 - 06/12/2022","2022-06-10","2022-06-12","2022-06-13",list()
"8187","CA Animal Health & Food Safety Lab - Tulare","CA Animal Health & Food Safety Lab - Tulare","10-05","Off campus","10/04/2022","2022-10-04","2022-10-04","2022-10-05",list()
"8188","CA Animal Health & Food Safety Laboratory","CA Animal Health & Food Safety Laboratory","10-06","Davis campus","10/04/2022","2022-10-04","2022-10-04","2022-10-06",list()
"8189","CA Animal Health and Food Safety Lab, Turlock","CA Animal Health and Food Safety Lab, Turlock","22-Sep","Off campus","09-13
 - 09-15","2021-09-13","2021-09-15","2021-09-22",list()
"8190","CAHFS-Turlock Laboratory","CAHFS-Turlock Laboratory","01-06","Off campus","01/03/2022","2022-01-03","2022-01-03","2022-01-06",list()
"8191","CAHFS San Bernardino Lab","CAHFS San Bernardino Lab","08-04","Off campus","07-27
 - 07-29","2021-07-27","2021-07-29","2021-08-04",list()
"8192","Calif Animal Health & Food Safety, San Bernardino","Calif Animal Health & Food Safety, San Bernardino","07-12","Off campus","07/06/2022","2022-07-06","2022-07-06","2022-07-12",list()
"8193","Calif. Animal Health & Food Safety, San Bernardino","Calif. Animal Health & Food Safety, San Bernardino","09-20","Off campus","09/19/2022","2022-09-19","2022-09-19","2022-09-20",list()
"8194","California Animal Health & Food Safety","California Animal Health & Food Safety","06-27","Davis campus","06/23/2022
 - 06/24/2022","2022-06-23","2022-06-24","2022-06-27",list()
"8195","California Animal Health & Food Safety - Tulare","California Animal Health & Food Safety - Tulare","08-17","Off campus","08/17/2022","2022-08-17","2022-08-17","2022-08-17",list()
"8196","California Animal Health & Food Safety Lab System","California Animal Health & Food Safety Lab System","06-24","Davis campus","06/24/2022","2022-06-24","2022-06-24","2022-06-24",list()
"8197","California Animal Health & Food Safety Lab, Tulare","California Animal Health & Food Safety Lab, Tulare","07-20","Off campus","07/18/2022
 - 07/20/2022","2022-07-18","2022-07-20","2022-07-20",list()
"8198","California Animal Health & Food Safety Lab, Tulare","California Animal Health & Food Safety Lab, Tulare","06-14","Davis campus","06/13/2022","2022-06-13","2022-06-13","2022-06-14",list()
"8199","California Animal Health & Food Safety Lab, Tulare","California Animal Health & Food Safety Lab, Tulare","07-20","Off campus","07/18/2022
 - 07/20/2022","2022-07-18","2022-07-20","2022-07-20",list()
"8200","California Animal Health & Food Safety Lab, Tulare","California Animal Health & Food Safety Lab, Tulare","07-20","Off campus","07/18/2022
 - 07/20/2022","2022-07-18","2022-07-20","2022-07-20",list()
"8201","California Animal Health & Food Safety Lab, Tulare","California Animal Health & Food Safety Lab, Tulare","06-14","Davis campus","06/13/2022","2022-06-13","2022-06-13","2022-06-14",list()
"8202","California Animal Health & Food Safety Lab, Tulare","California Animal Health & Food Safety Lab, Tulare","07-06","Off campus","07/05/2022","2022-07-05","2022-07-05","2022-07-06",list()
"8203","California Animal Health & Food Safety Lab, Tulare","California Animal Health & Food Safety Lab, Tulare","07-06","Off campus","07/05/2022","2022-07-05","2022-07-05","2022-07-06",list()
"8204","California Animal Health & Food Safety Lab, Tulare","California Animal Health & Food Safety Lab, Tulare","07-06","Off campus","07/05/2022","2022-07-05","2022-07-05","2022-07-06",list()
"8205","California Animal Health & Food Safety Lab, Tulare","California Animal Health & Food Safety Lab, Tulare","06-14","Davis campus","06/13/2022","2022-06-13","2022-06-13","2022-06-14",list()
"8206","California Animal Health & Food Safety, Tulare","California Animal Health & Food Safety, Tulare","07-14","Off campus","07/12/2022
 - 07/13/2022","2022-07-12","2022-07-13","2022-07-14",list()
"8207","California Animal Health and Food Safety","California Animal Health and Food Safety","07-12","Davis campus","07/05/2022
 - 07/08/2022","2022-07-05","2022-07-08","2022-07-12",list()
"8208","California Animal Health and Food Safety","California Animal Health and Food Safety","07-12","Davis campus","07/05/2022
 - 07/08/2022","2022-07-05","2022-07-08","2022-07-12",list()
"8209","California Animal Health and Food Safety","California Animal Health and Food Safety","09-22","Davis campus","09/20/2022
 - 09/21/2022","2022-09-20","2022-09-21","2022-09-22",list()
"8210","California Animal Health and Food Safety","California Animal Health and Food Safety","09-22","Davis campus","09/20/2022
 - 09/21/2022","2022-09-20","2022-09-21","2022-09-22",list()
"10086","California Lighting Technology Center","California Lighting Technology Center","06-24","Davis city","06/21/2022
 - 06/22/2022","2022-06-21","2022-06-22","2022-06-24",list()
"10087","Center for Aquatic Biology and Aquaculture","Center for Aquatic Biology and Aquaculture","04-25","Davis campus","04/20/2022","2022-04-20","2022-04-20","2022-04-25",list()
"10088","Center for Aquatic Biology and Aquaculture","Center for Aquatic Biology and Aquaculture","04-25","Davis campus","04/20/2022","2022-04-20","2022-04-20","2022-04-25",list()
"10089","Center for Aquatic Biology and Aquaculture","Center for Aquatic Biology and Aquaculture","09-02","Davis campus","09/01/2022","2022-09-01","2022-09-01","2022-09-02",list()
"10090","Center for Aquatic Biology and Aquaculture","Center for Aquatic Biology and Aquaculture","07-05","Davis campus","06/29/2022
 - 06/30/2022","2022-06-29","2022-06-30","2022-07-05",list()
"10091","Center for Aquatic Biology and Aquaculture","Center for Aquatic Biology and Aquaculture","04-25","Davis campus","04/20/2022","2022-04-20","2022-04-20","2022-04-25",list()
"10092","Center for Aquatic Biology and Aquaculture","Center for Aquatic Biology and Aquaculture","09-02","Davis campus","09/01/2022","2022-09-01","2022-09-01","2022-09-02",list()
"10093","Center for Aquatic Biology and Aquaculture","Center for Aquatic Biology and Aquaculture","09-02","Davis campus","09/01/2022","2022-09-01","2022-09-01","2022-09-02",list()
"10094","Center for Aquatic Biology and Aquaculture","Center for Aquatic Biology and Aquaculture","07-05","Davis campus","06/29/2022
 - 06/30/2022","2022-06-29","2022-06-30","2022-07-05",list()
"10095","Center for Aquatic Biology and Aquaculture","Center for Aquatic Biology and Aquaculture","07-05","Davis campus","06/29/2022
 - 06/30/2022","2022-06-29","2022-06-30","2022-07-05",list()
"10096","Center for Child and Family Studies","Center for Child and Family Studies","02-03","Davis city","02/02/2022","2022-02-02","2022-02-02","2022-02-03",list()
"10332","Center for Geotechnical Modeling","Center for Geotechnical Modeling","07-26","Davis campus","07/22/2022","2022-07-22","2022-07-22","2022-07-26",list()
"10334","Center for Health and the Environment","Center for Health and the Environment","05-23","Davis campus","05/23/2022","2022-05-23","2022-05-23","2022-05-23",list()
"10335","Center for Health and the Environment","Center for Health and the Environment","05-23","Davis campus","05/23/2022","2022-05-23","2022-05-23","2022-05-23",list()
"10336","Center for Health and the Environment","Center for Health and the Environment","05-23","Davis campus","05/23/2022","2022-05-23","2022-05-23","2022-05-23",list()
"10337","Center for Health and the Environment","Center for Health and the Environment","09-02","Davis campus","09/01/2022","2022-09-01","2022-09-01","2022-09-02",list()
"10338","Center for Health and the Environment","Center for Health and the Environment","09-02","Davis campus","08/30/2022","2022-08-30","2022-08-30","2022-09-02",list()
"10339","Center for Health and the Environment","Center for Health and the Environment","09-02","Davis campus","09/01/2022","2022-09-01","2022-09-01","2022-09-02",list()
"10340","Center for Health and the Environment","Center for Health and the Environment","09-02","Davis campus","08/30/2022","2022-08-30","2022-08-30","2022-09-02",list()
"10341","Center for Health and the Environment","Center for Health and the Environment","09-02","Davis campus","08/30/2022","2022-08-30","2022-08-30","2022-09-02",list()
"10342","Center for Health and the Environment","Center for Health and the Environment","09-02","Davis campus","09/01/2022","2022-09-01","2022-09-01","2022-09-02",list()
"10343","Center for Mind and Brain","Center for Mind and Brain","01-21","Davis campus","01/20/2022","2022-01-20","2022-01-20","2022-01-21",list()
"10344","Center for Mind and Brain","Center for Mind and Brain","01-21","Davis campus","01/20/2022","2022-01-20","2022-01-20","2022-01-21",list()
"10345","Center for Mind and Brain","Center for Mind and Brain","06-06","Davis city","06/03/2022","2022-06-03","2022-06-03","2022-06-06",list()
"10346","Center for Mind and Brain","Center for Mind and Brain","05-25","Davis city","05/24/2022","2022-05-24","2022-05-24","2022-05-25",list()
"10347","Center for Mind and Brain","Center for Mind and Brain","06-06","Davis city","06/03/2022","2022-06-03","2022-06-03","2022-06-06",list()
"10348","Center for Mind and Brain","Center for Mind and Brain","06-06","Davis city","06/03/2022","2022-06-03","2022-06-03","2022-06-06",list()
"10349","Center for Mind and Brain","Center for Mind and Brain","01-21","Davis campus","01/20/2022","2022-01-20","2022-01-20","2022-01-21",list()
"10350","Center for Mind and Brain","Center for Mind and Brain","05-25","Davis city","05/24/2022","2022-05-24","2022-05-24","2022-05-25",list()
"10351","Center for Mind and Brain","Center for Mind and Brain","05-25","Davis city","05/24/2022","2022-05-24","2022-05-24","2022-05-25",list()
"10403","Center for Watershed Sciences","Center for Watershed Sciences","07-07","Davis campus","07/05/2022","2022-07-05","2022-07-05","2022-07-07",list()
"10405","Central Heating & Cooling Plant","Central Heating & Cooling Plant","07-18","Davis campus","07/13/2022
 - 07/15/2022","2022-07-13","2022-07-15","2022-07-18",list()
"10406","Central Heating & Cooling Plant","Central Heating & Cooling Plant","08-29","Davis campus","08/27/2022","2022-08-27","2022-08-27","2022-08-29",list()
"10407","Central Heating & Cooling Plant","Central Heating & Cooling Plant","07-18","Davis campus","07/13/2022
 - 07/15/2022","2022-07-13","2022-07-15","2022-07-18",list()
"10408","Central Heating & Cooling Plant","Central Heating & Cooling Plant","08-29","Davis campus","08/27/2022","2022-08-27","2022-08-27","2022-08-29",list()
"10409","Central Receiving","Central Receiving","09-06","Davis campus","09/01/2022","2022-09-01","2022-09-01","2022-09-06",list()
"12388","Coffee House (COHO)","Coffee House (COHO)","09-21","Davis campus","09/16/2022","2022-09-16","2022-09-16","2022-09-21",list()
"12390","Communication Resources Building","Communication Resources Building","08-19","Davis campus","08/17/2022","2022-08-17","2022-08-17","2022-08-19",list()
"12391","Communication Resources Building","Communication Resources Building","08-22","Davis campus","08/17/2022","2022-08-17","2022-08-17","2022-08-22",list()
"12392","Communication Resources Building","Communication Resources Building","08-19","Davis campus","08/17/2022","2022-08-17","2022-08-17","2022-08-19",list()
"12393","Communication Resources Building","Communication Resources Building","08-22","Davis campus","08/17/2022","2022-08-17","2022-08-17","2022-08-22",list()
"12538","Continuing and Professional Education - Sacramento","Continuing and Professional Education - Sacramento","10-03","Off campus","10/27/2022
 - 10/28/2022","2022-10-27","2022-10-28","2022-10-03",list()
"12539","Continuing and Professional Education - Sacramento","Continuing and Professional Education - Sacramento","10-03","Off campus","10/27/2022
 - 10/28/2022","2022-10-27","2022-10-28","2022-10-03",list()
"12540","Continuing and Professional Education - Sacramento","Continuing and Professional Education - Sacramento","10-03","Off campus","09/27/2022
 - 09/28/2022","2022-09-27","2022-09-28","2022-10-03",list()
"12541","Continuing and Professional Education - Sacramento","Continuing and Professional Education - Sacramento","10-03","Off campus","09/27/2022
 - 09/28/2022","2022-09-27","2022-09-28","2022-10-03",list()
"13368","Cuarto Building","Cuarto Building","08-12","Davis campus","08/09/2022","2022-08-09","2022-08-09","2022-08-12",list()
"14345","Cuarto Dining Hall","Cuarto Dining Hall","05-19","Davis campus","05/19/2022","2022-05-19","2022-05-19","2022-05-19",list()
"14346","Cuarto Residence Halls","Cuarto Residence Halls","05-23","Davis campus","05/21/2022","2022-05-21","2022-05-21","2022-05-23",list()
"14347","Custodial  Services","Custodial  Services","09-16","Davis campus","09/14/2022","2022-09-14","2022-09-14","2022-09-16",list()
"14348","Custodial Building","Custodial Building","08-05","Davis campus","08/03/2022","2022-08-03","2022-08-03","2022-08-05",list()
"14349","Custodial Building","Custodial Building","08-30","Davis campus","08/26/2022","2022-08-26","2022-08-26","2022-08-30",list()
"14350","Custodial Building","Custodial Building","08-05","Davis campus","08/03/2022","2022-08-03","2022-08-03","2022-08-05",list()
"14351","Custodial Building","Custodial Building","08-05","Davis campus","08/03/2022","2022-08-03","2022-08-03","2022-08-05",list()
"14352","Custodial Building","Custodial Building","08-30","Davis campus","08/26/2022","2022-08-26","2022-08-26","2022-08-30",list()
"14353","Custodial Building","Custodial Building","06-28","Davis campus","06/26/2022","2022-06-26","2022-06-26","2022-06-28",list()
"14354","Custodial Building","Custodial Building","08-30","Davis campus","08/26/2022","2022-08-26","2022-08-26","2022-08-30",list()
"14355","Custodial Building","Custodial Building","06-28","Davis campus","06/26/2022","2022-06-26","2022-06-26","2022-06-28",list()
"14356","Custodial Building","Custodial Building","06-28","Davis campus","06/26/2022","2022-06-26","2022-06-26","2022-06-28",list()
"14357","Custodial Services","Custodial Services","07-05","Davis campus","06/27/2022
 - 06/30/2022","2022-06-27","2022-06-30","2022-07-05",list()
"14358","Custodial Services","Custodial Services","07-21","Davis campus","07/18/2022","2022-07-18","2022-07-18","2022-07-21",list()
"14359","Custodial Services","Custodial Services","10-18","Davis campus","10/17/2022","2022-10-17","2022-10-17","2022-10-18",list()
"14360","Custodial Services","Custodial Services","07-21","Davis campus","07/18/2022","2022-07-18","2022-07-18","2022-07-21",list()
"14361","Custodial Services","Custodial Services","07-19","Davis campus","07/18/2022","2022-07-18","2022-07-18","2022-07-19",list()
"14362","Custodial Services","Custodial Services","07-21","Davis campus","07/18/2022","2022-07-18","2022-07-18","2022-07-21",list()
"14363","Custodial Services","Custodial Services","07-21","Davis campus","07/18/2022","2022-07-18","2022-07-18","2022-07-21",list()
"14364","Custodial Services","Custodial Services","07-19","Davis campus","07/18/2022","2022-07-18","2022-07-18","2022-07-19",list()
"14365","Custodial Services","Custodial Services","07-19","Davis campus","07/18/2022","2022-07-18","2022-07-18","2022-07-19",list()
"14366","Custodial Services","Custodial Services","07-19","Davis campus","07/18/2022","2022-07-18","2022-07-18","2022-07-19",list()
"14367","Custodial Services","Custodial Services","07-05","Davis campus","06/27/2022
 - 06/30/2022","2022-06-27","2022-06-30","2022-07-05",list()
"14368","Custodial Services","Custodial Services","07-05","Davis campus","06/27/2022
 - 06/30/2022","2022-06-27","2022-06-30","2022-07-05",list()
"14369","Custodial Services","Custodial Services","10-18","Davis campus","10/17/2022","2022-10-17","2022-10-17","2022-10-18",list()
"14370","Custodial Services","Custodial Services","07-05","Davis campus","06/27/2022
 - 06/30/2022","2022-06-27","2022-06-30","2022-07-05",list()
"14371","Custodial Services","Custodial Services","10-18","Davis campus","10/17/2022","2022-10-17","2022-10-17","2022-10-18",list()
"14372","Custodial Services","Custodial Services","10-18","Davis campus","10/17/2022","2022-10-17","2022-10-17","2022-10-18",list()
"14373","Custodial Services Building","Custodial Services Building","09-01","Davis campus","08/26/2022","2022-08-26","2022-08-26","2022-09-01",list()
"14374","Custodial Services Building","Custodial Services Building","09-01","Davis campus","08/26/2022","2022-08-26","2022-08-26","2022-09-01",list()
"14375","Custodial Services Building","Custodial Services Building","09-01","Davis campus","08/26/2022","2022-08-26","2022-08-26","2022-09-01",list()
"14376","Custodial Services Building","Custodial Services Building","08-31","Davis campus","08/29/2022","2022-08-29","2022-08-29","2022-08-31",list()
"14377","Custodial Services Building","Custodial Services Building","07-26","Davis campus","07/21/2022","2022-07-21","2022-07-21","2022-07-26",list()
"14378","Custodial Services Building","Custodial Services Building","08-23","Davis campus","08/19/2022","2022-08-19","2022-08-19","2022-08-23",list()
"14379","Custodial Services Building","Custodial Services Building","08-23","Davis campus","08/19/2022","2022-08-19","2022-08-19","2022-08-23",list()
"14380","Custodial Services Building","Custodial Services Building","08-23","Davis campus","08/19/2022","2022-08-19","2022-08-19","2022-08-23",list()
"14381","Custodial Services Building","Custodial Services Building","08-23","Davis campus","08/19/2022","2022-08-19","2022-08-19","2022-08-23",list()
"14382","Custodial Services Building","Custodial Services Building","09-01","Davis campus","08/26/2022","2022-08-26","2022-08-26","2022-09-01",list()
"14383","Custodial Services Building","Custodial Services Building","07-26","Davis campus","07/21/2022","2022-07-21","2022-07-21","2022-07-26",list()
"14384","Custodial Services Building","Custodial Services Building","07-26","Davis campus","07/21/2022","2022-07-21","2022-07-21","2022-07-26",list()
"14385","Custodial Services Building","Custodial Services Building","08-31","Davis campus","08/29/2022","2022-08-29","2022-08-29","2022-08-31",list()
"14386","Custodial Services Building","Custodial Services Building","08-31","Davis campus","08/29/2022","2022-08-29","2022-08-29","2022-08-31",list()
"14387","Custodial Services Building","Custodial Services Building","07-26","Davis campus","07/21/2022","2022-07-21","2022-07-21","2022-07-26",list()
"14388","Custodial Services Building","Custodial Services Building","08-31","Davis campus","08/29/2022","2022-08-29","2022-08-29","2022-08-31",list()
"14389","Da Vinci Court","Da Vinci Court","02-23","Davis city","02/22/2022","2022-02-22","2022-02-22","2022-02-23",list()
"14395","Design & Construction Management","Design & Construction Management","01-18","Davis campus","01/18/2022","2022-01-18","2022-01-18","2022-01-18",list()
"14478","Dutton Hall, Room 1200","Dutton Hall, Room 1200","05-04","Davis campus","05/03/2022","2022-05-03","2022-05-03","2022-05-04",list()
"14479","Earth & Physical Sciences","Earth & Physical Sciences","05-11","Davis campus","05/09/2022","2022-05-09","2022-05-09","2022-05-11",list()
"14480","Earth & Physical Sciences","Earth & Physical Sciences","05-27","Davis campus","05/25/2022","2022-05-25","2022-05-25","2022-05-27",list()
"14481","Earth & Physical Sciences","Earth & Physical Sciences","05-27","Davis campus","05/25/2022","2022-05-25","2022-05-25","2022-05-27",list()
"14482","Earth & Physical Sciences","Earth & Physical Sciences","05-09","Davis campus","05/05/2022","2022-05-05","2022-05-05","2022-05-09",list()
"14483","Earth & Physical Sciences","Earth & Physical Sciences","05-09","Davis campus","05/05/2022","2022-05-05","2022-05-05","2022-05-09",list()
"14484","Earth & Physical Sciences","Earth & Physical Sciences","05-09","Davis campus","05/05/2022","2022-05-05","2022-05-05","2022-05-09",list()
"14485","Earth & Physical Sciences","Earth & Physical Sciences","05-11","Davis campus","05/09/2022","2022-05-09","2022-05-09","2022-05-11",list()
"14486","Earth & Physical Sciences","Earth & Physical Sciences","05-11","Davis campus","05/09/2022","2022-05-09","2022-05-09","2022-05-11",list()
"14487","Earth & Physical Sciences","Earth & Physical Sciences","05-11","Davis campus","05/09/2022","2022-05-09","2022-05-09","2022-05-11",list()
"14488","Earth & Physical Sciences","Earth & Physical Sciences","05-05","Davis campus","05/04/2022","2022-05-04","2022-05-04","2022-05-05",list()
"14489","Earth & Physical Sciences","Earth & Physical Sciences","05-05","Davis campus","05/04/2022","2022-05-04","2022-05-04","2022-05-05",list()
"14490","Earth & Physical Sciences","Earth & Physical Sciences","05-05","Davis campus","05/04/2022","2022-05-04","2022-05-04","2022-05-05",list()
"14491","Earth & Physical Sciences","Earth & Physical Sciences","05-27","Davis campus","05/25/2022","2022-05-25","2022-05-25","2022-05-27",list()
"14492","Earth & Physical Sciences","Earth & Physical Sciences","05-05","Davis campus","05/04/2022","2022-05-04","2022-05-04","2022-05-05",list()
"14493","Earth & Physical Sciences","Earth & Physical Sciences","05-27","Davis campus","05/25/2022","2022-05-25","2022-05-25","2022-05-27",list()
"14494","Earth & Physical Sciences","Earth & Physical Sciences","05-09","Davis campus","05/05/2022","2022-05-05","2022-05-05","2022-05-09",list()
"14495","Earth & Physical Sciences Building","Earth & Physical Sciences Building","09-26","Davis campus","09/22/2022","2022-09-22","2022-09-22","2022-09-26",list()
"14496","Earth & Physical Sciences Building","Earth & Physical Sciences Building","05-16","Davis campus","05/10/2022","2022-05-10","2022-05-10","2022-05-16",list()
"14497","Earth & Physical Sciences Building","Earth & Physical Sciences Building","05-16","Davis campus","05/10/2022","2022-05-10","2022-05-10","2022-05-16",list()
"14498","Earth & Physical Sciences Building","Earth & Physical Sciences Building","06-28","Davis campus","06/22/2022
 - 06/23/2022","2022-06-22","2022-06-23","2022-06-28",list()
"14499","Earth & Physical Sciences Building","Earth & Physical Sciences Building","06-28","Davis campus","06/22/2022
 - 06/23/2022","2022-06-22","2022-06-23","2022-06-28",list()
"14500","Earth & Physical Sciences Building","Earth & Physical Sciences Building","09-26","Davis campus","09/22/2022","2022-09-22","2022-09-22","2022-09-26",list()
"14501","Earth & Physical Sciences Building","Earth & Physical Sciences Building","05-16","Davis campus","05/10/2022","2022-05-10","2022-05-10","2022-05-16",list()
"14502","Earth & Physical Sciences Building","Earth & Physical Sciences Building","06-28","Davis campus","06/22/2022
 - 06/23/2022","2022-06-22","2022-06-23","2022-06-28",list()
"14503","Earth & Physical Sciences Building","Earth & Physical Sciences Building","06-28","Davis campus","06/22/2022
 - 06/23/2022","2022-06-22","2022-06-23","2022-06-28",list()
"14504","Earth & Physical Sciences Building","Earth & Physical Sciences Building","09-26","Davis campus","09/22/2022","2022-09-22","2022-09-22","2022-09-26",list()
"14505","Earth & Physical Sciences Building","Earth & Physical Sciences Building","10-31","Davis campus","10/26/2022","2022-10-26","2022-10-26","2022-10-31",list()
"14506","Earth & Physical Sciences Building","Earth & Physical Sciences Building","10-31","Davis campus","10/26/2022","2022-10-26","2022-10-26","2022-10-31",list()
"14507","Earth & Physical Sciences Building","Earth & Physical Sciences Building","10-31","Davis campus","10/26/2022","2022-10-26","2022-10-26","2022-10-31",list()
"14508","Earth & Physical Sciences Building","Earth & Physical Sciences Building","09-26","Davis campus","09/22/2022","2022-09-22","2022-09-22","2022-09-26",list()
"14509","Earth & Physical Sciences Building","Earth & Physical Sciences Building","05-16","Davis campus","05/10/2022","2022-05-10","2022-05-10","2022-05-16",list()
"14510","Earth & Physical Sciences Building","Earth & Physical Sciences Building","10-31","Davis campus","10/26/2022","2022-10-26","2022-10-26","2022-10-31",list()
"14511","Earth & Planetary Sciences","Earth & Planetary Sciences","06-14","Davis campus","06/13/2022","2022-06-13","2022-06-13","2022-06-14",list()
"15283","Earth and Planetary Sciences","Earth and Planetary Sciences","06-01","Davis campus","05/31/2022","2022-05-31","2022-05-31","2022-06-01",list()
"15284","Education Building","Education Building","08-15","Davis campus","08/12/2022","2022-08-12","2022-08-12","2022-08-15",list()
"15285","Edwards Family Athletics Center","Edwards Family Athletics Center","04-20","Davis campus","04/19/2022","2022-04-19","2022-04-19","2022-04-20",list()
"15286","Energy Conservation Center","Energy Conservation Center","04-07","Davis campus","04/05/2022","2022-04-05","2022-04-05","2022-04-07",list()
"15337","Environmental Services Facility","Environmental Services Facility","08-01","Davis campus","07/22/2022","2022-07-22","2022-07-22","2022-08-01",list()
"15338","Environmental Services Facility","Environmental Services Facility","08-01","Davis campus","07/22/2022","2022-07-22","2022-07-22","2022-08-01",list()
"15339","Environmental Services Facility","Environmental Services Facility","06-07","Davis campus","06/05/2022
 - 06/06/2022","2022-06-05","2022-06-06","2022-06-07",list()
"15340","Environmental Services Facility","Environmental Services Facility","06-07","Davis campus","06/05/2022
 - 06/06/2022","2022-06-05","2022-06-06","2022-06-07",list()
"15648","Facilities Maintenance Building","Facilities Maintenance Building","10-24","Davis campus","10/21/2022","2022-10-21","2022-10-21","2022-10-24",list()
"15649","Facilities Maintenance Building","Facilities Maintenance Building","07-15","Davis campus","07/14/2022","2022-07-14","2022-07-14","2022-07-15",list()
"15650","Facilities Maintenance Building","Facilities Maintenance Building","10-24","Davis campus","10/21/2022","2022-10-21","2022-10-21","2022-10-24",list()
"15651","Facilities Maintenance Building","Facilities Maintenance Building","10-24","Davis campus","10/21/2022","2022-10-21","2022-10-21","2022-10-24",list()
"15652","Facilities Maintenance Building","Facilities Maintenance Building","07-15","Davis campus","07/14/2022","2022-07-14","2022-07-14","2022-07-15",list()
"15653","Facilities Maintenance Building","Facilities Maintenance Building","07-15","Davis campus","07/14/2022","2022-07-14","2022-07-14","2022-07-15",list()
"15654","Facilities Maintenance Building","Facilities Maintenance Building","07-14","Davis campus","07/12/2022","2022-07-12","2022-07-12","2022-07-14",list()
"15655","Facilities Maintenance Building","Facilities Maintenance Building","07-14","Davis campus","07/12/2022","2022-07-12","2022-07-12","2022-07-14",list()
"15656","Facilities Maintenance Building","Facilities Maintenance Building","07-14","Davis campus","07/12/2022","2022-07-12","2022-07-12","2022-07-14",list()
"15657","Facilities Management","Facilities Management","04-06","Davis campus","04/05/2022","2022-04-05","2022-04-05","2022-04-06",list()
"15658","Facilities Management","Facilities Management","04-06","Davis campus","04/05/2022","2022-04-05","2022-04-05","2022-04-06",list()
"15659","Facilities Management","Facilities Management","04-06","Davis campus","04/05/2022","2022-04-05","2022-04-05","2022-04-06",list()
"15660","Facilities Management","Facilities Management","10-28","Davis campus","10/26/2022
 - 10/27/2022","2022-10-26","2022-10-27","2022-10-28",list()
"15661","Facilities Management","Facilities Management","04-29","Davis campus","04/26/2022
 - 04/28/2022","2022-04-26","2022-04-28","2022-04-29",list()
"15662","Facilities Management","Facilities Management","04-29","Davis campus","04/26/2022
 - 04/28/2022","2022-04-26","2022-04-28","2022-04-29",list()
"15663","Facilities Management","Facilities Management","04-29","Davis campus","04/26/2022
 - 04/28/2022","2022-04-26","2022-04-28","2022-04-29",list()
"15664","Facilities Management","Facilities Management","10-28","Davis campus","10/26/2022
 - 10/27/2022","2022-10-26","2022-10-27","2022-10-28",list()
"15665","Facilities Management","Facilities Management","10-28","Davis campus","10/26/2022
 - 10/27/2022","2022-10-26","2022-10-27","2022-10-28",list()
"15666","Facilities Management Building","Facilities Management Building","06-07","Davis campus","06/07/2022","2022-06-07","2022-06-07","2022-06-07",list()
"15667","Facilities Management Building","Facilities Management Building","06-01","Davis campus","05/31/2022","2022-05-31","2022-05-31","2022-06-01",list()
"15668","Facilities Management Building","Facilities Management Building","06-07","Davis campus","06/07/2022","2022-06-07","2022-06-07","2022-06-07",list()
"15669","Facilities Management Building","Facilities Management Building","06-01","Davis campus","05/31/2022","2022-05-31","2022-05-31","2022-06-01",list()
"15670","Facilities Management Building","Facilities Management Building","06-07","Davis campus","06/07/2022","2022-06-07","2022-06-07","2022-06-07",list()
"15671","Facilities Management Building","Facilities Management Building","06-01","Davis campus","05/31/2022","2022-05-31","2022-05-31","2022-06-01",list()
"15672","Facilities Management Building","Facilities Management Building","06-28","Davis campus","06/27/2022","2022-06-27","2022-06-27","2022-06-28",list()
"15673","Facilities Management Building","Facilities Management Building","06-28","Davis campus","06/27/2022","2022-06-27","2022-06-27","2022-06-28",list()
"15674","Facilities Management Building","Facilities Management Building","06-28","Davis campus","06/27/2022","2022-06-27","2022-06-27","2022-06-28",list()
"15709","Facilities Services Building","Facilities Services Building","08-09","Davis campus","08/05/2022","2022-08-05","2022-08-05","2022-08-09",list()
"15710","Facilities Services Building","Facilities Services Building","08-09","Davis campus","08/05/2022","2022-08-05","2022-08-05","2022-08-09",list()
"15711","Facilities Services Building","Facilities Services Building","08-09","Davis campus","08/05/2022","2022-08-05","2022-08-05","2022-08-09",list()
"15712","Facilities Services Building","Facilities Services Building","10-26","Davis campus","10/24/2022","2022-10-24","2022-10-24","2022-10-26",list()
"15713","Facilities Services Building","Facilities Services Building","10-26","Davis campus","10/24/2022","2022-10-24","2022-10-24","2022-10-26",list()
"15714","Facilities Services Building","Facilities Services Building","10-26","Davis campus","10/24/2022","2022-10-24","2022-10-24","2022-10-26",list()
"15715","Facilities Services Building","Facilities Services Building","10-25","Davis campus","10/19/2022","2022-10-19","2022-10-19","2022-10-25",list()
"15716","Facilities Services Building","Facilities Services Building","10-25","Davis campus","10/19/2022","2022-10-19","2022-10-19","2022-10-25",list()
"15717","Facilities Services Building","Facilities Services Building","10-25","Davis campus","10/19/2022","2022-10-19","2022-10-19","2022-10-25",list()
"15839","Fish Conservation and Culture Laboratory (FCCL)","Fish Conservation and Culture Laboratory (FCCL)","06-28","Off campus","06/23/2022
 - 06/24/2022","2022-06-23","2022-06-24","2022-06-28",list()
"15840","Fleet Services","Fleet Services","09-29","Davis campus","09/23/2022","2022-09-23","2022-09-23","2022-09-29",list()
"15841","Fleet Services","Fleet Services","07-14","Davis campus","07/13/2022","2022-07-13","2022-07-13","2022-07-14",list()
"15842","Fleet Services","Fleet Services","07-14","Davis campus","07/13/2022","2022-07-13","2022-07-13","2022-07-14",list()
"15843","Fleet Services","Fleet Services","09-29","Davis campus","09/23/2022","2022-09-23","2022-09-23","2022-09-29",list()
"15845","Foundation Plant Services","Foundation Plant Services","05-23","Davis campus","05/20/2022","2022-05-20","2022-05-20","2022-05-23",list()
"15846","Freeborn Hall - Lower","Freeborn Hall - Lower","05-18","Davis campus","05/18/2022","2022-05-18","2022-05-18","2022-05-18",list()
"18606","Gladys Valley Hall","Gladys Valley Hall","05-19","Davis campus","05/18/2022","2022-05-18","2022-05-18","2022-05-19",list()
"18607","Gladys Valley Hall","Gladys Valley Hall","03-29","Davis campus","03/28/2022","2022-03-28","2022-03-28","2022-03-29",list()
"18608","Gladys Valley Hall","Gladys Valley Hall","03-29","Davis campus","03/28/2022","2022-03-28","2022-03-28","2022-03-29",list()
"18609","Gladys Valley Hall","Gladys Valley Hall","04-05","Davis campus","04/04/2022","2022-04-04","2022-04-04","2022-04-05",list()
"18610","Gladys Valley Hall","Gladys Valley Hall","05-19","Davis campus","05/18/2022","2022-05-18","2022-05-18","2022-05-19",list()
"18611","Gladys Valley Hall","Gladys Valley Hall","03-29","Davis campus","03/28/2022","2022-03-28","2022-03-28","2022-03-29",list()
"18612","Gladys Valley Hall","Gladys Valley Hall","03-29","Davis campus","03/28/2022","2022-03-28","2022-03-28","2022-03-29",list()
"18613","Gladys Valley Hall","Gladys Valley Hall","04-05","Davis campus","04/04/2022","2022-04-04","2022-04-04","2022-04-05",list()
"18614","Gladys Valley Hall","Gladys Valley Hall","05-19","Davis campus","05/18/2022","2022-05-18","2022-05-18","2022-05-19",list()
"18615","Gladys Valley Hall","Gladys Valley Hall","05-19","Davis campus","05/18/2022","2022-05-18","2022-05-18","2022-05-19",list()
"18616","Gladys Valley Hall","Gladys Valley Hall","04-05","Davis campus","04/04/2022","2022-04-04","2022-04-04","2022-04-05",list()
"18617","Gladys Valley Hall","Gladys Valley Hall","06-01","Davis campus","05/31/2022","2022-05-31","2022-05-31","2022-06-01",list()
"18618","Gladys Valley Hall","Gladys Valley Hall","04-05","Davis campus","04/04/2022","2022-04-04","2022-04-04","2022-04-05",list()
"18619","Gladys Valley Hall","Gladys Valley Hall","06-01","Davis campus","05/31/2022","2022-05-31","2022-05-31","2022-06-01",list()
"18620","Gladys Valley Hall","Gladys Valley Hall","06-01","Davis campus","05/31/2022","2022-05-31","2022-05-31","2022-06-01",list()
"18621","Gladys Valley Hall","Gladys Valley Hall","06-01","Davis campus","05/31/2022","2022-05-31","2022-05-31","2022-06-01",list()
"18659","Gourley Hall","Gourley Hall","05-09","Davis campus","05/05/2022","2022-05-05","2022-05-05","2022-05-09",list()
"18660","Government and Community Relations","Government and Community Relations","07-06","Off campus","07/05/2022","2022-07-05","2022-07-05","2022-07-06",list()
"18661","Granite Canyon Laboratory, Monterey, CA","Granite Canyon Laboratory, Monterey, CA","08-05","Off campus","07-25
 - 08-04","2021-07-25","2021-08-04","2021-08-05",list()
"18707","Grounds","Grounds","04-21","Davis campus","04/20/2022","2022-04-20","2022-04-20","2022-04-21",list()
"18708","Grounds and Landscape Services Office","Grounds and Landscape Services Office","10-13","Davis campus","10/10/2022","2022-10-10","2022-10-10","2022-10-13",list()
"18709","Grove Surge 3","Grove Surge 3","04-06","Davis campus","04/05/2022","2022-04-05","2022-04-05","2022-04-06",list()
"19669","Health Stadium","Health Stadium","06-13","Davis campus","06/10/2022
 - 06/11/2022","2022-06-10","2022-06-11","2022-06-13",list()
"19670","Health Stadium Press Box","Health Stadium Press Box","06-14","Davis campus","06/11/2022
 - 06/12/2022","2022-06-11","2022-06-12","2022-06-14",list()
"19671","Health Stadium Press Box","Health Stadium Press Box","06-20","Davis campus","06/11/2022","2022-06-11","2022-06-11","2022-06-20",list()
"19672","Health Stadium Press Box","Health Stadium Press Box","06-20","Davis campus","06/11/2022","2022-06-11","2022-06-11","2022-06-20",list()
"19673","Health Stadium Press Box","Health Stadium Press Box","06-14","Davis campus","06/11/2022
 - 06/12/2022","2022-06-11","2022-06-12","2022-06-14",list()
"26465","Hopkins Services Complex","Hopkins Services Complex","09-21","Davis campus","09/19/2022
 - 09/21/2022","2022-09-19","2022-09-21","2022-09-21",list()
"26466","Hopkins Services Complex","Hopkins Services Complex","09-21","Davis campus","09/19/2022
 - 09/21/2022","2022-09-19","2022-09-21","2022-09-21",list()
"26467","Hopkins Services Complex","Hopkins Services Complex","06-14","Davis campus","06/10/2022","2022-06-10","2022-06-10","2022-06-14",list()
"26468","Hopkins Services Complex","Hopkins Services Complex","06-14","Davis campus","06/10/2022","2022-06-10","2022-06-10","2022-06-14",list()
"27194","Hutchinson Hall","Hutchinson Hall","06-02","Davis campus","06/01/2022","2022-06-01","2022-06-01","2022-06-02",list()
"27195","Hutchinson Hall","Hutchinson Hall","05-25","Davis campus","05/24/2022","2022-05-24","2022-05-24","2022-05-25",list()
"27196","Hutchinson Hall","Hutchinson Hall","05-26","Davis campus","05/23/2022","2022-05-23","2022-05-23","2022-05-26",list()
"27197","Hutchinson Hall","Hutchinson Hall","06-02","Davis campus","06/01/2022","2022-06-01","2022-06-01","2022-06-02",list()
"27198","Hutchinson Hall","Hutchinson Hall","05-25","Davis campus","05/24/2022","2022-05-24","2022-05-24","2022-05-25",list()
"27199","Hutchinson Hall","Hutchinson Hall","06-02","Davis campus","06/01/2022","2022-06-01","2022-06-01","2022-06-02",list()
"27200","Hutchinson Hall","Hutchinson Hall","05-26","Davis campus","05/23/2022","2022-05-23","2022-05-23","2022-05-26",list()
"27201","Hutchinson Hall","Hutchinson Hall","05-26","Davis campus","05/23/2022","2022-05-23","2022-05-23","2022-05-26",list()
"27202","Hutchinson Hall","Hutchinson Hall","05-25","Davis campus","05/24/2022","2022-05-24","2022-05-24","2022-05-25",list()
"27460","IACUC Trailer","IACUC Trailer","08-17","Davis campus","08/16/2022","2022-08-16","2022-08-16","2022-08-17",list()
"27462","Imagining America Office","Imagining America Office","10-19","Davis campus","10/17/2022","2022-10-17","2022-10-17","2022-10-19",list()
"27463","Indio Hall","Indio Hall","05-23","Davis campus","05/23/2022","2022-05-23","2022-05-23","2022-05-23",list()
"27464","Institute of Transportation Studies","Institute of Transportation Studies","05-16","Davis campus","05/13/2022","2022-05-13","2022-05-13","2022-05-16",list()
"27465","Internal Audit Services","Internal Audit Services","08-16","Davis campus","08/15/2022","2022-08-15","2022-08-15","2022-08-16",list()
"27538","Jackson Hall","Jackson Hall","07-19","Davis campus","07/18/2022","2022-07-18","2022-07-18","2022-07-19",list()
"27539","Jackson Hall","Jackson Hall","04-18","Davis campus","04/14/2022","2022-04-14","2022-04-14","2022-04-18",list()
"27540","Jackson Hall","Jackson Hall","07-19","Davis campus","07/18/2022","2022-07-18","2022-07-18","2022-07-19",list()
"27541","Jackson Hall","Jackson Hall","04-18","Davis campus","04/14/2022","2022-04-14","2022-04-14","2022-04-18",list()
"28011","Kenneth L. Maddy Laboratory","Kenneth L. Maddy Laboratory","05-12","Davis campus","05/09/2022","2022-05-09","2022-05-09","2022-05-12",list()
"28012","Kenneth Maddy Lab","Kenneth Maddy Lab","06-06","Davis campus","06/03/2022","2022-06-03","2022-06-03","2022-06-06",list()
"32262","Latitude Market","Latitude Market","05-26","Davis campus","05/25/2022","2022-05-25","2022-05-25","2022-05-26",list()
"32263","LGBTQIA Resource Center","LGBTQIA Resource Center","04-21","Davis campus","04/20/2022","2022-04-20","2022-04-20","2022-04-21",list()
"32264","Life Sciences Building, 2163","Life Sciences Building, 2163","07-13","Davis campus","07/11/2022
 - 07/13/2022","2022-07-11","2022-07-13","2022-07-13",list()
"32266","Math Sciences Building","Math Sciences Building","08-11","Davis campus","08/10/2022","2022-08-10","2022-08-10","2022-08-11",list()
"32435","Meat Laboratory, Cole Facility Building C","Meat Laboratory, Cole Facility Building C","06-03","Davis campus","06/01/2022","2022-06-01","2022-06-01","2022-06-03",list()
"32449","Medical Sciences 1 C","Medical Sciences 1 C","04-19","Davis campus","04/18/2022","2022-04-18","2022-04-18","2022-04-19",list()
"38966","Memorial Union Coffee House","Memorial Union Coffee House","10-06","Davis campus","10/04/2022","2022-10-04","2022-10-04","2022-10-06",list()
"38967","Memorial Union Games","Memorial Union Games","04-25","Davis campus","04/21/2022","2022-04-21","2022-04-21","2022-04-25",list()
"40413","MIND Institute","MIND Institute","04-06","Davis city","04/04/2022","2022-04-04","2022-04-04","2022-04-06",list()
"40414","Mondavi Institute","Mondavi Institute","09-14","Davis campus","09/11/2022","2022-09-11","2022-09-11","2022-09-14",list()
"40671","Multi-Purpose Teaching","Multi-Purpose Teaching","06-02","Davis campus","05/31/2022","2022-05-31","2022-05-31","2022-06-02",list()
"48721","One Capitol Mall, Sacramento","One Capitol Mall, Sacramento","07-20","Off campus","07/19/2022","2022-07-19","2022-07-19","2022-07-20",list()
"48726","Peter A. Shields Library","Peter A. Shields Library","05-04","Davis campus","05/02/2022","2022-05-02","2022-05-02","2022-05-04",list()
"48727","Peter A. Shields Library","Peter A. Shields Library","05-04","Davis campus","05/02/2022","2022-05-02","2022-05-02","2022-05-04",list()
"48728","Peter A. Shields Library","Peter A. Shields Library","05-04","Davis campus","05/02/2022","2022-05-02","2022-05-02","2022-05-04",list()
"48729","Peter A. Shields Library","Peter A. Shields Library","05-04","Davis campus","05/02/2022","2022-05-02","2022-05-02","2022-05-04",list()
"48730","Peter A. Shields Library","Peter A. Shields Library","02-28","Davis campus","02/24/2022","2022-02-24","2022-02-24","2022-02-28",list()
"48731","Peter A. Shields Library","Peter A. Shields Library","05-03","Davis campus","05/02/2022","2022-05-02","2022-05-02","2022-05-03",list()
"48732","Peter A. Shields Library","Peter A. Shields Library","05-02","Davis campus","04/26/2022
 - 04/27/2022","2022-04-26","2022-04-27","2022-05-02",list()
"48733","Peter A. Shields Library","Peter A. Shields Library","05-02","Davis campus","04/26/2022
 - 04/27/2022","2022-04-26","2022-04-27","2022-05-02",list()
"48734","Peter A. Shields Library","Peter A. Shields Library","05-02","Davis campus","04/26/2022
 - 04/27/2022","2022-04-26","2022-04-27","2022-05-02",list()
"48735","Peter A. Shields Library","Peter A. Shields Library","05-02","Davis campus","04/26/2022
 - 04/27/2022","2022-04-26","2022-04-27","2022-05-02",list()
"48736","Peter A. Shields Library","Peter A. Shields Library","02-28","Davis campus","02/24/2022","2022-02-24","2022-02-24","2022-02-28",list()
"48737","Peter A. Shields Library","Peter A. Shields Library","02-28","Davis campus","02/24/2022","2022-02-24","2022-02-24","2022-02-28",list()
"48738","Peter A. Shields Library","Peter A. Shields Library","02-28","Davis campus","02/24/2022","2022-02-24","2022-02-24","2022-02-28",list()
"48739","Peter A. Shields Library","Peter A. Shields Library","05-03","Davis campus","05/02/2022","2022-05-02","2022-05-02","2022-05-03",list()
"48740","Peter A. Shields Library","Peter A. Shields Library","05-03","Davis campus","05/02/2022","2022-05-02","2022-05-02","2022-05-03",list()
"48741","Peter A. Shields Library","Peter A. Shields Library","05-03","Davis campus","05/02/2022","2022-05-02","2022-05-02","2022-05-03",list()
"49364","Plant and Environmental Sciences Building","Plant and Environmental Sciences Building","05-24","Davis campus","05/19/2022","2022-05-19","2022-05-19","2022-05-24",list()
"49365","Plant Reproductive Biology","Plant Reproductive Biology","09-02","Davis campus","09/01/2022","2022-09-01","2022-09-01","2022-09-02",list()
"49366","Plant Reproductive Biology","Plant Reproductive Biology","09-02","Davis campus","09/01/2022","2022-09-01","2022-09-01","2022-09-02",list()
"49367","Plant Reproductive Biology","Plant Reproductive Biology","07-12","Davis campus","07/07/2022","2022-07-07","2022-07-07","2022-07-12",list()
"49368","Plant Reproductive Biology","Plant Reproductive Biology","09-02","Davis campus","09/01/2022","2022-09-01","2022-09-01","2022-09-02",list()
"49369","Plant Reproductive Biology","Plant Reproductive Biology","07-12","Davis campus","07/07/2022","2022-07-07","2022-07-07","2022-07-12",list()
"49370","Plant Reproductive Biology","Plant Reproductive Biology","07-12","Davis campus","07/07/2022","2022-07-07","2022-07-07","2022-07-12",list()
"49371","Plant Reproductive Biology","Plant Reproductive Biology","06-24","Davis campus","06/23/2022","2022-06-23","2022-06-23","2022-06-24",list()
"49372","Plant Reproductive Biology","Plant Reproductive Biology","06-24","Davis campus","06/23/2022","2022-06-23","2022-06-23","2022-06-24",list()
"49373","Plant Reproductive Biology","Plant Reproductive Biology","06-24","Davis campus","06/23/2022","2022-06-23","2022-06-23","2022-06-24",list()
"49376","Police Annex","Police Annex","09-29","Davis campus","09/28/2022","2022-09-28","2022-09-28","2022-09-29",list()
"51418","Primero Grove","Primero Grove","06-20","Davis campus","06/12/2022
 - 06/14/2022","2022-06-12","2022-06-14","2022-06-20",list()
"54035","Rec Pool / Recreation Pool","Rec Pool / Recreation Pool","09-13","Davis campus","09/13/2022","2022-09-13","2022-09-13","2022-09-13",list()
"54036","Rec Pool / Recreation Pool","Rec Pool / Recreation Pool","09-13","Davis campus","09/13/2022","2022-09-13","2022-09-13","2022-09-13",list()
"54037","Rec Pool / Recreation Pool","Rec Pool / Recreation Pool","09-15","Davis campus","09/13/2022","2022-09-13","2022-09-13","2022-09-15",list()
"54038","Rec Pool / Recreation Pool","Rec Pool / Recreation Pool","09-15","Davis campus","09/13/2022","2022-09-13","2022-09-13","2022-09-15",list()
"54069","Regan Hall","Regan Hall","10-20","Davis campus","10/17/2022","2022-10-17","2022-10-17","2022-10-20",list()
"54081","Repro Graphics (West Sacramento)","Repro Graphics (West Sacramento)","04-13","Off campus","04/11/2022","2022-04-11","2022-04-11","2022-04-13",list()
"54082","Research Park","Research Park","05-19","Davis city","05/16/2022","2022-05-16","2022-05-16","2022-05-19",list()
"54174","Robert Mondavi Center","Robert Mondavi Center","05-18","Davis campus","05/17/2022","2022-05-17","2022-05-17","2022-05-18",list()
"54175","Robert Mondavi Institute","Robert Mondavi Institute","05-09","Davis campus","05/08/2022","2022-05-08","2022-05-08","2022-05-09",list()
"54176","Robert Mondavi Institute","Robert Mondavi Institute","09-07","Davis campus","09/06/2022","2022-09-06","2022-09-06","2022-09-07",list()
"54177","Robert Mondavi Institute","Robert Mondavi Institute","05-09","Davis campus","05/08/2022","2022-05-08","2022-05-08","2022-05-09",list()
"54178","Robert Mondavi Institute","Robert Mondavi Institute","09-07","Davis campus","09/06/2022","2022-09-06","2022-09-06","2022-09-07",list()
"54179","Robert Mondavi Institute - North","Robert Mondavi Institute - North","08-19","Davis campus","08/19/2022","2022-08-19","2022-08-19","2022-08-19",list()
"54180","Robert Mondavi Institute - North","Robert Mondavi Institute - North","08-19","Davis campus","08/19/2022","2022-08-19","2022-08-19","2022-08-19",list()
"54181","Robert Mondavi Institute - North","Robert Mondavi Institute - North","11-01","Davis campus","10/31/2022","2022-10-31","2022-10-31","2022-11-01",list()
"54182","Robert Mondavi Institute - North","Robert Mondavi Institute - North","11-01","Davis campus","10/31/2022","2022-10-31","2022-10-31","2022-11-01",list()
"54183","Robert Mondavi Institute for Wine & Food Science","Robert Mondavi Institute for Wine & Food Science","10-03","Davis campus","09/27/2022
 - 09/29/2022","2022-09-27","2022-09-29","2022-10-03",list()
"54184","Robert Mondavi Institute for Wine & Food Science","Robert Mondavi Institute for Wine & Food Science","10-03","Davis campus","10/27/2022
 - 10/29/2022","2022-10-27","2022-10-29","2022-10-03",list()
"54185","Robert Mondavi Institute for Wine & Food Science","Robert Mondavi Institute for Wine & Food Science","10-03","Davis campus","10/27/2022
 - 10/29/2022","2022-10-27","2022-10-29","2022-10-03",list()
"54186","Robert Mondavi Institute for Wine & Food Science","Robert Mondavi Institute for Wine & Food Science","10-03","Davis campus","09/27/2022
 - 09/29/2022","2022-09-27","2022-09-29","2022-10-03",list()
"54187","Robert Mondavi Institute Lab","Robert Mondavi Institute Lab","04-22","Davis campus","04/20/2022
 - 04/21/2022","2022-04-20","2022-04-21","2022-04-22",list()
"54188","Robert Mondavi Institute Sensory","Robert Mondavi Institute Sensory","07-05","Davis campus","06/28/2022","2022-06-28","2022-06-28","2022-07-05",list()
"54722","Roessler Hall - Lecture","Roessler Hall - Lecture","05-18","Davis campus","05/17/2022","2022-05-17","2022-05-17","2022-05-18",list()
"54723","Russell Field","Russell Field","05-16","Davis campus","05/11/2022","2022-05-11","2022-05-11","2022-05-16",list()
"54733","Sage St. Market","Sage St. Market","06-06","Davis campus","06/04/2022","2022-06-04","2022-06-04","2022-06-06",list()
"54734","San Bernardino Lab","San Bernardino Lab","01-12","Off campus","01-05
 - 01-07","2021-01-05","2021-01-07","2021-01-12",list()
"54735","San Bernardino Lab","San Bernardino Lab","01-12","Off campus","01-05
 - 01-07","2021-01-05","2021-01-07","2021-01-12",list()
"54736","San Bernardino Lab","San Bernardino Lab","01-25","Off campus","01-20
 - 01-21","2021-01-20","2021-01-21","2021-01-25",list()
"54737","San Bernardino Lab","San Bernardino Lab","01-25","Off campus","01-20
 - 01-21","2021-01-20","2021-01-21","2021-01-25",list()
"55154","Science Lab Building","Science Lab Building","06-01","Davis campus","05/31/2022","2022-05-31","2022-05-31","2022-06-01",list()
"59044","Sciences Laboratory Building","Sciences Laboratory Building","07-07","Davis campus","07/05/2022","2022-07-05","2022-07-05","2022-07-07",list()
"59045","Sciences Laboratory Building","Sciences Laboratory Building","05-24","Davis campus","05/20/2022","2022-05-20","2022-05-20","2022-05-24",list()
"59046","Sciences Laboratory Building","Sciences Laboratory Building","07-07","Davis campus","07/05/2022","2022-07-05","2022-07-05","2022-07-07",list()
"59047","Sciences Laboratory Building","Sciences Laboratory Building","05-23","Davis campus","05/18/2022","2022-05-18","2022-05-18","2022-05-23",list()
"59048","Sciences Laboratory Building","Sciences Laboratory Building","07-07","Davis campus","07/05/2022","2022-07-05","2022-07-05","2022-07-07",list()
"59049","Sciences Laboratory Building","Sciences Laboratory Building","05-23","Davis campus","05/18/2022","2022-05-18","2022-05-18","2022-05-23",list()
"59050","Sciences Laboratory Building","Sciences Laboratory Building","05-23","Davis campus","05/18/2022","2022-05-18","2022-05-18","2022-05-23",list()
"59051","Sciences Laboratory Building","Sciences Laboratory Building","05-24","Davis campus","05/20/2022","2022-05-20","2022-05-20","2022-05-24",list()
"59052","Sciences Laboratory Building","Sciences Laboratory Building","05-24","Davis campus","05/20/2022","2022-05-20","2022-05-20","2022-05-24",list()
"59053","Scrub Oak Hall (Auditorium)","Scrub Oak Hall (Auditorium)","05-03","Davis campus","05/02/2022","2022-05-02","2022-05-02","2022-05-03",list()
"59075","Scrubs Caf","Scrubs Caf","07-19","Davis campus","07/12/2022","2022-07-12","2022-07-12","2022-07-19",list()
"59076","Scrubs Caf","Scrubs Caf","07-19","Davis campus","07/12/2022","2022-07-12","2022-07-12","2022-07-19",list()
"59077","Scrubs Caf","Scrubs Caf","06-23","Davis campus","06/21/2022","2022-06-21","2022-06-21","2022-06-23",list()
"59078","Scrubs Caf","Scrubs Caf","06-23","Davis campus","06/21/2022","2022-06-21","2022-06-21","2022-06-23",list()
"59079","Segundo","Segundo","07-05","Davis campus","06/27/2022
 - 06/29/2022","2022-06-27","2022-06-29","2022-07-05",list()
"59080","Segundo Area Service Desk","Segundo Area Service Desk","03-01","Davis campus","03/01/2022","2022-03-01","2022-03-01","2022-03-01",list()
"59099","Segundo Catering Services","Segundo Catering Services","09-28","Davis campus","09/22/2022","2022-09-22","2022-09-22","2022-09-28",list()
"68353","Segundo Dining Services","Segundo Dining Services","06-23","Davis campus","06/22/2022","2022-06-22","2022-06-22","2022-06-23",list()
"68354","Segundo Dining Services","Segundo Dining Services","06-23","Davis campus","06/22/2022","2022-06-22","2022-06-22","2022-06-23",list()
"68355","Segundo Dining Services","Segundo Dining Services","08-05","Davis campus","08/04/2022","2022-08-04","2022-08-04","2022-08-05",list()
"68356","Segundo Dining Services","Segundo Dining Services","08-05","Davis campus","08/04/2022","2022-08-04","2022-08-04","2022-08-05",list()
"69409","Segundo Service Center","Segundo Service Center","03-11","Davis campus","03/08/2022","2022-03-08","2022-03-08","2022-03-11",list()
"69410","Segundo Service Desk","Segundo Service Desk","06-23","Davis campus","06/22/2022","2022-06-22","2022-06-22","2022-06-23",list()
"69578","Services for International Students and Scholars","Services for International Students and Scholars","06-13","Davis campus","06/06/2022","2022-06-06","2022-06-06","2022-06-13",list()
"69579","Shasta Building","Shasta Building","08-12","Davis campus","08/09/2022","2022-08-09","2022-08-09","2022-08-12",list()
"91144","Solano Park - Office","Solano Park - Office","05-17","Davis campus","05/16/2022","2022-05-16","2022-05-16","2022-05-17",list()
"91252","Stadium: Bruce Edwards Club Room","Stadium: Bruce Edwards Club Room","08-31","Davis campus","08/30/2022","2022-08-30","2022-08-30","2022-08-31",list()
"91253","Stadium: Bruce Edwards Club Room","Stadium: Bruce Edwards Club Room","09-02","Davis campus","08/31/2022","2022-08-31","2022-08-31","2022-09-02",list()
"91254","Stadium: Bruce Edwards Club Room","Stadium: Bruce Edwards Club Room","08-31","Davis campus","08/30/2022","2022-08-30","2022-08-30","2022-08-31",list()
"91255","Stadium: Bruce Edwards Club Room","Stadium: Bruce Edwards Club Room","09-02","Davis campus","08/31/2022","2022-08-31","2022-08-31","2022-09-02",list()
"92343","Student Community Center Coffee House","Student Community Center Coffee House","04-15","Davis campus","04/12/2022","2022-04-12","2022-04-12","2022-04-15",list()
"92345","Student Health & Counseling Services","Student Health & Counseling Services","07-12","Davis campus","07/06/2022
 - 07/07/2022","2022-07-06","2022-07-07","2022-07-12",list()
"92346","Student Health & Counseling Services","Student Health & Counseling Services","05-31","Davis campus","05/23/2022
 - 05/27/2022","2022-05-23","2022-05-27","2022-05-31",list()
"92347","Student Health & Counseling Services","Student Health & Counseling Services","07-12","Davis campus","07/06/2022
 - 07/07/2022","2022-07-06","2022-07-07","2022-07-12",list()
"92348","Student Health & Counseling Services","Student Health & Counseling Services","05-31","Davis campus","05/23/2022
 - 05/27/2022","2022-05-23","2022-05-27","2022-05-31",list()
"92594","Student Housing Administration Building","Student Housing Administration Building","08-18","Davis campus","08/16/2022","2022-08-16","2022-08-16","2022-08-18",list()
"92595","Student Housing Administration Building","Student Housing Administration Building","08-18","Davis campus","08/16/2022","2022-08-16","2022-08-16","2022-08-18",list()
"92596","Student Housing Administration Building","Student Housing Administration Building","10-03","Davis campus","10/28/2022
 - 10/29/2022","2022-10-28","2022-10-29","2022-10-03",list()
"92597","Student Housing Administration Building","Student Housing Administration Building","10-03","Davis campus","09/28/2022
 - 09/29/2022","2022-09-28","2022-09-29","2022-10-03",list()
"92598","Student Housing Administration Building","Student Housing Administration Building","08-18","Davis campus","08/16/2022","2022-08-16","2022-08-16","2022-08-18",list()
"92599","Student Housing Administration Building","Student Housing Administration Building","08-18","Davis campus","08/16/2022","2022-08-16","2022-08-16","2022-08-18",list()
"92600","Student Housing Administration Building","Student Housing Administration Building","10-03","Davis campus","10/28/2022
 - 10/29/2022","2022-10-28","2022-10-29","2022-10-03",list()
"92601","Student Housing Administration Building","Student Housing Administration Building","10-03","Davis campus","10/28/2022
 - 10/29/2022","2022-10-28","2022-10-29","2022-10-03",list()
"92602","Student Housing Administration Building","Student Housing Administration Building","10-03","Davis campus","10/28/2022
 - 10/29/2022","2022-10-28","2022-10-29","2022-10-03",list()
"92603","Student Housing Administration Building","Student Housing Administration Building","10-03","Davis campus","09/28/2022
 - 09/29/2022","2022-09-28","2022-09-29","2022-10-03",list()
"92604","Student Housing Administration Building","Student Housing Administration Building","10-03","Davis campus","09/28/2022
 - 09/29/2022","2022-09-28","2022-09-29","2022-10-03",list()
"92605","Student Housing Administration Building","Student Housing Administration Building","05-12","Davis campus","05/10/2022
 - 05/11/2022","2022-05-10","2022-05-11","2022-05-12",list()
"92606","Student Housing Administration Building","Student Housing Administration Building","05-12","Davis campus","05/10/2022
 - 05/11/2022","2022-05-10","2022-05-11","2022-05-12",list()
"92607","Student Housing Administration Building","Student Housing Administration Building","05-12","Davis campus","05/10/2022
 - 05/11/2022","2022-05-10","2022-05-11","2022-05-12",list()
"92608","Student Housing Administration Building","Student Housing Administration Building","05-12","Davis campus","05/10/2022
 - 05/11/2022","2022-05-10","2022-05-11","2022-05-12",list()
"92609","Student Housing Administration Building","Student Housing Administration Building","10-03","Davis campus","09/28/2022
 - 09/29/2022","2022-09-28","2022-09-29","2022-10-03",list()
"92610","Student Housing Office","Student Housing Office","10-12","Davis campus","10/10/2022","2022-10-10","2022-10-10","2022-10-12",list()
"92611","Student Recruitment & Retention Center","Student Recruitment & Retention Center","04-13","Davis campus","04/11/2022","2022-04-11","2022-04-11","2022-04-13",list()
"92612","Supply Chain Management","Supply Chain Management","02-18","Davis city","02/15/2022","2022-02-15","2022-02-15","2022-02-18",list()
"92617","Surge III","Surge III","06-21","Davis campus","06/17/2022","2022-06-17","2022-06-17","2022-06-21",list()
"92626","Tahoe Environmental Research Center","Tahoe Environmental Research Center","10-19","Off campus","10/13/2022
 - 10/14/2022","2022-10-13","2022-10-14","2022-10-19",list()
"92627","TANA arts facility, 1224 Lemen Av, Woodland","TANA arts facility, 1224 Lemen Av, Woodland","07-14","Off campus","07-11
 - 07-12","2021-07-11","2021-07-12","2021-07-14",list()
"92628","TB-1","TB-1","05-09","Davis campus","05/02/2022","2022-05-02","2022-05-02","2022-05-09",list()
"92629","Teaching & Learning Center","Teaching & Learning Center","05-27","Davis campus","05/26/2022","2022-05-26","2022-05-26","2022-05-27",list()
"92630","Teaching & Learning Center","Teaching & Learning Center","05-27","Davis campus","05/26/2022","2022-05-26","2022-05-26","2022-05-27",list()
"92631","Teaching & Learning Center","Teaching & Learning Center","05-20","Davis campus","05/19/2022","2022-05-19","2022-05-19","2022-05-20",list()
"92632","Teaching & Learning Center","Teaching & Learning Center","05-20","Davis campus","05/19/2022","2022-05-19","2022-05-19","2022-05-20",list()
"92633","Teaching & Research Animal Care Services","Teaching & Research Animal Care Services","09-16","Davis campus","09/13/2022","2022-09-13","2022-09-13","2022-09-16",list()
"92634","Teaching And Learning Center","Teaching And Learning Center","05-12","Davis campus","05/09/2022","2022-05-09","2022-05-09","2022-05-12",list()
"95815","Teaching and Research Animal Care Services","Teaching and Research Animal Care Services","10-11","Davis campus","10/10/2022","2022-10-10","2022-10-10","2022-10-11",list()
"95816","Teaching and Research Animal Care Services (TRACS)","Teaching and Research Animal Care Services (TRACS)","03-28","Davis campus","03/24/2022","2022-03-24","2022-03-24","2022-03-28",list()
"95817","Teaching Learning Complex","Teaching Learning Complex","09-22","Davis campus","09/21/2022","2022-09-21","2022-09-21","2022-09-22",list()
"96397","Tercero Commons","Tercero Commons","09-21","Davis campus","09/19/2022
 - 09/20/2022","2022-09-19","2022-09-20","2022-09-21",list()
"100756","Tercero Community Gardens","Tercero Community Gardens","04-25","Davis campus","04/24/2022","2022-04-24","2022-04-24","2022-04-25",list()
"100757","Tercero Dining Services","Tercero Dining Services","04-11","Davis campus","04/07/2022","2022-04-07","2022-04-07","2022-04-11",list()
"101058","Tercero Service Center","Tercero Service Center","08-04","Davis campus","07/28/2022","2022-07-28","2022-07-28","2022-08-04",list()
"101059","Tercero Service Center","Tercero Service Center","08-10","Davis campus","08/08/2022","2022-08-08","2022-08-08","2022-08-10",list()
"101060","Tercero Service Center","Tercero Service Center","08-04","Davis campus","07/28/2022","2022-07-28","2022-07-28","2022-08-04",list()
"101061","Tercero Service Center","Tercero Service Center","08-10","Davis campus","08/08/2022","2022-08-08","2022-08-08","2022-08-10",list()
"101111","TES Building","TES Building","06-13","Davis campus","06/06/2022","2022-06-06","2022-06-06","2022-06-13",list()
"101347","The Learning Center","The Learning Center","04-08","Davis campus","04/07/2022","2022-04-07","2022-04-07","2022-04-08",list()
"101348","The Learning Center","The Learning Center","04-07","Davis campus","04/05/2022","2022-04-05","2022-04-05","2022-04-07",list()
"101349","The Learning Center","The Learning Center","04-07","Davis campus","04/05/2022","2022-04-05","2022-04-05","2022-04-07",list()
"101350","The Learning Center","The Learning Center","04-08","Davis campus","04/07/2022","2022-04-07","2022-04-07","2022-04-08",list()
"101376","Thurman Hall","Thurman Hall","05-23","Davis campus","05/20/2022","2022-05-20","2022-05-20","2022-05-23",list()
"101377","Thurman Hall","Thurman Hall","05-23","Davis campus","05/20/2022","2022-05-20","2022-05-20","2022-05-23",list()
"101378","Thurman Hall","Thurman Hall","06-07","Davis campus","06/06/2022","2022-06-06","2022-06-06","2022-06-07",list()
"101379","Thurman Hall","Thurman Hall","06-07","Davis campus","06/06/2022","2022-06-06","2022-06-06","2022-06-07",list()
"101397","Ticon II","Ticon II","01-12","Off campus","01/04/2022","2022-01-04","2022-01-04","2022-01-12",list()
"101458","Transportation & Parking Services","Transportation & Parking Services","05-27","Davis campus","05/24/2022
 - 05/26/2022","2022-05-24","2022-05-26","2022-05-27",list()
"101484","Transportation Services Heavy Equipment","Transportation Services Heavy Equipment","06-14","Davis campus","06/13/2022","2022-06-13","2022-06-13","2022-06-14",list()
"101485","Tulare Lab","Tulare Lab","01-12","Off campus","01-03
 - 01-05","2021-01-03","2021-01-05","2021-01-12",list()
"103511","UC Center Sacramento","UC Center Sacramento","07-22","Off campus","07/20/2022","2022-07-20","2022-07-20","2022-07-22",list()
"103512","UC Davis Bodega Marine Laboratory","UC Davis Bodega Marine Laboratory","07-25","Off campus","07/18/2022
 - 07/21/2022","2022-07-18","2022-07-21","2022-07-25",list()
"103563","UCU Center","UCU Center","09-19","Davis campus","09/18/2022","2022-09-18","2022-09-18","2022-09-19",list()
"103564","Unitrans","Unitrans","04-25","Davis campus","04/20/2022","2022-04-20","2022-04-20","2022-04-25",list()
"103768","University Services Building/1441 Research Park","University Services Building/1441 Research Park","05-16","Davis city","05/12/2022","2022-05-12","2022-05-12","2022-05-16",list()
"103769","Upward Bound - Siskiyou Office","Upward Bound - Siskiyou Office","08-29","Off campus","08/26/2022","2022-08-26","2022-08-26","2022-08-29",list()
"104236","Vegetable Crop Greenhouse","Vegetable Crop Greenhouse","07-19","Davis campus","07/18/2022","2022-07-18","2022-07-18","2022-07-19",list()
"104406","Vet Med-Tulare","Vet Med-Tulare","29-Sep","Off campus","09-24
 - 09-26","2021-09-24","2021-09-26","2021-09-29",list()
"104854","Vet Med 3A - MPT","Vet Med 3A - MPT","04-05","Davis campus","04/04/2022","2022-04-04","2022-04-04","2022-04-05",list()
"104855","Vet Med 3A - MPT","Vet Med 3A - MPT","03-11","Davis campus","03/07/2022","2022-03-07","2022-03-07","2022-03-11",list()
"104856","Vet Med 3A - MPT","Vet Med 3A - MPT","04-05","Davis campus","04/04/2022","2022-04-04","2022-04-04","2022-04-05",list()
"104857","Vet Med 3A - MPT","Vet Med 3A - MPT","03-11","Davis campus","03/07/2022","2022-03-07","2022-03-07","2022-03-11",list()
"105054","Vet Med Multi-Purpose Teaching Facility","Vet Med Multi-Purpose Teaching Facility","05-19","Davis campus","05/17/2022","2022-05-17","2022-05-17","2022-05-19",list()
"105056","Vet Med Teaching & Research Center, Tulare","Vet Med Teaching & Research Center, Tulare","02-07","Off campus","02/04/2022
 - 02/05/2022","2022-02-04","2022-02-05","2022-02-07",list()
"105057","Vet Met 2","Vet Met 2","06-23","Davis campus","06/21/2022","2022-06-21","2022-06-21","2022-06-23",list()
"105058","Vet Met Teaching Hospital","Vet Met Teaching Hospital","07-05","Davis campus","06/28/2022
 - 06/29/2022","2022-06-28","2022-06-29","2022-07-05",list()
"105059","Veterinary Genetics Lab","Veterinary Genetics Lab","05-11","Davis campus","05/09/2022","2022-05-09","2022-05-09","2022-05-11",list()
"105060","Veterinary Genetics Lab","Veterinary Genetics Lab","06-28","Davis campus","06/24/2022","2022-06-24","2022-06-24","2022-06-28",list()
"105061","Veterinary Genetics Lab","Veterinary Genetics Lab","05-11","Davis campus","05/09/2022","2022-05-09","2022-05-09","2022-05-11",list()
"105062","Veterinary Genetics Lab","Veterinary Genetics Lab","06-28","Davis campus","06/24/2022","2022-06-24","2022-06-24","2022-06-28",list()
"105063","Veterinary Genetics Laboratory","Veterinary Genetics Laboratory","08-01","Davis campus","07/29/2022","2022-07-29","2022-07-29","2022-08-01",list()
"105156","Veterinary Medicine MPT","Veterinary Medicine MPT","03-31","Davis campus","03/29/2022
 - 03/30/2022","2022-03-29","2022-03-30","2022-03-31",list()
"105157","Veterinary Medicine Teaching Hospital","Veterinary Medicine Teaching Hospital","06-01","Davis campus","05/25/2022","2022-05-25","2022-05-25","2022-06-01",list()
"105158","Veterinary Medicine Teaching Hospital","Veterinary Medicine Teaching Hospital","06-01","Davis campus","05/25/2022","2022-05-25","2022-05-25","2022-06-01",list()
"105159","Veterinary Medicine Teaching Hospital","Veterinary Medicine Teaching Hospital","06-01","Davis campus","05/25/2022","2022-05-25","2022-05-25","2022-06-01",list()
"105160","Veterinary Medicine Teaching Hospital","Veterinary Medicine Teaching Hospital","06-02","Davis campus","05/31/2022","2022-05-31","2022-05-31","2022-06-02",list()
"105161","Veterinary Medicine Teaching Hospital","Veterinary Medicine Teaching Hospital","06-02","Davis campus","05/31/2022","2022-05-31","2022-05-31","2022-06-02",list()
"105162","Veterinary Medicine Teaching Hospital","Veterinary Medicine Teaching Hospital","06-02","Davis campus","05/31/2022","2022-05-31","2022-05-31","2022-06-02",list()
"105163","Veterinary Medicine Teaching Hospital","Veterinary Medicine Teaching Hospital","06-01","Davis campus","05/29/2022","2022-05-29","2022-05-29","2022-06-01",list()
"105164","Veterinary Medicine Teaching Hospital","Veterinary Medicine Teaching Hospital","06-01","Davis campus","05/29/2022","2022-05-29","2022-05-29","2022-06-01",list()
"105165","Veterinary Medicine Teaching Hospital","Veterinary Medicine Teaching Hospital","06-01","Davis campus","05/29/2022","2022-05-29","2022-05-29","2022-06-01",list()
"105166","Veterinary Medicine VM3A","Veterinary Medicine VM3A","03-31","Davis campus","03/30/2022","2022-03-30","2022-03-30","2022-03-31",list()
"105167","Veterinary Small Animal Clinic","Veterinary Small Animal Clinic","03-08","Davis campus","03/07/2022","2022-03-07","2022-03-07","2022-03-08",list()
"106611","Walter A. Robinson Welcome Center","Walter A. Robinson Welcome Center","10-26","Davis campus","10/24/2022","2022-10-24","2022-10-24","2022-10-26",list()
"106666","Wastewater Treatment Plant Building","Wastewater Treatment Plant Building","06-27","Davis campus","06/23/2022","2022-06-23","2022-06-23","2022-06-27",list()
"106670","Watershed Science Research Center","Watershed Science Research Center","08-03","Davis campus","07/30/2022","2022-07-30","2022-07-30","2022-08-03",list()
"106671","Watershed Sciences Research Center","Watershed Sciences Research Center","08-23","Davis campus","08/17/2022","2022-08-17","2022-08-17","2022-08-23",list()
"113074","West Village - 1715 Tilia Street","West Village - 1715 Tilia Street","08-17","Davis campus","08/15/2022","2022-08-15","2022-08-15","2022-08-17",list()
"113075","West Village 215 Sage Street","West Village 215 Sage Street","06-23","Davis campus","06/20/2022","2022-06-20","2022-06-20","2022-06-23",list()
"113076","West Village Square & Community College","West Village Square & Community College","09-06","Davis campus","09/03/2022","2022-09-03","2022-09-03","2022-09-06",list()
"113080","Western Cooling Efficiency Center","Western Cooling Efficiency Center","08-24","Davis campus","08/18/2022
 - 08/19/2022","2022-08-18","2022-08-19","2022-08-24",list()
"113344","Wyatt Pavilion Theatre","Wyatt Pavilion Theatre","03-11","Davis campus","03/09/2022","2022-03-09","2022-03-09","2022-03-11",list()
